"Organization Name","Last Funding Date","Total Funding Amount","Stage","Industries","Headquarters Location","Description","CB Rank (Company)","Website","Estimated Revenue Range","Top 5 Investors","Lead Investors"
"Plant Path","Mar 5, 2026","$27,655,000","Not Started","Agriculture, Biotechnology, Farming","Saint Louis Park, Minnesota, United States","Plant Path specializes in developing food and medical plant varieties to improve human health through nutrition.","10,586","https://plantpathco.com/","$1M to $10M","—","—"
"Zenniz","Feb 20, 2026","$8,170,978","Not Started","Software, Sports, Tennis","Helsinki, Southern Finland, Finland","Zenniz is an ITF approved game tracking solution that provides real-time information.","10,608","http://www.zenniz.com/","$1M to $10M","Seventure Partners, Superhero Capital, Butterfly Ventures, Miki Kuusi, Bromelia Capital","Butterfly Ventures, Superhero Capital"
"Koiviston Auto","Feb 23, 2026","€300,000,000","Not Started","Railroad","Lahti, Southern Finland, Finland","Koiviston Auto is the largest bus operating company in Finland.","10,649","https://www.koivistonauto.fi/","—","Siemens, Edmond de Rothschild Private Equity, LBP AM, Nord/LB, ABN AMRO Sustainable Impact Fund","—"
"Heritage Energy Holdings","Feb 23, 2026","$28,500,000","Not Started","CleanTech, Energy, Renewable Energy","Texas, South Carolina, United States","Heritage Energy Holdings offers both businesses and home owners the opportunity to purchase privately-owned systems.","10,700","https://heritageenergyholdings.com/","—","Eagle Point Credit Management","Eagle Point Credit Management"
"Ameren","Feb 23, 2026","$6,246,739,104","Not Started","Consulting, Consumer Electronics, Electrical Distribution, Energy, Information Technology, Oil and Gas, Solar","St Louis, Missouri, United States","Ameren is a delivery company that specializes in natural gas and electric distribution, as well as electric transmission services.","10,753","http://ameren.com/","$1B to $10B","—","—"
"CenterPoint Energy","Feb 23, 2026","$5,250,000,014","Not Started","Energy, Logistics, Natural Resources, Oil and Gas","Houston, Texas, United States","CenterPoint Energy is an energy delivery company with electric transmission and distribution, power generation and natural gas distribution.","10,804","http://centerpointenergy.com/","$1B to $10B","—","—"
"Clara Homes","Feb 23, 2026","$106,000,000","Not Started","Commercial Real Estate, Real Estate","Miami, Florida, United States","Clara Homes is a integrated real estate firm offering residential and commercial development, operations oversight and custom homes.","10,846","https://www.clarahomes.co/","$1M to $10M","Madison Realty Capital, Maxim Capital Group","Madison Realty Capital, Maxim Capital Group"
"MCQ Markets","Mar 3, 2026","$7,657,345","Not Started","Financial Services, FinTech, Marketplace","Miami, Florida, United States","MCQ Markets is reinventing luxury asset ownership by making exotic autos more accessible with its revolutionary fractional ownership model.","10,996","https://www.mcqmarkets.com/","Less than $1M","Sol Global Investments","Sol Global Investments"
"Sovereign Network Group","Feb 19, 2026","£500,000,000","Not Started","Home Services","Basingstoke, Hampshire, United Kingdom","Sovereign Network Group provides good, affordable homes the foundation for a better life.","11,041","https://www.sng.org.uk/","$500M to $1B","Barclays, NatWest, Lloyds Banking Group","Barclays, Lloyds Banking Group, NatWest"
"Immunic Therapeutics","Feb 13, 2026","$994,463,541","Not Started","Biotechnology, Life Science, Medical, Therapeutics","New York, New York, United States","Immunic is a biopharmaceutical company that develops a pipeline of selective oral immunology therapies.","11,044","https://www.imux.com/","—","RA Capital Management, HTGF (High-Tech Gruenderfonds), EQT Life Sciences, Vivo Capital, Omega Funds","Aberdeen Investments, Biotechnology Value Fund, EQT Life Sciences, Fund+, German Federal Ministry of Education and Research, LifeCare Partners, LSP BioVentures, Omega Funds"
"EmployIndy","Feb 24, 2026","$8,500,000","Not Started","Association, Financial Services, Non Profit","Indianapolis, Indiana, United States","Guiding Marion County's Workforce","11,099","https://employindy.org/","$10M to $50M","Salesforce, Lilly Endowment, StriveTogether, Richard M. Fairbanks Foundation","Lilly Endowment, Richard M. Fairbanks Foundation, Salesforce, StriveTogether"
"Beam Therapeutics","Feb 24, 2026","$1,289,000,000","Not Started","Biotechnology, Genetics, Medical, Therapeutics","Cambridge, Massachusetts, United States","Beam Therapeutics is a biotechnology company developing precision genetic medicines through the use of base editing technology.","11,131","https://beamtx.com/","—","Cormorant Asset Management, Sixth Street, ARCH Venture Partners, Perceptive Advisors, Omega Funds","ARCH Venture Partners, F-Prime, Sixth Street"
"Larimar Therapeutics","Feb 25, 2026","$721,680,000","Not Started","Biotechnology, Medical, Therapeutics","Bala Cynwyd, Pennsylvania, United States","Larimar Therapeutics is a clinical-stage biotechnology company focused on developing treatments for complex rare diseases.","11,180","https://larimartx.com/","—","RA Capital Management, Vivo Capital, Venrock, Adage Capital Management, Atlas Venture","Alta Partners, Atlas Venture, Third Rock Ventures"
"Sharp Therapeutics","Feb 27, 2026","$7,597,759","Not Started","Biotechnology, Life Science, Medical Device","Pittsburgh, Pennsylvania, United States","Sharp Therapeutics is engaged in the development of biosensors for cellular biology research and high-throughput screening.","11,255","https://sharptx.com/","Less than $1M","Innovation Works, Newlin Investment Company, STX PARTNERS, Brooks Family Office, Scott F. Sneddon","Newlin Investment Company, STX PARTNERS"
"Pinwheel Therapeutics","Feb 5, 2026","$20,000,000","Not Started","Biopharma, Medical","Stamford, Connecticut, United States","Pinwheel Therapeutics is a Connecticut-based clinical-stage biopharmaceutical company.","11,311","","—","108 BioCapital","108 BioCapital"
"Pregnolia","Feb 17, 2026","$10,622,374","Not Started","Intelligent Systems, Medical Device","Schlieren, Zurich, Switzerland","Pregnolia developed an innovative system to accurately assess the stiffness of the cervical tissue of pregnant and non-pregnant women.","11,321","https://en.pregnolia.com/","$1M to $10M","Verve Ventures, Zürcher Kantonal Bank, Redstone.VC, Venture Kick, European Innovation Council Fund","European Innovation Council Fund, Sanitas Health Insurance, Venture Kick, Verve Ventures"
"MECAWARE","Feb 17, 2026","€42,500,000","Not Started","Chemical","Bully, Rhone-Alpes, France","MECAWARE mission is to speed up strategic autonomy thanks to resource circularity and the intelligence of the material cycle.","11,423","https://mecaware.com/","—","Bpifrance, EIT InnoEnergy, UI Investissement, EIC Accelerator, KREAXI","EIC Accelerator"
"Antero - Utica Shale assets","Feb 20, 2026","$480,000,000","Not Started","Industrial, Infrastructure, Oil and Gas","Denver, Colorado, United States","Antero Utica Shale assets is a portfolio of oil and natural gas properties and infrastructure for well operations and production gathering.","11,483","https://www.anteroresources.com/operations/utica-shale","—","Northern Oil and Gas","—"
"Heliup","Mar 3, 2026","€26,000,000","Not Started","Manufacturing, Renewable Energy, Solar","Le Bourget-du-lac, Rhone-Alpes, France","Heliup is a company that creates and manufactures solar systems for huge building roofs.","11,522","https://www.heliup-solar.com/","$1M to $10M","Bpifrance, Supernova Invest, EIT InnoEnergy, Starquest Capital, Lita.co","Starquest Capital, Supernova Invest"
"Ashley Stewart","Feb 23, 2026","$15,000,000","Not Started","Fashion, Lifestyle, Women's","Edison, New Jersey, United States","Ashley Stewart is a global fashion brand that stands for uncompromising style, fashion, fit & empowerment for the woman","11,524","http://www.ashleystewart.com/","$100M to $500M","Clearlake Capital Group, Tiger Finance","Tiger Finance"
"Chiral","Feb 5, 2026","$15,966,798","Not Started","Manufacturing, Nanotechnology, Semiconductor, Sensor","Zürich, Zurich, Switzerland","Post-silicon computing with nanomaterials","11,580","https://www.chiralnano.com/","Less than $1M","Founderful, Quantonation, Crane Venture Partners, HCVC, Venture Kick","Crane Venture Partners, Founderful, HCVC, Venture Kick"
"Prosolia Energy","Feb 10, 2026","€380,000,000","Not Started","Energy, Renewable Energy, Sustainability","Paris, Ile-de-France, France","Prosolia Energy expertise in renewable energy and offers solutions on utilization of renewable energy sources instead of polluting sources.","11,629","https://prosoliaenergy.com/","$1M to $10M","Santander, Goldman Sachs, ABN AMRO Bank, Sumitomo Mitsui Banking Corporation","Sumitomo Mitsui Banking Corporation"
"Pursuit","Feb 11, 2026","$11,750,000","Not Started","Innovation Management, Non Profit, Social Impact","Long Island City, New York, United States","Pursuit is a social impact organization that creates economic transformation and opportunity.","11,635","https://www.pursuit.org/","$1M to $10M","Verizon, Google for Startups, Blackstone Group, Blue Earth Capital, Alexis Ohanian","Blue Earth Capital, Link Logistics Real Estate, Mizuho Americas"
"WESCO International","Feb 24, 2026","$4,028,000,000","Not Started","Commercial, Electronics, Manufacturing","Pittsburgh, Pennsylvania, United States","Wesco is a provider of business-to-business distribution, logistics services, and supply chain solutions.","11,640","http://www.wesco.com/","$10B+","Reference Capital SA","—"
"NEOGAP Therapeutics","Feb 11, 2026","$29,476,756","Not Started","Biotechnology, Health Care, Pharmaceutical","Stockholm, Stockholms Lan, Sweden","NEOGAP Therapeutics is a Pharmaceutical manufacturing industry.","11,769","https://neogap.se/","$10M to $50M","European Innovation Council, Sciety, Eurostars, 3T Invest, Sciety Venture Partners","European Innovation Council, Eurostars, Sciety, Sciety Venture Partners"
"Kilter Systems","Feb 20, 2026","$16,221,707","Not Started","Agriculture, AgTech, Farming","Viken, Troms, Norway","Kilter Systems is a developer of agricultural technology.","11,870","https://www.kiltersystems.com/","$1M to $10M","Pymwymic, Verdelis Investments, Natural Ventures, Nufarm, Kubota Corporation","Kubota Corporation, Nufarm, Pymwymic"
"EGI Battery","Mar 3, 2026","$10,000,000","Not Started","Battery, Manufacturing","Ann Arbor, Michigan, United States","EGI Battery manufactures batteries for autonomous systems, aviation, robotics, and mobility.","11,920","https://egibattery.com/","—","TSVC","TSVC"
"OXOlife","Feb 22, 2026","€10,000,000","Not Started","Biotechnology, Health Care, Medical","San Quírico Safaja, Catalonia, Spain","Oxolife is a biotechnology company in the clinical phase of development.","11,965","http://www.oxolife.com/","$1M to $10M","Inveready, Centre for the Development of Industrial Technology (CDTI), EIC Accelerator, Ministry of Science and Innovation of Spain, EIT Health","BStartup, EIC Accelerator, EIT Health, Inveready, Ministry of Science and Innovation of Spain"
"Frontier Rare Earths","Feb 5, 2026","$20,000,000","Not Started","Field Support, Mineral, Mining","Luxembourg, Luxembourg, Luxembourg","Frontier Rare Earths is a mineral exploration and development company that specializes in the development of rare earth elements.","12,009","https://frontierrareearths.com/","$1M to $10M","Industrial Development Corporation","Industrial Development Corporation"
"Scrap Management Industries","Mar 3, 2026","$120,000,000","Not Started","Environmental Engineering, Recycling, Waste Management","Kansas City, Missouri, United States","Scrap Management Industries is an environmental engineering company that offers scrap metal recycling services.","12,126","https://www.smirecyclers.com/","$1M to $10M","Eldridge","Eldridge"
"Kennedy Wilson","Feb 17, 2026","$1,003,367,114","Not Started","Finance, Financial Services, Real Estate","Beverly Hills, California, United States","Kennedy Wilson is a vertically integrated global real estate investment and services company.","12,182","http://kennedywilson.com/","$500M to $1B","KW Management Group, Eldridge Industries, Fairfax Financial Holdings, Allied Irish Banks","Allied Irish Banks, Eldridge Industries, Fairfax Financial Holdings"
"Shizuku AI","Feb 9, 2026","$15,000,000","Not Started","Artificial Intelligence (AI), Developer Tools, Mobile Devices, Productivity Tools","California, Pennsylvania, United States","Shizuku an open-source Android tool that enables apps to access elevated system APIs without rooting your device, typically via ADB setup.","12,217","https://shizuku.ai/","—","Andreessen Horowitz, DeNA","Andreessen Horowitz"
"Kaex","Feb 19, 2026","$13,112,364","Not Started","Consumer Goods, Fast-Moving Consumer Goods, Lifestyle, Medical, Personal Health, Sports","Zürich, Zurich, Switzerland","KAEX is a patent pending nutraceutical / otc pharmaceutical","12,236","https://kaex.ch/","$1M to $10M","Crowdcube, mediaforgrowth, SevenAccelerator, Artemon Capital","Artemon Capital, mediaforgrowth"
"IDT Biologika","Feb 26, 2026","€12,900,000","Not Started","Health Care, Manufacturing, Pharmaceutical","Dessau, Sachsen-Anhalt, Germany","IDT Biologika is a CDMO providing services for developing and manufacturing viral vaccines, cell and gene therapies, and other biologics.","12,259","https://idt-biologika.com/","$100M to $500M","European Health and Digital Executive Agency","European Health and Digital Executive Agency"
"Shuttle Pharmaceuticals","Mar 6, 2026","$25,412,500","Not Started","Biotechnology, Pharmaceutical, Therapeutics","Rockville, Maryland, United States","Shuttle Pharmaceuticals is a clinical-stage pharmaceutical company utilizing proprietary technology to develop novel therapies.","12,350","https://www.shuttlepharma.com/","$1M to $10M","—","—"
"Junior Achievement USA","Feb 18, 2026","$25,820,000","Not Started","Education, Non Profit","Colorado Springs, Colorado, United States","Junior Achievement USA is a education administration programs.","12,370","https://jausa.ja.org/","$10M to $50M","Charles Schwab Foundation, American Express, Lilly Endowment, Paychex Charitable Foundation","American Express, Charles Schwab Foundation, Lilly Endowment, Paychex Charitable Foundation"
"Andion","Feb 23, 2026","€67,000,000","Not Started","Clean Energy, Energy, Organic, Renewable Energy","Luxembourg, Luxembourg, Luxembourg","Andion Global is a platform for waste-to-renewable energy that creates biogas projects in all their forms.","12,577","https://andionch4.com/","—","Goldman Sachs Alternatives, Equitix","Equitix, Goldman Sachs Alternatives"
"Moleculin","Feb 19, 2026","$120,020,307","Not Started","Biotechnology, Medical, Pharmaceutical","Houston, Texas, United States","Moleculin is a pharmaceutical company developing dermatological products to treat skin disorders.","12,778","http://moleculin.com/","$1M to $10M","ROTH Capital Partners","ROTH Capital Partners"
"Ikos Advanced","Feb 25, 2026","€8,000,000","Not Started","Agriculture, AgTech, Farming","Adra, Andalucia, Spain","Ikos Advanced develops precision agriculture software and hardware like soil sensors, smart irrigation into the Ikos platform.","12,849","https://www.ikostech.es/cue","—","Impact Bridge","Impact Bridge"
"Devicare","Feb 9, 2026","$13,007,506","Not Started","Biotechnology, Digital Media, Health Care, Medical Device","Barcelona, Catalonia, Spain","Devicare is a biotech company developing medical treatments in Urology by combining innovative therapies with digital technologies","12,853","http://www.devicare.com/","$10M to $50M","Cofides, ICF Capital, Ship2B, Ona Capital Privat SCR SA, Avançsa","Avançsa, Cofides, EMESA Corporación Empresarial"
"Precision BioSciences","Mar 2, 2026","$342,400,000","Not Started","Biotechnology, Genetics, Health Care, Medical","Durham, North Carolina, United States","Precision BioSciences is a biotechnology company dedicated to improving life.","12,859","https://precisionbiosciences.com/","$10M to $50M","Franklin Templeton, RA Capital Management, Cormorant Asset Management, Vivo Capital, Janus Henderson Investors","ArrowMark Partners, TG Therapeutics, venBio Partners"
"ATRO Medical","Feb 24, 2026","€7,400,000","Not Started","Biotechnology, Health Care, Medical, Medical Device","Nijmegen, Gelderland, The Netherlands","Medical technology company developing a polymer meniscus implant.","12,898","http://atromedical.com/","$1M to $10M","Bolwork International Investment, European Innovation Council, Innovatiefonds Noord-Holland, Thuja Capital, BOM","European Innovation Council, Lumana Invest"
"Tidal Real Estate Partners","Feb 9, 2026","$371,500,000","Not Started","Commercial Real Estate, Property Development, Real Estate, Real Estate Investment","New City, New York, United States","Tidal Real Estate Partners is a real estate firm that offers property development and investment services.","12,920","https://tidalrep.com/","—","Madison Realty Capital, KSL Capital Partners","—"
"Gold.com","Feb 5, 2026","$150,000,000","Not Started","Precious Metals, Trading Platform","Santa Monica, California, United States","Gold.com is a global marketplace for integrated alternative assets that provides consumers, collector","13,041","https://www.gold.com/","$1B to $10B","Tether","Tether"
"A Crane Rental, LLC","Feb 10, 2026","$175,000,000","Not Started","Construction, Rental","Dravosburg, Pennsylvania, United States","A Crane Rental, LLC is a full-service crane rental and lifting services provider to the construction and industrial maintenance industries.","13,056","https://acraneusa.com/","$10M to $50M","InterVest Capital Partners, Wingspire Capital, Ares Commercial Finance","Ares Commercial Finance"
"Duos Technologies","Feb 26, 2026","$111,550,000","Not Started","Hardware, Homeland Security, Software","Jacksonville, Florida, United States","Duos Technologies provides intelligent video surveillance software featuring video analytics and physical security information.","13,059","http://duostechnologies.com/","$10M to $50M","—","—"
"AutoConnexa","Feb 24, 2026","€6,700,000","Not Started","Auto Insurance, Financial Services, Insurance, InsurTech","Bari, Puglia, Italy","Connexa InsTech is a digital and telematics insurance company solution offering unprecedented customer-centricity and flexibility.","13,086","https://autoconnexa.it/","$1M to $10M","MBSpeedUp, CDP Venture Capital, Lumen Ventures, Itas Mutua Assicurazioni, Doorway","—"
"Lytix Biopharma","Feb 10, 2026","$29,619,386","Not Started","Biotechnology, Health Care, Pharmaceutical","Tromsø, Troms, Norway","Lytix Biopharma is a pharmaceutical company specializing in anti-microbials and cancer therapeutics.","13,392","http://www.lytixbiopharma.com/","$1M to $10M","PrimaryBid, Norinnova Invest, Sparebanken Nord-Norge, SkatteFUNN, Norinnova Forvaltning","SkatteFUNN"
"Citius Pharmaceuticals","Feb 24, 2026","$204,700,000","Not Started","Biotechnology, Life Science, Medical, Therapeutics","Cranford, New Jersey, United States","Citius Pharmaceuticals is a biopharmaceutical company that develops and commercializes therapeutic products.","13,523","http://www.citiuspharma.com/","—","NJEDA, Leonard Mazur, Myron Holubiak","Leonard Mazur, Myron Holubiak, NJEDA"
"Freestyle Chess","Feb 17, 2026","€17,730,000","Not Started","Gaming","Wangels, Schleswig-Holstein, Germany","Freestyle Chess maintains the fundamental features of regular chess but adds a twist: the rear row is randomized.","13,627","https://www.freestyle-chess.com/","—","Left Lane Capital, FJ Labs, Robin Capital","—"
"GoodShape","Mar 5, 2026","£8,000,000","Not Started","Health Care","Watford, Hertford, United Kingdom","GoodShape provides services for the health and wellbeing of organizations' employees.","13,852","https://www.goodshape.com/","—","Growth Lending","Growth Lending"
"Rosy Soil","Feb 20, 2026","$8,600,000","Not Started","Agriculture, Home and Garden, Home Improvement","Greenwich, New York, United States","Rosy Soil makes the best houseplant soil with organic biochar compost. Our houseplant potting soil keeps indoor plants healthy and thriving.","13,902","https://rosysoil.com/","—","Draper Associates, Boost VC, Superorganism, AP Ventures, Climate Capital","AP Ventures"
"Pensieve","Feb 24, 2026","$6,970,000","Not Started","Artificial Intelligence (AI), Education, Training","San Francisco, California, United States","Pensieve is an AI educational platform that handles grading and provides feedback to colleges with lectures.","14,051","https://www.pensieve.co/","—","Reach Capital, Mayfield Fund, Anti Fund, a16z Scout Fund, Vela Partners","Mayfield Fund, WGU Labs"
"Broccoli","Feb 24, 2026","$23,692,704","Not Started","Agentic AI, Artificial Intelligence (AI), Customer Service","San Francisco, California, United States","Broccoli develops AI-powered voice agents designed for customer service operations in the trades industry.","14,101","https://www.broccoli.com/","—","—","—"
"Freemodel","Feb 27, 2026","$23,350,000","Not Started","Home Improvement","Burlingame, California, United States","Freemodel designs, manages, and pays up-front for pre-sales home renovations.","14,166","https://www.freemodel.com/","$1M to $10M","QED Investors, 1984 Ventures, FJ Labs, 1Sharpe Ventures, Crossbeam Venture Partners","QED Investors"
"TARGAN","Mar 3, 2026","$151,634,999","Not Started","Aquaculture, Biotechnology, Innovation Management, Life Science","Morrisville, North Carolina, United States","TARGAN is a bio-systems company focused on improving animal health and productivity in the poultry, livestock, and aquaculture industries.","14,218","https://www.targan.com/","$1M to $10M","National Science Foundation, Novaquest Capital Management, Oval Park Capital, Merck Animal Health, Mountain Group Capital","Merck Animal Health, Merck Animal Health Ventures, Mountain Group Capital, National Science Foundation, Novaquest Capital Management, Symbiotic Capital"
"GFP Real Estate","Feb 5, 2026","$205,000,000","Not Started","Leasing, Property Management, Real Estate","New York, New York, United States","GFP Real Estate specializes in real estate development, construction, acquisitions, leasing, assets, and property management services.","14,515","https://www.gfpre.com/","$1M to $10M","Customers Bank","Customers Bank"
"Iron Sheepdog","Feb 23, 2026","$14,214,225","Not Started","Apps, Construction, Finance, Software","Williamsburg, Virginia, United States","Iron Sheepdog is a technology solution that uses web-based technology and a mobile app to manage every aspect of short haul trucking.","14,522","https://www.ironsheepdog.com/","$1M to $10M","Grand Ventures, SJF Ventures, Supply Chain Ventures, ShockVentures","SJF Ventures"
"Sunoco LP","Feb 26, 2026","$7,350,000,000","Not Started","Fuel, Oil and Gas, Wholesale","Dallas, Texas, United States","Sunoco LP is a fuel distributor that supplies fuel to convenience stores, independent dealerships, commercial customers, and distributors.","14,584","https://www.sunocolp.com/","$10B+","—","—"
"Eco-inject","Feb 23, 2026","£5,200,000","Not Started","Manufacturing, Pharmaceutical, Product Design","Cambridge, Cambridgeshire, United Kingdom","Eco-inject designs and manufactures autoinjectors for pharmaceutical companies.","14,748","https://eco-inject.com/","—","Adjuvo","Adjuvo"
"Peregrine Turbine Technologies","Feb 26, 2026","$13,136,000","Not Started","Industrial Automation, Machinery Manufacturing, Manufacturing, Mechanical Engineering","Wiscasset, Maine, United States","Peregrine Turbine Technologies is a mechanical or industrial engineering company that develops revolutionary sCO2 power generation systems.","14,786","https://www.peregrineturbine.com/","$1M to $10M","Maine Technology Institute","Maine Technology Institute"
"Real Estate Business Analytics","Mar 4, 2026","$20,549,981","Not Started","Information Technology, Rental, Software","Littleton, Colorado, United States","Real Estate Business Analytics is a data analytics software company providing budgeting and forecasting applications.","14,917","https://www.getreba.com/","$1M to $10M","—","—"
"RenX Enterprises","Feb 13, 2026","$16,380,000","Not Started","Construction, Green Building, Real Estate","Miami, Florida, United States","RenX Enterprises is a real estate development company specializing in projects utilizing purpose-built, prefabricated modules.","14,950","https://www.sgdevco.com/","Less than $1M","Arena Investors","Arena Investors"
"n-Ink","Feb 17, 2026","€7,500,000","Not Started","Electronics, Internet of Things, Printing","Linköping, Ostergotlands Lan, Sweden","N-Ink provides n-type ink which is compatible with Printed Electronics, the Internet of Things, and Bioelectronics.","14,990","https://www.n-ink.com/","$1M to $10M","Voima Ventures, EIC Accelerator","EIC Accelerator, Voima Ventures"
"Kampaay","Feb 12, 2026","$13,313,896","Not Started","Catering, Enterprise Software, Event Management, Events, Marketplace, SaaS","Milano, Lombardia, Italy","Kampaay is the solution for Event Management: it simplifies and digitises the management and organisation of your corporate events","15,079","https://www.kampaay.com/","$1M to $10M","CDP Venture Capital, 360 Capital, Kairos Partners, Doorway, Azimut Digitech Fund","360 Capital, CDP Venture Capital, SG Company"
"BioSort","Feb 23, 2026","NOK100,000,000","Not Started","Consulting, Software","Fornebu, Akershus, Norway","BioSort provides health development and biometrics identification for optimization.","15,135","https://www.biosort.no/?lang=en","$1M to $10M","Ichthus Venture Capital, Hatch Blue Ltd, Farvatn Venture, Futurum Ventures, Grieg Kapital","—"
