Organization Name,CrunchBase URL,Last Funding Date,Total Funding Amount,Stage,Industries,Headquarters Location,Description,CB Rank (Company),Website,Estimated Revenue Range,Top 5 Investors,Lead Investors,Twitter,LinkedIn,Number of Employees,Last Funding Amount,Founded Date
Anam,https://www.crunchbase.com/organization/anam-09ab,"Jul 11, 2025","$11,300,000",Not Started,"Artificial Intelligence (AI), Developer APIs, Generative AI, Information Technology, Video","London, England, United Kingdom",Anam is the developer of real-time AI personas for brands to increase consumer interaction.,"12,529",https://www.anam.ai/,—,"SV Angel, Torch Capital, Redpoint, Concept Ventures, Mati Staniszewski","Concept Ventures, Redpoint",https://x.com/MeetAnamAI,https://www.linkedin.com/company/anam-ai,11-50,"$9,000,000",2023
Decile Group,https://www.crunchbase.com/organization/decile-group,"Jul 11, 2025","$14,000,000",Not Started,"Asset Management, Financial Services, FinTech","San Francisco, California, United States",Venture Capital & Private Equity Principals,"14,928",https://decilegroup.com/,—,"Draper Associates, Team Ignite Ventures, Geek Ventures, Javelin Venture Partners, Jolly VC","Draper Associates, Javelin Venture Partners",,https://www.linkedin.com/company/decilegroup/,11-50,"$14,000,000",2021
Traxys S.A.,https://www.crunchbase.com/organization/traxys-s-a,"Jul 11, 2025","$3,385,000,000",Not Started,"Business Development, Energy, Mining, Trading Platform","Luxembourg, Luxembourg, Luxembourg",Traxys S.A. provides financial and logistical solutions for mining and energy.,"17,500",http://www.traxys.com/,$10B+,—,—,,https://www.linkedin.com/company/traxys/,251-500,"$1,815,000,000",1919
Belong Health,https://www.crunchbase.com/organization/belong-health,"Jul 11, 2025","$96,999,998",Not Started,"Health Care, Hospital","Radnor, Pennsylvania, United States","Belong Health works with local health plans to provide regionally informed, humanistic care to a rapidly expanding community of need.","19,880",https://belong-health.com/,$10M to $50M,"Alumni Ventures, Maverick Ventures, New Enterprise Associates","Alumni Ventures, Maverick Ventures, New Enterprise Associates",,https://www.linkedin.com/company/belonghealth,51-100,"$56,999,998",2021
Nordisk Bergteknik,https://www.crunchbase.com/organization/nordisk-bergteknik,"Jul 11, 2025","SEK400,000,000",Not Started,"Construction, Infrastructure, Mining, Sustainability","Gothenburg, Vastra Gotaland, Sweden",Nordisk Bergteknik is a specialists within rock handling and foundation solutions.,"25,125",https://nordiskbergteknik.se/,$10M to $50M,"Nordea, Swedbank","Nordea, Swedbank",,https://www.linkedin.com/company/nordisk-bergteknik/,1001-5000,"SEK400,000,000",1965
General Reasoning,https://www.crunchbase.com/organization/general-reasoning,"Jul 11, 2025","$10,904,992",Not Started,"Artificial Intelligence (AI), Generative AI, SaaS, Software","San Francisco, California, United States",General Reasoning is building universal intelligence,"25,995",https://gr.inc/,—,—,—,https://x.com/GenReasoning,https://www.linkedin.com/company/general-reasoning/,1-10,"$10,904,992",2025
Guzman Energy,https://www.crunchbase.com/organization/guzman-energy,"Jul 11, 2025","$210,000,000",Not Started,"Electronics, Energy, Renewable Energy, Solar","Denver, Colorado, United States",Guzman Energy is a wholesale power provider and energy trading company.,"28,345",http://www.guzmanenergy.com/,$1M to $10M,"Vision Ridge Capital Partners, UMB Bank, Inbankshares, Zoma Capital, BciCapital",—,https://x.com/guzmanenergy,https://www.linkedin.com/company/guzman-financial-engineers/,51-100,"$80,000,000",2013
CityFibre,https://www.crunchbase.com/organization/cityfibre,"Jul 11, 2025","£8,935,000,000",Not Started,"Infrastructure, Network Hardware, Telecommunications","London, England, United Kingdom",CityFibre operates as an independent provider of fiber infrastructure in secondary cities.,"29,395",http://www.cityfibre.com/,$100M to $500M,"Antin Infrastructure Partners, Deutsche Bank, Mubadala, Societe Generale, ABN AMRO Bank","Interogo Holding AG, Mubadala, National Wealth Fund",https://x.com/CityFibre,http://www.linkedin.com/company/cityfibre,1001-5000,"£960,000,000",2011
Dextall,https://www.crunchbase.com/organization/dextall,"Jul 11, 2025","$18,045,000",Not Started,"Building Material, Construction, Manufacturing","Fairfax, Virginia, United States",Dextall is a building material technology company delivering prefabricated exteriors for mid and high-rise buildings.,"30,108",http://dextall.com/,$1M to $10M,"Winklevoss Capital, L+M Development Partners, Simpson Strong-Tie Company, Old Three Hundred Capital, Essence Development","Essence Development, L+M Development Partners, Old Three Hundred Capital, Simpson Strong-Tie Company",https://x.com/DextallTech,https://www.linkedin.com/company/dextall/,51-100,"$15,000,000",2020
Applied Underwriters,https://www.crunchbase.com/organization/applied-underwriters,"Jul 11, 2025","$150,000,000",Not Started,"Financial Services, Insurance","Omaha, Nebraska, United States",Applied Underwriters® is a global risk services firm that manages uncertainty through its business services and re/insurance solutions.,"42,437",https://www.auw.com/,$500M to $1B,Dolfin,Dolfin,https://x.com/applieduw,https://www.linkedin.com/company/19366,501-1000,"$150,000,000",1994
DL Invest Group,https://www.crunchbase.com/organization/dl-invest-group,"Jul 11, 2025","€405,500,000",Not Started,"Commercial, Industrial, Real Estate","Katowice, Slaskie, Poland","DL Invest Group is an investor and developer of logistics centers, office centers, and commercial parks.","51,264",https://dlinvest.pl/,—,"European Bank for Reconstruction and Development, Invesco, Macquarie Bank, Emira Property Fund",Emira Property Fund,https://x.com/dlinvestgroup,https://www.linkedin.com/company/dl-invest-group/,101-250,"€350,000,000",2009
Reprise Biomedical,https://www.crunchbase.com/organization/reprise-biomedical-inc,"Jul 11, 2025","$47,131,762",Not Started,"Biotechnology, Medical, Medical Device","Plymouth, Minnesota, United States",Reprise Biomedical focuses on the development and commercialization of biological medical devices.,"53,903",http://www.reprisebio.com/,Less than $1M,—,—,https://x.com/RepriseBio,https://www.linkedin.com/company/reprisebio/about/,11-50,"$6,356,956",2019
Miro Forestry & Timber Products,https://www.crunchbase.com/organization/miro-forestry-timber-products,"Jul 11, 2025","$60,210,000",Not Started,"Forestry, Manufacturing, Sustainability, Wood Processing","London, England, United Kingdom","Miro Forestry & Timber Products manufactures and delivers plywood, edge-glued panels, and wood poles for the industrial sector.","54,010",https://www.miroforestry.com/,$100M to $500M,"Mirova, Finnfund, FMO, British International Investment, FinDev Canada","FinDev Canada, Lagata",,https://www.linkedin.com/company/miro-forestry-and-timber-products,1001-5000,—,2009
Two,https://www.crunchbase.com/organization/two-inc,"Jul 11, 2025","€33,500,000",Not Started,"B2B, E-Commerce, Financial Services, FinTech, Payments","Oslo, Oslo, Norway","Two is a fintech startup that is building something akin to buy now, pay later for B2B purchases.","68,565",https://www.two.inc/,Less than $1M,"Sequoia Capital, Alumni Ventures, Antler, LocalGlobe, Shine Capital","Antler, Idekapital, Sequoia Capital, Shine Capital",https://x.com/Two_b2b,https://www.linkedin.com/company/two-b2b/,51-100,"€13,000,000",2020
Orlando Senior Health Network,https://www.crunchbase.com/organization/orlando-senior-health-network,"Jul 11, 2025","$25,000,000",Not Started,"Health Care, Home Health Care, Hospital","Orlando, Florida, United States","Orlando Senior Health Network is a nonprofit organization that offers senior living facilities, rehabilitation and home healthcare services.","74,391",https://orlandoseniorhealth.org/,$10M to $50M,Ziegler,Ziegler,https://x.com/lutherantowers,https://www.linkedin.com/company/orlando-senior-health-network/about/,501-1000,"$25,000,000",1978
re:cap,https://www.crunchbase.com/organization/re-cap,"Jul 11, 2025","$377,113,384",Not Started,"Financial Services, FinTech","Berlin, Berlin, Germany","re:cap is the Capital OS that seamlessly integrates debt funding, liquidity management, financial operations in one platform.","75,904",https://www.re-cap.com/,—,"Entrée Capital, HSBC Innovation Banking, Possible Ventures, Felix Capital, Project A Ventures","Avellinia Capital, Entrée Capital, Felix Capital, HSBC Innovation Banking, Mubadala Capital Ventures, Project A Ventures",https://x.com/recapnow,https://www.linkedin.com/company/recapnow,51-100,"€125,000,000",May 2021
Signet Real Estate,https://www.crunchbase.com/organization/signet-real-estate,"Jul 11, 2025","$102,000,000",Not Started,"Project Management, Property Development, Real Estate","Jacksonville, Florida, United States","Signet Real Estate specializes in property management, project management, asset management, and real estate development.","79,269",https://www.signetre.com/,$10M to $50M,—,—,,https://www.linkedin.com/company/signetre/,11-50,"$102,000,000",1995
Associated Danish Ports,https://www.crunchbase.com/organization/associated-danish-ports,"Jul 11, 2025","DKK700,000,000",Not Started,"Freight Service, Logistics, Supply Chain Management, Transportation","Fredericia, Syddanmark, Denmark","ADP manages ports in Fredericia and Nyborg, handling diverse cargo and supporting logistics.","80,152",https://www.adp-as.dk/,$1M to $10M,Brookfield Asset Management,Brookfield Asset Management,,https://www.linkedin.com/company/associated-danish-ports-a-s-adp,51-100,"DKK700,000,000",2000
Varus Supermarkets,https://www.crunchbase.com/organization/varus-supermarkets,"Jul 11, 2025","$25,000,000",Not Started,"Consumer Goods, Grocery, Retail","Dniprovka, Zaporiz'ka Oblast', Ukraine",Varus Supermarkets is a Ukrainian retail chain.,"99,606",https://varus.ua/,$100M to $500M,European Bank for Reconstruction and Development,European Bank for Reconstruction and Development,,https://www.linkedin.com/company/omega-ltd/,5001-10000,"$25,000,000",2003
PKO BP,https://www.crunchbase.com/organization/pko-bp,"Jul 11, 2025","€1,250,000,000",Not Started,"Banking, Finance, Financial Services","Warszawa, Mazowieckie, Poland",PKO BP operates as a commercial bank.,"135,046",https://www.pkobp.pl/,$1B to $10B,—,—,https://x.com/analizy_pkobp,https://www.linkedin.com/company/pko-bp,10001+,"€500,000,000",1919
Electrica,https://www.crunchbase.com/organization/societatea-energetica-electrica-sa,"Jul 11, 2025","€500,000,000",Not Started,"Electrical Distribution, Energy","Bucharest, Bucuresti, Romania",Electrica is a public utility company that distributes electricity and undertakes maintenance works.,"160,922",http://www.electrica.ro/,$100M to $500M,European Investment Bank,European Investment Bank,,https://www.linkedin.com/company/electrica,10001+,"€500,000,000",1990
Gemini,https://www.crunchbase.com/organization/gemini-99b2,"Jul 10, 2025","$499,903,059",Not Started,"Cryptocurrency, Finance, Financial Services, FinTech, Web3","New York, New York, United States",Gemini is a licensed digital asset exchange and custodian built for both individuals and institutions.,59,https://gemini.com/,$100M to $500M,"Ripple, K5 Global, VanEck, WndrCo, Pantera Capital","Draper Dragon, Morgan Creek Digital, Ripple",https://x.com/gemini,https://www.linkedin.com/company/geminitrust,501-1000,"$75,000,000",2014
Varda,https://www.crunchbase.com/organization/varda-ba64,"Jul 10, 2025","$328,025,000",Not Started,"Aerospace, Manufacturing, Product Design","El Segundo, California, United States",Varda is a space manufacturing startup that creates products in microgravity and retrieves them for terrestrial use.,853,http://varda.com/,—,"General Catalyst, Alumni Ventures, Khosla Ventures, Founders Fund, Lux Capital","Alumni Ventures, Caffeinated Capital, Founders Fund, Khosla Ventures, Lux Capital, Natural Capital, Shrug Capital",https://x.com/vardaspace,https://www.linkedin.com/company/varda-space-industries,101-250,"$187,000,000",Jan 2021
Bilt Rewards,https://www.crunchbase.com/organization/bilt-technologies,"Jul 10, 2025","$813,300,000",Not Started,"FinTech, Loyalty Programs, Real Estate, Rental Property","New York, New York, United States",Bilt Rewards is a payments and commerce network that allows users to earn points on rent and HOA payments.,"1,138",https://www.biltrewards.com/,$100M to $500M,"General Catalyst, Fifth Wall, Left Lane Capital, Wells Fargo, Vanderbilt University","General Catalyst, GID, Kairos HQ, Left Lane Capital, Teachers’ Venture Growth",https://x.com/BiltRewards,https://www.linkedin.com/company/biltrewards,101-250,"$250,000,000",Jun 2021
Boston Metal,https://www.crunchbase.com/organization/boston-metal,"Jul 10, 2025","$455,496,978",Not Started,"Building Material, CleanTech, Industrial Manufacturing, Manufacturing, Precious Metals","Woburn, Massachusetts, United States",Boston Metal is a metals production company that develops an electric-powered tech to decarbonize steelmaking and metal production.,"2,408",https://bostonmetal.com/,$1M to $10M,"International Finance Corporation, Aramco Ventures, Energy Impact Partners, Breakthrough Energy Ventures, Marunouchi Innovation Partners","ArcelorMittal, BloombergNEF, Breakthrough Energy Ventures, International Finance Corporation, Marunouchi Innovation Partners, National Science Foundation, Piva Capital, US Department of Energy",,https://www.linkedin.com/company/bostonmetal,251-500,"$51,000,000",2012
Tecovas,https://www.crunchbase.com/organization/tecovas-2,"Jul 10, 2025","$115,404,806",Not Started,"Direct Sales, E-Commerce, Fashion","Austin, Texas, United States",Tecovas is a direct-to-consumer western-wear company that sells cowboy boots.,"2,565",http://tecovas.com/,$100M to $500M,"Blue Collective, M13, Elephant, Plus Capital, Brian Spaly","Blue Collective, Brian Spaly, Elephant, Plus Capital, YETI Capital",https://x.com/tecovas,https://www.linkedin.com/company/tecovas,501-1000,"$9,999,990",2015
iCapital,https://www.crunchbase.com/organization/icapital-network,"Jul 10, 2025","$1,549,210,871",Not Started,"Asset Management, Banking, Financial Services, FinTech","New York, New York, United States",iCapital is a fintech platform for alternative investments and investors.,"3,454",https://icapital.com/,—,"Temasek Holdings, BlackRock, Apollo, Goldman Sachs, Golub Capital","Bank of America, BlackRock, Blackstone Group, Credit Suisse, JP Morgan Chase, Morgan Stanley Investment Management, Panorama Point Partners, Ping An Global Voyager, Pivot Investment Partners, SurgoCap Partners, Temasek Holdings, The Carlyle Group, T. Rowe Price, WestCap",https://x.com/icapitalnetwork,https://www.linkedin.com/company/icapital-network-inc,1001-5000,"$820,000,000",2013
Knox,https://www.crunchbase.com/organization/knox-10df,"Jul 10, 2025","$6,500,000",Not Started,"Computer, Cyber Security, Government, Public Safety","Austin, Texas, United States","Knox Systems providing security solutions, including access control and surveillance systems, to enhance safety and efficiency.","3,684",http://knoxsystems.com/,—,"Felicis, Ridgeline, FirsthandVC",Felicis,https://x.com/KnoxCloud,https://www.linkedin.com/company/knox-systems-inc/,1-10,"$6,500,000",2024
Spacelift,https://www.crunchbase.com/organization/spacelift,"Jul 10, 2025","$73,600,000",Not Started,"Cloud Data Services, Information Technology, SaaS, Software","Redwood City, California, United States","Spacelift is an infrastructure orchestration platform that manages provisioning, configuration, and governance workflows.","3,996",https://spacelift.io/,$1M to $10M,"Insight Partners, Endeavor Catalyst, Five Elms Capital, Inovo.vc, Blossom Capital","Blossom Capital, Five Elms Capital, Hoxton Ventures, Inovo.vc, Insight Partners",https://x.com/spaceliftio,https://www.linkedin.com/company/spacelift-io,101-250,"$51,000,000",2019
Akash Systems,https://www.crunchbase.com/organization/akash-systems,"Jul 10, 2025","$20,437,551",Not Started,"Aerospace, Information Technology, Manufacturing, Satellite Communication, Space Travel","San Francisco, California, United States",Akash Systems is focused on developing and supplying the next generation of communications gear for space satellites.,"7,030",https://akashsystems.com/,$10M to $50M,"Gaingels, Khosla Ventures, Founders Fund, Correlation Ventures, DCVC",Khosla Ventures,https://x.com/AkashSystems,https://www.linkedin.com/company/akash-systems-inc.,11-50,"$2,837,551",2016
Ionic Mineral Technologies,https://www.crunchbase.com/organization/ionic-mineral-technologies,"Jul 10, 2025","$29,000,000",Not Started,"Battery, Energy, Manufacturing","Provo, Utah, United States",Ionic Mineral Technologies is a nano-silicon anode powder producer that helps in charging speeds for lithium-ion batteries.,"8,478",https://ionicmt.com/,—,—,—,https://x.com/ionic_mt,https://www.linkedin.com/company/ionic-mineral-technologies/,11-50,"$29,000,000",2020
Landline,https://www.crunchbase.com/organization/landline,"Jul 10, 2025","$76,319,916",Not Started,"Logistics, Transportation, Travel","Hawthorne, California, United States",Landline provides a transportation service to make travel more accessible.,"8,512",https://landline.com/,$10M to $50M,"Drive Capital, Mucker Capital, Upfront Ventures, Bossa Invest, WndrCo","Drive Capital, Matchstick Ventures, Upfront Ventures",https://x.com/ridelandline,https://www.linkedin.com/company/landlineco/,51-100,"$2,650,823",Jun 2018
Vellum,https://www.crunchbase.com/organization/vellum-74f3,"Jul 10, 2025","$25,500,000",Not Started,"Artificial Intelligence (AI), Developer Platform, Information Technology, Software","New York, New York, United States",Vellum is a provider of an enterprise development platform for building mission-critical AI products.,"9,077",https://www.vellum.ai/,—,"Y Combinator, Pioneer Fund, TwentyTwo VC, Rebel Fund, Leaders Fund","Leaders Fund, Y Combinator",https://x.com/vellum_ai,https://www.linkedin.com/company/vellumai,11-50,"$20,000,000",2023
Aqtual,https://www.crunchbase.com/organization/aqtual,"Jul 10, 2025","$47,000,000",Not Started,"Biotechnology, Health Care, Machine Learning, Wellness","Hayward, California, United States","Aqtual is a biotechnology diagnostics platform that provides healthcare solutions, novel technology, and biochemistry for chronic disease.","10,292",https://aqtual.com/,$1M to $10M,"Genoa Ventures, Manta Ray Ventures, Bold Capital Partners, Yu Galaxy, BOLD Longevity Growth Fund","Genoa Ventures, Manta Ray Ventures, Yu Galaxy",,https://www.linkedin.com/company/aqtual,11-50,"$31,000,000",2018
Nuclidium,https://www.crunchbase.com/organization/swiss-nuclides,"Jul 10, 2025","CHF84,000,000",Not Started,"Health Care, Health Diagnostics, Medical, Therapeutics","Basel, Basel-Stadt, Switzerland",Nuclidium is a clinical-stage radiopharmaceutical company that develops novel radionuclide PET tracers for precision diagnostics.,"14,299",https://www.swissnuclides.ch/,$1M to $10M,"NRW.BANK, Highlight Capital, Kurma Partners, European Innovation Council, Wellington Partners","Angelini Ventures, European Innovation Council, Kurma Partners, Neva SGR, Wellington Partners",,https://www.linkedin.com/company/swiss-nuclides,1-10,"CHF79,000,000",2018
Wire 3,https://www.crunchbase.com/organization/wire-3,"Jul 10, 2025","$350,000,000",Not Started,"Consumer, Internet, Telecommunications","Rochester, New York, United States","Wire 3 is a telecommunications company that offers consumers quick, high-bandwidth data connections.","14,918",https://wire3.com/,—,"CIBC, JP Morgan, Guggenheim Investments, Oak Hill Capital Partners, Woodforest National Bank","CIBC, Guggenheim Investments, JP Morgan, Woodforest National Bank",https://x.com/wire3LLC,https://www.linkedin.com/company/wire3,51-100,"$235,000,000",2021
Wake Forest University,https://www.crunchbase.com/organization/wake-forest-university,"Jul 10, 2025","$63,900,000",Not Started,"Education, Higher Education, Universities","Winston Salem, North Carolina, United States","Wake Forest University is a private, independent, nonprofit, non-sectarian, coeducational research university.","15,301",http://www.wfu.edu/,$1B to $10B,"Lilly Endowment, National Institutes of Health, AmeriCorps Public Allies","AmeriCorps Public Allies, Lilly Endowment, National Institutes of Health",https://x.com/WakeForest1834,https://www.linkedin.com/edu/school?id=18804,5001-10000,"$30,000,000","Feb 3, 1834"
Augmodo,https://www.crunchbase.com/organization/augmodo,"Jul 10, 2025","$42,884,953",Not Started,"Artificial Intelligence (AI), Marketing, Retail","Seattle, Washington, United States","Augmodo Spatial AI enables real-time tracking of products across all stores, enhancing inventory management and shopping experiences.","15,733",https://www.augmodo.com/,—,"TQ Ventures, Lerer Hippeau, Simple Food Ventures, New Fare, Interlace Ventures","Lerer Hippeau, TQ Ventures",,https://www.linkedin.com/company/augmodo,11-50,"$37,584,953",2023
Foundation EGI,https://www.crunchbase.com/organization/foundation-egi,"Jul 10, 2025","$30,600,000",Not Started,"Artificial Intelligence (AI), Generative AI, Information Technology","Los Altos, California, United States",The EGI platform from the Foundation is designed to speed up all phases of the product development cycle,"17,023",https://www.foundationegi.com/,—,"Alumni Ventures, E14 Fund, RRE Ventures, Samsung NEXT, Translink Capital","RRE Ventures, Translink Capital",,https://www.linkedin.com/company/foundationegi,11-50,"$23,000,000",2023
QuiX,https://www.crunchbase.com/organization/quix-42ff,"Jul 10, 2025","€38,000,000",Not Started,"Hardware, Manufacturing, Quantum Computing, Semiconductor","Enschede, Overijssel, The Netherlands","QuiX develops photonic quantum computing hardware, utilizing integrated photonics to process quantum information through light particles.","18,793",https://www.quixquantum.com/,$1M to $10M,"Invest-NL, FORWARD.one, PhotonVentures, European Innovation Council Fund, PhotonDelta","EIC Accelerator, EIC Scaling Club, European Innovation Council Fund, Invest-NL",https://x.com/quixquantum,https://www.linkedin.com/company/quix-bv,11-50,"€15,000,000",2019
Renasant Bio,https://www.crunchbase.com/organization/renasant-bio,"Jul 10, 2025","$54,500,000",Not Started,"Biotechnology, Life Science, Therapeutics","Berkeley, California, United States",Renasant Bio is a biopharmaceutical company pioneering disease-modifying oral small molecule treatments.,"19,104",https://www.renasantbio.com/,—,"5AM Ventures, OrbiMed, Qiming Venture Partners USA, Atlas Venture",5AM Ventures,https://x.com/RenasantBio,https://www.linkedin.com/company/renasant-bio,11-50,"$54,500,000",2022
San Diego International Airport,https://www.crunchbase.com/organization/san-diego-international-airport,"Jul 10, 2025","$35,000,000",Not Started,"Air Transportation, Customer Service, Parking, Restaurants, Shopping","San Diego, California, United States","San Diego International Airport is an online portal that provides live flight tracking info, arrivals, and departure times.","21,409",http://www.san.org/,$100M to $500M,"Federal Aviation Administration, Airport Terminals Program","Airport Terminals Program, Federal Aviation Administration",https://x.com/sandiegoairport,https://www.linkedin.com/company/sdcraa,251-500,"$15,000,000",2003
CREAL,https://www.crunchbase.com/organization/creal3d,"Jul 10, 2025","$24,932,190",Not Started,"3D Technology, Augmented Reality, Health Care, Software, Virtual Reality","Ecublens, Vaud, Switzerland",CREAL develops near-eye light-field display bringing true optical depth and better immersion into virtual and mixed reality.,"22,157",https://www.creal.com/,$1M to $10M,"European Innovation Council, Verve Ventures, Venture Kick, MassChallenge, Swisscom Ventures","Carl Zeiss Vision, DAA Ventures, European Innovation Council, Foundation for Innovation and Technology (FIT), Hammer Team, SICTIC, Swisscom Ventures, Venture Kick, Verve Ventures, ZEISS Group",https://x.com/CREAL_3D,https://www.linkedin.com/company/creal3d/,11-50,"$8,900,000","Nov 3, 2017"
WaHa,https://www.crunchbase.com/organization/water-harvesting,"Jul 10, 2025","$21,668,795",Not Started,"AgTech, CleanTech, Heating, Ventilation, and Air Conditioning (HVAC), Water","Fremont, California, United States",Revolutionary platform for solid desiccant regeneration improves energy efficiency and carbon emissions by 50% for HVAC and AWG applications,"23,458",http://www.wahainc.com/,$1M to $10M,"Berkeley Catalyst Fund (BCF), Anthropocene Institute, Christian Thirion, TAQNIA, Mitsui Mining & Smelting","Berkeley Catalyst Fund (BCF), Christian Thirion, Mike Phillips",,https://www.linkedin.com/company/water-harvesting-inc/,11-50,"$8,000,000","Jul 18, 2018"
Gevo,https://www.crunchbase.com/organization/gevo,"Jul 10, 2025","$2,095,460,000",Not Started,"Biotechnology, Energy, Fossil Fuels, Fuel, Renewable Energy","Englewood, Colorado, United States","Gevo focuses on the production of isobutanol, thereby bringing renewable and cost-effective fossil fuel alternatives to consumers worldwide.","24,107",http://www.gevo.com/,$10M to $50M,"Khosla Ventures, OUP (Osage University Partners), US Department of Energy, LANXESS, TriplePoint Capital","Barclays Investment Bank, Burrill & Company, Federal Aviation Administration, Khosla Ventures, Malaysian Life Sciences Capital Fund, US Department of Energy, Whitebox Advisors",,http://www.linkedin.com/company/499588,101-250,"$40,000,000",2005
