Organization Name,CrunchBase URL,Last Funding Date,Total Funding Amount,Stage,Industries,Headquarters Location,Description,CB Rank (Company),Website,Estimated Revenue Range,Top 5 Investors,Lead Investors,Twitter,LinkedIn,Number of Employees,Last Funding Amount,Founded Date
Queens Carbon,https://www.crunchbase.com/organization/queens-carbon,"Apr 30, 2025","$24,500,000",Not Started,"B2B, Consulting, Manufacturing","Pine Brook, New Jersey, United States",Queens Carbon is working on a processing system that will dramatically cut energy use.,"35,293",https://www.queenscarbon.com/,Less than $1M,"Plug and Play, Clean Energy Ventures, US Department of Energy, Clean Energy Venture Group, Buzzi Unicem USA","Clean Energy Ventures, US Department of Energy",https://x.com/QueensCarbon,https://www.linkedin.com/company/queens-carbon,1-10,"$10,000,000",2022
NovaMea,https://www.crunchbase.com/organization/novamea,"Apr 30, 2025","$12,200,000",Not Started,"Energy Storage, Manufacturing, Renewable Energy","Renens, Vaud, Switzerland",NovaMea is a clean technology startup that develops and commercializes electrochemical solutions for energy storage and conversion.,"38,639",https://www.novamea.org/,—,"Lightspeed Venture Partners, Horizon 2020","Horizon 2020, Lightspeed Venture Partners",https://x.com/NovaMea2023,https://www.linkedin.com/company/novamea,1-10,"$9,000,000",2023
RxAll,https://www.crunchbase.com/organization/rxall-inc,"Apr 30, 2025","$6,780,137",Not Started,"Artificial Intelligence (AI), Big Data, Database, Delivery Service, Enterprise, Hardware, Internet of Things, Software","New Haven, Connecticut, United States",RxAll is a Deep Learning-Hyperspectral IoT Platform for the authentication and real-time global tracking of quality of drugs.,"46,207",http://www.rxall.net/,$1M to $10M,"Plug and Play, SOSV, Merck, Launch Africa, 54 Collective","54 Collective, Investing In Innovation Africa, Launch Africa",https://x.com/RxAll_Inc,https://www.linkedin.com/company/rxall-inc.,11-50,"$225,000",2016
XPFibre,https://www.crunchbase.com/organization/xpfibre,"Apr 30, 2025","€75,000,000",Not Started,"Construction, Telecommunications","Courbevoie, Ile-de-France, France",XPFibre is the largest alternative fibre-to-the-home (FttH) infrastructure wholesale operator in France.,"46,361",https://xpfibre.com/,—,—,—,https://x.com/XpFibre,https://www.linkedin.com/company/xpfibre/,251-500,"€75,000,000",—
TradeBridge,https://www.crunchbase.com/organization/woodsford-tradebridge,"Apr 30, 2025","$385,763,990",Not Started,"Financial Services, FinTech","London, England, United Kingdom",Seize your moment with finance fit for a faster moving world.,"46,371",http://www.tradebridge.com/,$10M to $50M,"Castlelake, Credit Suisse, ABN AMRO Fund","ABN AMRO Fund, Castlelake, Credit Suisse",https://x.com/Trade_Bridge,https://www.linkedin.com/company/woodsford-tradebridge/,11-50,"£70,000,000","Jan 1, 2013"
AssetWatch,https://www.crunchbase.com/organization/nikola-labs-llc,"Apr 30, 2025","$166,137,997",Not Started,"Big Data, Industrial Automation, Internet of Things, Machine Learning, Predictive Analytics","Westerville, Ohio, United States","AssetWatch is a deployable, remote, end-to-end condition monitoring solution providing predictive insight to enable proactive maintenance.","55,141",https://www.assetwatch.com/,$10M to $50M,"Wellington Management, G2 Venture Partners, OUP (Osage University Partners), Monte Carlo Capital, Triangle Peak Partners","Advanced Technology Services, G2 Venture Partners, Ikove Capital Partners, Monte Carlo Capital, Proton Enterprises, Viking Global Investors, Wellington Management",https://x.com/GoAssetWatch,https://www.linkedin.com/company/goassetwatch/,251-500,"$75,000,000","Oct 1, 2014"
ESL Shipping,https://www.crunchbase.com/organization/esl-shipping,"Apr 30, 2025","€110,000,000",Not Started,"Marine Transportation, Shipping, Transportation, Water Transportation","Helsinki, Southern Finland, Finland",ESL Shipping is a carrier of dry bulk cargo.,"55,197",https://www.eslshipping.com/,$100M to $500M,"Nordic Investment Bank, Varma Mutual Pension Insurance Company, OP Financial Group",Nordic Investment Bank,https://x.com/esl_shipping,https://www.linkedin.com/company/esl-shipping-oy/,101-250,"€45,000,000",1949
Cage Bio,https://www.crunchbase.com/organization/cage-bio,"Apr 30, 2025","$12,705,935",Not Started,"Biotechnology, Health Care, Medical","San Carlos, California, United States","Cage Bio develops novel products for dermatology, inflammation, and immunology.","56,856",https://cagebio.com/,$1M to $10M,Propel(X),Propel(X),https://x.com/CageBioInc,https://www.linkedin.com/company/cage-bio-inc,1-10,—,"Jan 1, 2016"
Heidtman Steel,https://www.crunchbase.com/organization/heidtman-steel,"Apr 30, 2025","$245,000,000",Not Started,"Consumer Goods, Manufacturing, Precious Metals","Toledo, Ohio, United States",Heidtman Steel provides the extensive range of processing capabilities associated with a large service center network,"57,648",http://www.heidtman.com/,$100M to $500M,"Bank of Montreal, WhiteHawk Capital Partners",Bank of Montreal,,https://www.linkedin.com/company/1267212,1001-5000,"$245,000,000",1954
Fresenius Medical Care North America,https://www.crunchbase.com/organization/fresenius-medical-care-north-america,"Apr 30, 2025","$133,587,192",Not Started,"Biotechnology, Health Care, Medical, Medical Device, Pharmaceutical","Waltham, Massachusetts, United States",Fresenius Medical Care North America provides healthcare services to people with renal and other chronic conditions.,"60,627",https://fmcna.com/,$10B+,U.S. Department of Veteran Affairs,U.S. Department of Veteran Affairs,https://x.com/fmcnanews,https://www.linkedin.com/company/fresenius-medical-care/,10001+,"$8,674,334",1996
Diamyd Medical,https://www.crunchbase.com/organization/diamyd-medical,"Apr 30, 2025","$43,342,352",Not Started,"Biotechnology, Health Diagnostics, Medical Device","Stockholm, Stockholms Lan, Sweden",Diamyd Medical is a Swedish diabetes company active in the field of pharmaceutical development.,"63,432",http://www.diamyd.com/,Less than $1M,"Breakthrough T1D, Pittsburgh Life Sciences Greenhouse, Vinnova, Bertil Lindkvist, Anders Essen Möller","Anders Essen Möller, Bertil Lindkvist, Breakthrough T1D",https://x.com/diamyd,https://www.linkedin.com/company/diamyd-medical,11-50,"SEK224,000,000",1994
Mobilize Financial Services,https://www.crunchbase.com/organization/rci-banque-sa-germany-branch,"Apr 30, 2025","€624,000,000",Not Started,"Banking, Financial Services, Insurance, Leasing","Neuss, Nordrhein-Westfalen, Germany","Mobilize Financial Services specializes in car loans, investment, insurance, financing, and leasing services.","84,898",https://www.mobilize-fs.de/,$100M to $500M,—,—,,https://www.linkedin.com/company/rci-banque-niederlassung-deutschland/,1001-5000,"€624,000,000",1947
Brickell Bay Holding Company,https://www.crunchbase.com/organization/brickell-bay-holding-company,"Apr 30, 2025","$13,000,000",Not Started,Business Development,"Miami, Florida, United States",Brickell Bay Holding Company offers business services.,"91,181",—,—,—,—,,,—,"$13,000,000",2024
Dominion Packaging,https://www.crunchbase.com/organization/dominion-packaging,"Apr 30, 2025","$10,600,000",Not Started,"Customer Service, Manufacturing, Packaging Services","Sandston, Virginia, United States",Dominion Packaging manufactures wide range of folding cartons and packaging services maintaining an excellent level of customer service.,"95,576",https://www.dompkg.com/,—,"Gordon Brothers, Backcast Partners","Backcast Partners, Gordon Brothers",,https://www.linkedin.com/company/dominion-packaging/,101-250,—,2004
Clean Energy Technologies,https://www.crunchbase.com/organization/clean-energy-technologies,"Apr 30, 2025","$13,000,000",Not Started,"Energy, Renewable Energy","Irvine, California, United States","Clean Energy Technologies is a trading symbol that designs, builds, and markets renewable and energy-efficient products and solutions.","99,909",http://cetyinc.com/,$1M to $10M,U.S. Department of Agriculture,U.S. Department of Agriculture,,,11-50,"$12,000,000","Jan 1, 1993"
BenchPrep,https://www.crunchbase.com/organization/benchprep,"Apr 30, 2025","$30,719,424",Not Started,"Android, Education, iOS, SaaS, Skill Assessment, Software, Test and Measurement","Chicago, Illinois, United States",BenchPrep offers a learner success platform to improve engagement and outcomes for learners.,"126,561",http://www.benchprep.com/,Less than $1M,"New Enterprise Associates, Lightbank, Owl Ventures, Jump Capital, Revolution Ventures","Jump Capital, New Enterprise Associates, Owl Ventures",https://x.com/BenchPrep,https://www.linkedin.com/company/benchprep/,11-50,"$2,519,424","Aug 1, 2010"
Touax,https://www.crunchbase.com/organization/touax,"Apr 30, 2025","€50,000,000",Not Started,"Leasing, Logistics, Rental","La Défense, Ile-de-France, France",Touax specializes in the rental and marketing transport equipment and modular constructions.,"175,184",https://touax.com/en,$100M to $500M,"European Investment Bank, Development Partners International",European Investment Bank,,https://www.linkedin.com/company/touax/about/,101-250,"€50,000,000",1853
Augusta Gold,https://www.crunchbase.com/organization/bullfrog-gold,"Apr 30, 2025","$27,663,018",Not Started,"Industrial, Mining, Natural Resources, Precious Metals, Project Management","Grand Junction, Colorado, United States","Augusta Gold explores and develops gold projects, focusing on mining asset acquisition and value creation.","192,460",https://www.augustagold.com/,$1M to $10M,Augusta Investments,Augusta Investments,https://x.com/gold_augusta,https://www.linkedin.com/company/augusta-gold-corp,1-10,"$500,000","Jan 1, 2007"
EWOR,https://www.crunchbase.com/organization/ewor,"Apr 29, 2025","€33,200,000",Not Started,"Education, Training, Venture Capital","Berlin, Berlin, Germany","The EWOR Fellowship backs the top tech founders globally with up to €500,000 and bespoke mentorship by unicorn founders.",514,https://ewor.com/,$1M to $10M,"FJ Labs, Paul Müller, Felix Haas, David Rowan, Robert Wuttke",—,https://x.com/EWOR_official,https://www.linkedin.com/company/ewor/,11-50,"€30,000,000",2020
Zoe Financial,https://www.crunchbase.com/organization/zoe-financial,"Apr 29, 2025","$45,900,000",Not Started,"Financial Services, FinTech, Software, Wealth Management","New York, New York, United States",Zoe Financial is a wealth management platform that connects people with independent investment advisors for investment management.,"1,495",https://zoefinancial.com/,Less than $1M,"CAPTRUST, Karman Ventures, Bossa Invest, Mariner Wealth Advisors, Sageview Capital","Open Opportunity Fund, Sageview Capital",https://x.com/ZoeFinancial,https://www.linkedin.com/company/zoe-financial-inc.,11-50,"$29,600,000","Feb 1, 2018"
Navro,https://www.crunchbase.com/organization/paytrix,"Apr 29, 2025","$78,971,300",Not Started,"Banking, Finance, Financial Services, FinTech, Payments","London, England, United Kingdom",Navro is a payment curation platform that offers tools for businesses to gain real-time insights into payments and track money movements.,"3,081",https://navro.com/,—,"Bain Capital Ventures, Salica, Motive Partners, Fin Capital, Motive Ventures","Bain Capital Ventures, Better Tomorrow Ventures, Jump Capital, Motive Partners, Motive Ventures, Salica, Unusual Ventures",https://x.com/navro__,https://www.linkedin.com/company/navropayments,101-250,"$41,000,000",2022
Cohesity,https://www.crunchbase.com/organization/cohesity,"Apr 29, 2025","$955,000,000",Not Started,"Analytics, Artificial Intelligence (AI), Cloud Computing, Cyber Security, Data Center, Data Storage, Information Technology, Security","Santa Clara, California, United States","Cohesity is a data management technology firm that offers hyper-converged secondary storage solutions for backups, files, and analytics.","3,323",https://www.cohesity.com/,$100M to $500M,"Accel, Sequoia Capital, NVIDIA, Madrona, Sapphire Ventures","Artis Ventures, DFJ Growth, Foundation Capital, Google Ventures, Greenspring Associates, Haveli Investments, JP Morgan Chase, Qualcomm Ventures, Sequoia Capital, SoftBank Vision Fund, Steadfast Capital Management, The Carlyle Group, Wing Venture Capital",https://x.com/cohesity,https://www.linkedin.com/company/cohesity/,1001-5000,—,"Jul 11, 2013"
Near Space Labs,https://www.crunchbase.com/organization/near-space-labs,"Apr 29, 2025","$34,500,000",Not Started,"Aerospace, Computer Vision, Geospatial, Robotics, Software","Brooklyn, New York, United States","Near Space Labs provides aerial imagery using zero-emission balloons to support mapping, urban planning, and environmental monitoring.","5,774",https://www.nearspacelabs.com/,$10M to $50M,"Gaingels, Draper Associates, Toyota Ventures, Third Sphere, Crosslink Capital","Bold Capital Partners, CivStart, Crosslink Capital, Draper Associates",https://x.com/nearspacelabs,https://www.linkedin.com/company/near-space,11-50,"$20,000,000",Oct 2017
Utilidata,https://www.crunchbase.com/organization/utilidata,"Apr 29, 2025","$95,300,000",Not Started,"Artificial Intelligence (AI), Clean Energy, Energy, Power Grid, Software","Providence, Rhode Island, United States",Utilidata is a grid technology startup that integrates AI capabilities to enhance data utilization and operational efficiency.,"7,169",http://www.utilidata.com/,$10M to $50M,"NVIDIA, American Electric Power, MUUS, Quanta Services, Moore Strategic Ventures","Braemar Energy Ventures, Keyframe Capital Partners, Moore Strategic Ventures, Renown Capital Partners",https://x.com/Utilidata,https://www.linkedin.com/company/utilidata-inc-,101-250,"$60,300,000",2012
March Biosciences,https://www.crunchbase.com/organization/march-biosciences,"Apr 29, 2025","$46,800,000",Not Started,"Biotechnology, Health Care, Life Science, Medical, Therapeutics","Houston, Texas, United States",March Biosciences is a clinical-stage cell therapy company that develops CAR-T cell strategies to address hematological cancers.,"10,112",https://march.bio/,—,"Modi Ventures, Mission BioCapital, Alexandria Venture Investments, KdT Ventures, Fitz Gate Ventures","4BIO Capital, Cancer Focus Fund, Cancer Prevention and Research Institute of Texas, Mission BioCapital, ScaleReady",,https://www.linkedin.com/company/march-biosciences,1-10,"$200,000",2021
Vizcom,https://www.crunchbase.com/organization/vizcom-614c,"Apr 29, 2025","$51,000,000",Not Started,"Artificial Intelligence (AI), Information Technology, Software","California City, California, United States",Vizcom is an AI-powered creative tool designed for industrial designers and artists.,"10,486",https://www.vizcom.ai/,$100M to $500M,"Index Ventures, Basis Set Ventures, Unusual Ventures, Ayush Sood, Kyle Parrish","Index Ventures, Unusual Ventures",https://x.com/vizcom_ai,https://www.linkedin.com/company/vizcomco,11-50,"$26,000,000",2021
1NCE,https://www.crunchbase.com/organization/1nce-gmbh,"Apr 29, 2025","$110,000,000",Not Started,"Business Intelligence, Data Management, Internet of Things, Software, Telecommunications","Köln, Nordrhein-Westfalen, Germany",1NCE provides IoT software and connectivity platform for connected products to customers managing devices across different countries.,"10,824",https://1nce.com/,Less than $1M,"I Squared Capital, SoftBank Vision Fund, SoftBank, Deutsche Telekom, Kensington Capital Partners",SoftBank Vision Fund,https://x.com/1NCE_IoT,https://www.linkedin.com/company/18471615/,251-500,"$60,000,000",Dec 2017
Bird Buddy,https://www.crunchbase.com/organization/bird-buddy,"Apr 29, 2025","$36,303,184",Not Started,"Apps, Artificial Intelligence (AI), E-Commerce","Wilmington, Delaware, United States","Bird Buddy is a smart bird feeder, notifies that of bird visitors, captures their photos, and organizes them in a beautiful collection.","12,063",https://mybirdbuddy.com/,$50M to $100M,"General Catalyst, BACKED VC, Prota Ventures, Silicon Gardens, Adjacent","BACKED VC, General Catalyst, Silicon Gardens",https://x.com/mybirdbuddy,https://www.linkedin.com/company/birdbuddy,101-250,"$2,254,433",2020
ChiroHD,https://www.crunchbase.com/organization/chirohd,"Apr 29, 2025","$34,000,000",Not Started,"Computer, Health Care, Software","Marietta, Georgia, United States",ChiroHD is a cloud-based EHR company focusing on the chiropractic space.,"12,220",https://chirohd.com/,$1M to $10M,Mainsail Partners,Mainsail Partners,,https://www.linkedin.com/company/chirohd/,11-50,"$26,000,000",2017
Hoofprint Biome,https://www.crunchbase.com/organization/hoofprint-biome,"Apr 29, 2025","$15,000,000",Not Started,"Animal Feed, Biotechnology, Life Science, Livestock","Raleigh, North Carolina, United States",Hoofprint Biome is a biotechnology company that develops probiotics that improve the sustainability of ruminant livestock production.,"12,224",https://www.hoofprintbiome.com/,$1M to $10M,"SOSV, Breakthrough Energy Ventures, Good Growth Capital, Alexandria Venture Investments, Ponderosa Ventures","AgriZeroNZ, SOSV",,https://www.linkedin.com/company/hoofprint-biome/,1-10,"$15,000,000",2023
Persivia,https://www.crunchbase.com/organization/persivia,"Apr 29, 2025","$125,000,000",Not Started,"Artificial Intelligence (AI), Electronic Health Record (EHR), Health Care, Information Technology, Medical","Marlborough, Massachusetts, United States","Persivia provides AI-driven population health solution to hospitals, payers and providers to excel in value based care","14,597",http://persivia.com/,$10M to $50M,"Aldrich Capital Partners, Petrichor Healthcare Capital Management","Aldrich Capital Partners, Petrichor Healthcare Capital Management",https://x.com/persiviainc,https://www.linkedin.com/company/persivia,51-100,"$107,000,000",2005
Nectar,https://www.crunchbase.com/organization/nectar-hr,"Apr 29, 2025","$58,657,484",Not Started,"Human Resources, Information Technology, SaaS","Orem, Utah, United States",Nectar is an employee recognition and rewards platform for the modern workforce.,"15,001",https://www.nectarhr.com/,$1M to $10M,"PeakSpan Capital, GTMfund, Element Ventures",PeakSpan Capital,https://x.com/nectar_hr,https://www.linkedin.com/company/nectarhr,101-250,"$13,500,000","Apr 16, 2016"
Blooming Health,https://www.crunchbase.com/organization/blooming-health,"Apr 29, 2025","$30,300,000",Not Started,"Apps, Artificial Intelligence (AI), Health Care, Software, Wellness","New York, New York, United States","Blooming Health streamlines social care delivery with AI-powered, multilingual outreach and automation tools.","15,217",https://gobloominghealth.com/,$10M to $50M,"Insight Partners, Afore Capital, Right Side Capital Management, Forum Ventures, Metrodora Ventures","Afore Capital, Crossbeam Venture Partners, Forum Ventures, Insight Partners",https://x.com/GoBlooming,https://www.linkedin.com/company/blooming-health-co/,51-100,"$26,000,000",2020
Villa Homes,https://www.crunchbase.com/organization/villa-homes-8162,"Apr 29, 2025","$75,530,261",Not Started,"Architecture, Construction, Real Estate","San Francisco, California, United States",Villa Homes is a construction company that helps homeowners and communities building backyard homes.,"15,522",https://villahomes.com/,—,"Tectonic Ventures, Unless, Atomic","Atomic, Unless",https://x.com/_VillaHomes_,https://www.linkedin.com/company/villa-homes-adus,101-250,"$25,256,867",2019
Replenysh,https://www.crunchbase.com/organization/replenysh,"Apr 29, 2025","$10,000,000",Not Started,"Internet, Recycling","Orange, California, United States",Replenysh builds the operating system of material recovery.,"16,589",https://replenysh.com/,$1M to $10M,"Floodgate, Kindred Ventures, Script Capital, M13, Angel Collective Opportunity Fund","Floodgate, Kindred Ventures, M13, Script Capital",https://x.com/replenysh,https://www.linkedin.com/company/replenysh/,11-50,"$8,000,000","Jan 1, 2016"
TAU Systems,https://www.crunchbase.com/organization/tau-systems,"Apr 29, 2025","$35,000,000",Not Started,Biotechnology,"Austin, Texas, United States",TAU Systems provides medical imaging technology.,"17,047",https://www.tausystems.com/,$1M to $10M,"Alumni Ventures, Quantonation, Impact Ventures, Lukasz Gadowski, Team Global","Lukasz Gadowski, Quantonation",https://x.com/TauSystems,https://www.linkedin.com/company/tausystems/,11-50,"$20,000,000",2021
Growers Edge,https://www.crunchbase.com/organization/growers-edge-financial,"Apr 29, 2025","$89,746,385",Not Started,"Agriculture, Analytics, Farming, Financial Services, FinTech","Johnston, Iowa, United States",Growers Edge provides financial products and data tools for agricultural retailers.,"17,405",https://www.growersedge.com/,$1M to $10M,"Lowercarbon Capital, S2G Investments, The Nature Conservancy, iSelect Fund, Cibus Fund","Cibus Fund, Cox Enterprises, Lowercarbon Capital, S2G Investments, Skyline Global Partners",https://x.com/growers_edge,https://www.linkedin.com/company/growers-edge-financial,11-50,"$29,246,385",2017
Camp Network,https://www.crunchbase.com/organization/camp-network-901e,"Apr 29, 2025","$34,000,000",Not Started,"Artificial Intelligence (AI), Blockchain, Cryptocurrency, FinTech","New York, New York, United States",Camp Network is a purpose-built Layer 1 blockchain to power AI agents.,"19,062",https://www.campnetwork.xyz/,—,"Blockchain Capital, Ethena, Celestia, Paper Ventures, EigenLabs","1kx, Blockchain Capital, Maven 11 Capital",https://x.com/campnetworkxyz,https://www.linkedin.com/company/campnetwork,11-50,"$30,000,000",2023
Miden,https://www.crunchbase.com/organization/miden-2df1,"Apr 29, 2025","$25,000,000",Not Started,"Blockchain, Cryptocurrency, FinTech","Menlo Park, California, United States",Miden grants applications the power to scale with public and private transactions.,"19,765",https://miden.xyz/,—,"a16z crypto, Hack VC, Symbolic Capital, Delta Blockchain Fund, Finality Capital Partners","a16z crypto, Hack VC",https://x.com/0xMiden,https://www.linkedin.com/company/0xmiden,11-50,"$25,000,000",2025
Synchronoss Technologies,https://www.crunchbase.com/organization/synchronoss-technologies,"Apr 29, 2025","$268,000,000",Not Started,"Content, Digital Media, Telecommunications","Bridgewater, New Jersey, United States",Synchronoss Technologies provides multi-channel transaction management solutions for the communication and digital content marketplaces.,"20,099",http://www.synchronoss.com/,$100M to $500M,"Adams Street Partners, Citizens Bank, Ascent Venture Partners, Liberty Ventures, ABS Ventures","ABS Ventures, Citizens Bank, TP Birch Grove",https://x.com/Synchronoss,http://www.linkedin.com/company/synchronoss-technologies,501-1000,"$200,000,000",2000
DeepUll,https://www.crunchbase.com/organization/deepull,"Apr 29, 2025","€103,500,000",Not Started,"Biotechnology, Life Science","Barcelona, Catalonia, Spain",DeepUll is a biotech company that focuses its activity on the development of a new diagnostic system for early-stage sepsis condition.,"20,148",https://deepull.com/,—,"European Investment Bank, Mérieux Equity Partners, Asabys Partners, Kurma Partners, Columbus Venture Partners","Alta Life Sciences, Asabys Partners, Centre for the Development of Industrial Technology (CDTI), Columbus Venture Partners, European Investment Bank, Kurma Partners, Mérieux Equity Partners, Panakes Partners, Werfen",,https://www.linkedin.com/company/deepull,11-50,"€50,000,000",2019
Recover 180,https://www.crunchbase.com/organization/recover-180,"Apr 29, 2025","$53,165,391",Not Started,"Food and Beverage, Food Processing, Manufacturing","Long Beach, California, United States",Recover 180 manufactures organic hydration sports drinks to boost performance and recovery for athletes.,"21,470",https://drinkrecover.com/,$1M to $10M,"Julian Aiken, Romello Crowell",—,https://x.com/drink_recover,https://www.linkedin.com/company/recover180,1-10,"$1,775,000",2014
VSORA,https://www.crunchbase.com/organization/vsora,"Apr 29, 2025","$65,256,508",Not Started,"Artificial Intelligence (AI), Communications Infrastructure, Network Security, Semiconductor","La Forêt, Auvergne, France","VSORA is an IP provider for chipmakers designing the latest generations of digital communications systems, such as 5G.","23,085",http://www.vsora.com/,$1M to $10M,"Omnes Capital, European Innovation Council, Partech, Otium Capital, Adelie","European Innovation Council, Omnes Capital, Otium Capital, Partech",,https://www.linkedin.com/company/vsora/,11-50,"€40,000,000",2015
Iwell,https://www.crunchbase.com/organization/iwell-68ac,"Apr 29, 2025","€27,000,000",Not Started,"Clean Energy, Machinery Manufacturing, Manufacturing","Utrecht, Utrecht, The Netherlands",Iwell is a manufacturing company that offers smart storage solutions and batteries for sustainable and affordable energy supply.,"24,251",https://www.iwell.eu/,$1M to $10M,"Invest-NL, Meridiam, Rabobank",Meridiam,https://x.com/iwellbv,https://www.linkedin.com/company/iwell-nederland/,11-50,"€27,000,000",2016
Hy2gen,https://www.crunchbase.com/organization/hy2gen,"Apr 29, 2025","€247,000,000",Not Started,"Hydroponics, Manufacturing","Wiesbaden, Hessen, Germany","HY2GEN AG develops, finances, builds and operates plants for the production of green hydrogen and hydrogen-based e-fuels worldwide","24,628",https://hy2gen.com/,$1M to $10M,"La Caisse, Mirova, Technip Energies, Hy24, BenDa",Hy24,https://x.com/hy2genag,https://www.linkedin.com/company/hy2gen-ag,11-50,"€47,000,000",Oct 2017
