Organization Name,CrunchBase URL,Last Funding Date,Total Funding Amount,Stage,Industries,Headquarters Location,Description,CB Rank (Company),Website,Estimated Revenue Range,Top 5 Investors,Lead Investors,Twitter,LinkedIn,Number of Employees,Last Funding Amount,Founded Date
Trupanion,https://www.crunchbase.com/organization/trupanion,"Nov 4, 2025","$257,999,995",Not Started,"Health Care, Health Insurance, Insurance, Pet","Seattle, Washington, United States",Trupanion is an insurance company which provides pet care insurance.,"56,503",http://trupanion.com/,$1B to $10B,"Maveron, Highland Capital Partners, PNC Bank","Highland Capital Partners, Maveron, PNC Bank",https://x.com/Trupanion,https://www.linkedin.com/company/trupanion-pet-insurance,1001-5000,"$120,000,000",1999
Yavin,https://www.crunchbase.com/organization/yavin,"Nov 4, 2025","€6,200,000",Not Started,"Information Technology, Point of Sale, Software","Paris, Ile-de-France, France",Yavin provides modern point-of-sale solutions for European merchants.,"57,665",https://yavin.com/,$1M to $10M,"Seedcamp, New Wave (VC), Thibaud Elziere, Xavier Niel, Arthur Waller",AwakenAngels,,https://fr.linkedin.com/company/yavin,11-50,—,2018
FAIRMAT,https://www.crunchbase.com/organization/fairmat-tech,"Nov 4, 2025","$112,459,489",Not Started,"Advanced Materials, Automotive, CleanTech, Consumer Electronics, Leisure, Manufacturing, Recycling, Sports","Paris, Ile-de-France, France","Recycling Carbon Fiber Composite to produce a strong, light and ecological material with advanced technical grades","62,499",https://fairmat.tech/,$50M to $100M,"European Investment Bank, Temasek Holdings, Singular, Infinity Recycling, The Friedkin Group","AGORANOV, Bpifrance Large Venture, Compagnie Nationale a Portefeuille, European Investment Bank, Infinity Recycling, Singular, Slate VC, Temasek Holdings",https://x.com/Fairmat_tech,https://linkedin.com/company/fairmat-tech,101-250,"€10,000,000","Oct 20, 2020"
Aqui tu Reforma,https://www.crunchbase.com/organization/aqui-tu-reforma,"Nov 4, 2025","€7,380,000",Not Started,"Home Decor, Home Improvement, Home Renovation","Barcelona, Catalonia, Spain",Aqui tu Reforma provides high-quality house renovations that are technologically enabled.,"75,563",https://www.aquitureforma.com/,$1M to $10M,"Iberdrola, Seaya, ICF Capital, Encomenda VC, Sabadell Venture Capital",Sabadell Venture Capital,https://x.com/aquitureforma,https://es.linkedin.com/company/aqui-tu-reforma,11-50,—,2018
Relmada Therapeutics,https://www.crunchbase.com/organization/relmada-therapeutics,"Nov 4, 2025","$406,131,110",Not Started,"Biotechnology, Clinical Trials, Pharmaceutical","New York, New York, United States","Relmada Therapeutics is a biotech company addressing diseases of the central nervous system, with a focus on major depressive disorder.","80,612",http://www.relmada.com/,$1M to $10M,"Janus Henderson Investors, OrbiMed, BioAdvance, Ben Franklin Technology Partners of Southeastern Pennsylvania, Columbia Threadneedle Investments",—,https://x.com/relmada,https://www.linkedin.com/company/relmada-therapeutics-inc,11-50,"$100,000,000",2004
GTS Rail,https://www.crunchbase.com/organization/gts-rail,"Nov 4, 2025","€15,000,000",Not Started,"Fleet Management, Railroad, Transportation","Bari, Puglia, Italy",GTS Rail is a railway company that offers traction services for goods.,"85,681",https://www.gtsrail.com/,$1M to $10M,UniCredit Leasing,UniCredit Leasing,https://x.com/gtsrail,https://www.linkedin.com/company/gts-rail,11-50,"€15,000,000",2012
ICFG Limited (formerly Fintech Asia ),https://www.crunchbase.com/organization/fintech-asia-e92f,"Nov 4, 2025","$25,000,000",Not Started,"Financial Services, FinTech","St. Peter Port, NA - Guernsey, Guernsey",Fintech Asia is a financial technology and innovation company that aims to improve and automate the supply of financial services.,"87,931",https://www.ic-fg.com/,Less than $1M,Helicap,Helicap,,https://www.linkedin.com/company/fintech-asia-limited,1-10,"$25,000,000",2021
Myomo,https://www.crunchbase.com/organization/myomo,"Nov 4, 2025","$55,116,765",Not Started,"Biotechnology, Health Care, Medical Device","Cambridge, Massachusetts, United States",Myomo develops devices with myoelectric prosthetic technology to restore the mobility of individuals with muscle weakness.,"105,462",https://myomo.com/,$10M to $50M,"Avenue Capital Group, Mountain Group Capital, Boston Harbor Angels","Avenue Capital Group, Mountain Group Capital",https://x.com/myomoinc,https://www.linkedin.com/company/myomo-inc./,101-250,"$12,500,000",2004
AquaBounty Technologies,https://www.crunchbase.com/organization/aquabounty-technologies,"Nov 4, 2025","$42,000,000",Not Started,"Biotechnology, Health Care, Health Diagnostics, Therapeutics","Maynard, Massachusetts, United States",AquaBounty Technologies is a biotechnology company that focuses on improving productivity in commercial aquaculture.,"150,700",http://www.aquabounty.com/,$1M to $10M,Bay City Capital,—,,https://www.linkedin.com/company/aquabounty,11-50,"$4,000,000",1991
FAVO Capital,https://www.crunchbase.com/organization/favo-capital,"Nov 4, 2025","$25,000,000",Not Started,"Commercial Real Estate, Real Estate, Real Estate Investment","Garden City, New York, United States",Favo Capital is a direct funding company that provides funding to small and medium-sized businesses across the country.,"180,425",https://www.favocapital.com/,$10M to $50M,"Dolomite.io, Stewards Investment Capital","Dolomite.io, Stewards Investment Capital",,https://www.linkedin.com/company/favocap/,51-100,"$10,000,000",1997
Loma Linda University Medical Center,https://www.crunchbase.com/organization/loma-linda-university-medical-center,"Nov 4, 2025","$9,000,000",Not Started,"Education, Health Care, Hospital, Medical","Loma Linda, California, United States",Loma Linda University Medical Center is an Seventh-day Adventist educational health-sciences organization.,"191,502",https://lluh.org/,$10M to $50M,California Institute for Regenerative Medicine,California Institute for Regenerative Medicine,https://x.com/LLUHealth,https://www.linkedin.com/company/loma-linda-university-health/,10001+,"$9,000,000",1905
PEDEVCO,https://www.crunchbase.com/organization/pacific-energy,"Nov 4, 2025","$285,000,000",Not Started,"Energy, Industrial, Oil and Gas","Danville, California, United States",PEDEVCO Development is an independent oil and gas company with a focus on high growth energy projects.,"201,185",https://www.pedevco.com/,—,Juniper Capital Advisors,Juniper Capital Advisors,https://x.com/pedevco,https://www.linkedin.com/company/pacific-energy-development,11-50,"$35,000,000",2000
Hippocratic AI,https://www.crunchbase.com/organization/hippocratic-ai,"Nov 3, 2025","$402,000,000",Not Started,"Artificial Intelligence (AI), Foundational AI, Generative AI, Health Care, Information Technology","Palo Alto, California, United States",Hippocratic AI is a healthcare technology company that develops safety-focused large-language models for medical applications.,237,https://www.hippocraticai.com/,$10M to $50M,"Andreessen Horowitz, General Catalyst, NVIDIA, Kleiner Perkins, SV Angel","Andreessen Horowitz, Avenir, General Catalyst, Kleiner Perkins, NVentures, Premji Invest",https://x.com/hippocraticai,https://www.linkedin.com/company/hippocratic-ai-health,101-250,"$126,000,000",Apr 2023
Femasys,https://www.crunchbase.com/organization/femasys,"Nov 3, 2025","$95,253,202",Not Started,"Biotechnology, Health Care, Manufacturing, Medical Device, Robotics, Women's","Suwanee, Georgia, United States",Femasys engages in R&D and manufacture of medical devices for women's healthcare.,752,http://femasys.com/,$1M to $10M,"Legacy Capital Partners, PharmaCyte Biotech, Jorey Chernett, Salem Partners, Mario Family Funds","Jorey Chernett, Legacy Capital Partners, PharmaCyte Biotech",,https://www.linkedin.com/company/femasys,11-50,"$12,000,000",2004
Lava,https://www.crunchbase.com/organization/lava-ede8,"Nov 3, 2025","$227,500,000",Not Started,"Bitcoin, Financial Services, Lending","New York, New York, United States",Lava is a bitcoin lending platform that offers a self-custodial wallet for managing bitcoin finances.,"1,805",https://www.lava.xyz/,$1M to $10M,"Khosla Ventures, Founders Fund, Caffeinated Capital, SignalFire, HashKey Capital","Founders Fund, Khosla Ventures",https://x.com/lava_xyz,https://www.linkedin.com/company/lavaxyz,1-10,"$200,000,000","May 13, 2021"
Kula Bio,https://www.crunchbase.com/organization/kula-bio,"Nov 3, 2025","$87,612,172",Not Started,"Agriculture, Biotechnology, Farming, Food and Beverage","Somerville, Massachusetts, United States",Kula Bio is a company that provides sustainable biological solutions for modern agriculture.,"2,936",https://www.kulabio.com/,$1M to $10M,"BoxGroup, Lowercarbon Capital, Collaborative Fund, Pillar VC, Taihill Venture","Collaborative Fund, Lowercarbon Capital, Pillar VC",,https://www.linkedin.com/company/kulabio/,11-50,"$15,483,411",2018
Teleskope,https://www.crunchbase.com/organization/teleskope-c1a4,"Nov 3, 2025","$32,200,000",Not Started,"Artificial Intelligence (AI), Compliance, Security, Software","New York, New York, United States","Teleskope provides a data protection platform that automates data security, privacy, and compliance across organizational environments.","2,966",https://www.teleskope.ai/,$1M to $10M,"Plug and Play, Primary Venture Partners, Lerer Hippeau, M13, Essence VC","Lerer Hippeau, M13, Primary Venture Partners",,https://www.linkedin.com/company/teleskopeai,11-50,"$25,000,000",2022
UBS,https://www.crunchbase.com/organization/ubs,"Nov 3, 2025","$12,569,710,718",Not Started,"Asset Management, Banking, Financial Services, Wealth Management","Zürich, Zurich, Switzerland","UBS is a financial services firm engaged in wealth management, investment banking, asset management, and retail banking.","3,264",https://www.ubs.com/,$10B+,—,—,https://x.com/UBS,http://www.linkedin.com/company/ubs,10001+,"$3,250,000,000","Jun 29, 1998"
iVerify,https://www.crunchbase.com/organization/iverify-df7e,"Nov 3, 2025","$28,326,254",Not Started,"Information Technology, Mobile, Network Security","Long Island City, New York, United States",IVerify is a mobile threat hunting company that provides mobile security solutions.,"3,571",https://www.iverify.io/,—,"BoxGroup, Pathlight Ventures, MANTIS Venture Capital, Mischief, Shine Capital","Mischief, Shine Capital",https://x.com/IsMyPhoneHacked,https://www.linkedin.com/company/iverify-io/,11-50,"$12,326,254",Aug 2023
Kick,https://www.crunchbase.com/organization/kick-2aea,"Nov 3, 2025","$22,000,000",Not Started,"Accounting, Apps, Bookkeeping and Payroll, FinTech, SaaS, Tax Preparation","Palo Alto, California, United States",Accounting software that does the work for you,"4,008",https://kick.co/,$1M to $10M,"General Catalyst, Felicis, Google Ventures, Bossa Invest, GTMfund","Felicis, General Catalyst, Google Ventures, OpenAI Startup Fund",https://x.com/kickfinance,https://www.linkedin.com/company/kickfinance,11-50,"$10,000,000",2022
Sonoma Biotherapeutics,https://www.crunchbase.com/organization/sonoma-biotherapeutics,"Nov 3, 2025","$365,300,000",Not Started,"Biotechnology, Life Science, Therapeutics","South San Francisco, California, United States",Sonoma Biotherapeutics develops engineered regulatory T-cell (Treg) therapies to treat autoimmune and inflammatory diseases.,"4,746",https://www.sonomabio.com/,$50M to $100M,"8VC, ARCH Venture Partners, Janus Henderson Investors, Fidelity, OUP (Osage University Partners)","Ally Bridge Group, Regeneron, ScaleReady",https://x.com/sonomabio,https://www.linkedin.com/company/sonoma-biotherapeutics,101-250,"$300,000",2020
Heineken,https://www.crunchbase.com/organization/heineken,"Nov 3, 2025","$14,706,991,774",Not Started,"Brewing, Food and Beverage, Lifestyle","Amsterdam, Noord-Holland, The Netherlands",Heineken is a global brewering company that offers and markets premium beers and cider brands for the global market.,"4,895",http://www.theheinekencompany.com/,$10B+,"FEMSA, Bill Gates","Bill Gates, FEMSA",https://x.com/HEINEKENCompany,https://www.linkedin.com/company/heineken,10001+,"€1,300,000,000",1863
Octonomy,https://www.crunchbase.com/organization/octonomy,"Nov 3, 2025","€23,500,000",Not Started,"Artificial Intelligence (AI), Business Process Automation (BPA), CRM, Enterprise Resource Planning (ERP)","Köln, Nordrhein-Westfalen, Germany",Octonomy automates technical and field service support using multi-agent artificial intelligence systems.,"5,254",https://www.octonomy.ai/,—,"NRW.BANK, Capnamic, Macquarie Capital, TechVision Fund","Capnamic, Macquarie Capital",,https://www.linkedin.com/company/octonomy,51-100,"€18,500,000",2024
mimic,https://www.crunchbase.com/organization/mimic-robotics,"Nov 3, 2025","$20,846,466",Not Started,"Artificial Intelligence (AI), Hardware, Robotic Process Automation (RPA), Robotics, Software","Zürich, Zurich, Switzerland",Mimic specializes in AI and robotic solutions that focuses on automating tedious tasks in various industries.,"5,578",https://www.mimicrobotics.com/,$1M to $10M,"Speedinvest, Founderful, Elaia, 10x Founders, Amazon Web Services","Amazon Web Services, CES, Elaia, ESA Business Incubation Centre Switzerland, Founderful, Innosuisse, Speedinvest, Venture Kick",https://x.com/mimicrobotics,https://www.linkedin.com/company/mimicrobotics,11-50,"$16,000,000","Apr 24, 2024"
Donut,https://www.crunchbase.com/organization/donut-893a,"Nov 3, 2025","$22,000,000",Not Started,"Blockchain, Cryptocurrency, Financial Services","New York, New York, United States",Donut is the first crypto agentic browser that uses the finest crypto in-domain model and a swarm of browsing agents.,"6,428",https://donutbrowser.ai/,$1M to $10M,"HSG, Makers Fund, Monad, Matrix, Hack VC","BITKRAFT Ventures, Hack VC, HSG",https://x.com/DonutBrowser,https://www.linkedin.com/company/donut-browser/,11-50,"$15,000,000",2025
Griffin Global Asset Management,https://www.crunchbase.com/organization/griffin-global-asset-management,"Nov 3, 2025","$5,370,000,000",Not Started,"Asset Management, Commercial, Finance, Financial Services, Leasing","Los Angeles, California, United States",Griffin Global Asset Management provides financial solutions and asset management services for the aviation industry.,"6,855",https://www.griffingam.com/,$1M to $10M,"Citibank, Bank of Montreal, Sumitomo Mitsui Banking Corporation",—,https://x.com/Griffin_GAM,https://www.linkedin.com/company/griffin-global-asset-management,11-50,"$1,245,000,000",2018
FluoGuide,https://www.crunchbase.com/organization/fluoguide,"Nov 3, 2025","$39,647,292",Not Started,"Biotechnology, Health Care","Copenhagen, Hovedstaden, Denmark",FluoGuide provides solutions for maximizing surgical outcome through intelligent targeting.,"7,096",https://fluoguide.com/,—,"European Innovation Council, OP Financial Group, Arbejdernes Landsbank, Linc",European Innovation Council,https://x.com/fluoguide,https://dk.linkedin.com/company/fluoguide,1-10,"SEK104,000,000",2018
Firehawk Aerospace,https://www.crunchbase.com/organization/firehawk-aerospace,"Nov 3, 2025","$88,250,000",Not Started,"3D Printing, Aerospace, Manufacturing","Addison, Texas, United States","Firehawk Aerospace manufactures solid rocket motors, energetic materials, and propellant for defense applications.","7,868",https://www.firehawkaerospace.com/,$1M to $10M,"Gaingels, Draper Associates, Stellar Ventures, Decisive Point, 1789 Capital","1789 Capital, Hanwha Defense USA, Raytheon, State of Oklahoma, Victorum Capital",,https://www.linkedin.com/company/firehawk-aerospace-llc,51-100,—,2019
Infravision,https://www.crunchbase.com/organization/infravision-7755,"Nov 3, 2025","$114,497,949",Not Started,"Aerospace, Energy, Industrial, Infrastructure","Austin, Texas, United States","Infravision develops aerial-robotics systems aimed at the construction, maintenance, and repair of power-transmission infrastructure.","9,147",https://www.infravisioninc.com/,$10M to $50M,"Hitachi Ventures, Activate Capital Partners, GIC, Australian Renewable Energy Agency, Energy Impact Partners","Australian Renewable Energy Agency, Energy Impact Partners, GIC",https://x.com/Infravision_UAS,https://www.linkedin.com/company/infravisioninc,101-250,"$91,000,000",2018
AAVantgarde Bio,https://www.crunchbase.com/organization/aavantgarde-bio,"Nov 3, 2025","$206,254,600",Not Started,"Biotechnology, Health Care, Life Science, Therapeutics","Milano, Lombardia, Italy",AAVantgarde Bio is a clinical-stage biotechnology company that develops gene therapies for inherited retinal disorders.,"10,215",https://www.aavantgarde.com/,$1M to $10M,"Schroders Capital, CDP Venture Capital, Sofinnova Partners, Sixty Degree Capital, Longwood Fund","Atlas Venture, Forbion Capital Partners, Schroders Capital, Sofinnova Partners",,https://www.linkedin.com/company/aavantgarde-bio,11-50,"$141,000,000",2021
Jeppesen ForeFlight,https://www.crunchbase.com/organization/jeppesen-foreflight,"Nov 3, 2025","$150,000,000",Not Started,"Consulting, Software, Software Engineering","Englewood, Colorado, United States","Jeppesen ForeFlight is redefining the future of aviation technology – equipping pilots, operators, and decision-makers.","11,080",https://www.jeppesenforeflight.com/,$100M to $500M,CPP Investments,—,https://x.com/jeppforeflight,https://www.linkedin.com/company/jeppesen-foreflight,1001-5000,"$150,000,000",1934
Go Digital Music,https://www.crunchbase.com/organization/go-digital-music,"Nov 3, 2025","$230,000,000",Not Started,"Digital Media, Media and Entertainment, Music","Los Angeles, California, United States",Go Digital Music is media and technology holding company.,"11,174",https://godigital.music/,—,"Bank of America, Fifth Third Bank, Mitsubishi UFJ Financial Group, First Horizon Bank, East West Bank",Bank of America,,,—,"$230,000,000",2006
Banco Bilbao Vizcaya Argentaria,https://www.crunchbase.com/organization/banco-bilbao-vizcaya-argentaria,"Nov 3, 2025","$4,742,335,051",Not Started,"Banking, Big Data, Finance, Financial Services, FinTech","Bilbao, Pais Vasco, Spain",Banco Bilbao Vizcaya Argentaria  is a global financial services group that offers the a range of services to customers and companies.,"12,783",https://www.bbva.com/,$10B+,International Finance Corporation,International Finance Corporation,https://x.com/bbva,https://www.linkedin.com/company/bbva-espana/,10001+,"€1,000,000,000","May 28, 1857"
Popai Health,https://www.crunchbase.com/organization/popai-health,"Nov 3, 2025","$11,000,000",Not Started,"Artificial Intelligence (AI), Health Care, Hospital, Information Technology","San Francisco, California, United States",Popai Health uses care coordination calls to extract important insights.,"14,039",https://popai.health/,—,"New Enterprise Associates, Team8","New Enterprise Associates, Team8",,https://www.linkedin.com/company/popai-health,1-10,"$11,000,000",2024
Jones Lang LaSalle,https://www.crunchbase.com/organization/jones-lang-lasalle,"Nov 3, 2025","$1,593,850,000",Not Started,"Commercial, Real Estate","Chicago, Illinois, United States","Jones Lang LaSalle, a financial and professional services firm, specializes in commercial real estate services and investment management.","14,796",http://www.jll.com/,$10B+,"JP Morgan Chase, Sculptor","JP Morgan Chase, Sculptor",https://x.com/JLL,http://www.linkedin.com/company/3178,10001+,"$565,350,000",1783
Neste,https://www.crunchbase.com/organization/neste,"Nov 3, 2025","€4,100,000,000",Not Started,"Industrial, Oil and Gas, Sustainability","Espoo, Southern Finland, Finland",Neste is a sustainable energy company focused on renewable diesel and aviation fuel.,"15,313",https://www.neste.com/,$10B+,European Commission,European Commission,https://x.com/NesteGlobal,https://www.linkedin.com/company/neste,5001-10000,—,"Jan 9, 1948"
Source.ag,https://www.crunchbase.com/organization/source-ag,"Nov 3, 2025","$54,508,112",Not Started,"Agriculture, AgTech, Artificial Intelligence (AI), Farming","Amsterdam, Noord-Holland, The Netherlands",Source.ag develops AI-powered software solutions to support commercial greenhouse cultivation.,"16,926",https://source.ag/,$10M to $50M,"E14 Fund, Astanor Ventures, Acre Venture Partners, Enza Zaden, HICO","Acre Venture Partners, Astanor Ventures, E14 Fund, HICO",https://x.com/sourceagri,https://www.linkedin.com/company/source-ag,101-250,"€15,200,000",Nov 2020
Taylor Morrison,https://www.crunchbase.com/organization/taylor-morrison,"Nov 3, 2025","$3,525,000,000",Not Started,"Architecture, Building Material, Civil Engineering, Construction, Real Estate, Residential","Scottsdale, Arizona, United States",Taylor Morrison is one of the largest home building companies in the United States.,"16,930",http://www.taylormorrison.com/,$1B to $10B,Kennedy Lewis Investment Management,Kennedy Lewis Investment Management,https://x.com/Taylor_Morrison,http://www.linkedin.com/company/taylor-morrison,1001-5000,"$525,000,000",2007
Zelluna Immunotherapy,https://www.crunchbase.com/organization/zelluna-immunotherapy,"Nov 3, 2025","$13,082,901",Not Started,"Biotechnology, Health Care, Medical, Pharmaceutical","Oslo, Oslo, Norway",Zelluna Immunotherapy is a privately owned Norwegian biopharmaceutical company.,"17,050",http://www.zelluna.com/,$1M to $10M,"Takeda Ventures, Birk Venture",Takeda Ventures,,https://www.linkedin.com/company/zelluna/,11-50,—,"Jan 1, 2016"
Coherence Neuro,https://www.crunchbase.com/organization/opto-biosystems,"Nov 3, 2025","$12,251,055",Not Started,"Health Care, Medical, Medical Device, Neuroscience","Cambridge, Cambridgeshire, United Kingdom",Coherence develops healthcare tech linking cancer neuroscience with neurotechnology for new treatments.,"18,051",https://www.coherenceneuro.com/,—,"Blackbird Ventures, topology, SmartGateVC, Possible Ventures, Artesian VC","Artesian VC, Blackbird Ventures, topology",https://x.com/coherenceneuro,https://www.linkedin.com/company/coherence-neuro,11-50,"$10,000,000",2022
Sidewalk Infrastructure Partners,https://www.crunchbase.com/organization/sidewalk-infrastructure-partners,"Nov 3, 2025","$1,000,000,000",Not Started,"Infrastructure, Project Management, Smart Cities","New York, New York, United States",Sidewalk Infrastructure Partners applies innovative technology to urban infrastructure systems.,"20,983",https://www.sidewalkinfra.com/,—,"StepStone Group, Alphabet, Ontario Teachers' Pension Plan","Alphabet, Ontario Teachers' Pension Plan, StepStone Group",https://x.com/sidewalkinfra,https://www.linkedin.com/company/sidewalk-infrastructure-partners-sip/,11-50,"$200,000,000",2019
PENN Entertainment,https://www.crunchbase.com/organization/penn-national-gaming,"Nov 3, 2025","$1,732,100,000",Not Started,"Casino, Gaming, Internet, Racing","Reading, Pennsylvania, United States",PENN Entertainment is a diversified owner and manager of gaming.,"21,599",https://www.pennentertainment.com/,$1B to $10B,Gaming and Leisure Properties,Gaming and Leisure Properties,https://x.com/pngaminginc,https://www.linkedin.com/company/penn-national-gaming,10001+,"$150,000,000",1972
Phio Pharmaceuticals,https://www.crunchbase.com/organization/rxi-pharmaceuticals,"Nov 3, 2025","$138,511,000",Not Started,"Biotechnology, Health Care, Medical, Oncology","King Of Prussia, Pennsylvania, United States",Phio Pharmaceuticals is a biotechnology company specializing in the application of RNAi therapies in immuno-oncology.,"23,515",https://phiopharma.com/,$1M to $10M,"OPKO Health, TRITON FUNDS LLC, Lincoln Park Capital Fund","Lincoln Park Capital Fund, TRITON FUNDS LLC",https://x.com/phio_pharma,https://www.linkedin.com/company/phio-pharmaceuticals-corp/,1-10,"$13,400,000",2006
The Icon League,https://www.crunchbase.com/organization/the-icon-league,"Nov 3, 2025","€15,000,000",Not Started,"Outdoors, Sports, Sports Leagues and Teams","Cologne, Nordrhein-Westfalen, Germany",The Icon League is a football club/league.,"25,509",https://www.theiconleague.com/,—,"HV Capital, H14, Jürgen Klopp's family office, Thomas Hagedorn",HV Capital,,https://www.linkedin.com/company/the-icon-league/,1-10,"€15,000,000",2023
EO Charging,https://www.crunchbase.com/organization/eo-charging,"Nov 3, 2025","$129,957,592",Not Started,"Electrical Distribution, Product Design, Software","Stowmarket, Suffolk, United Kingdom","EO Charging designs smart electric vehicle chargers and intelligent software for homes, workplaces, and destinations.","26,001",https://www.eocharging.com/,$1M to $10M,"HSBC, Zouk Capital, Vortex Energy","HSBC, Vortex Energy, Zouk Capital",https://x.com/eocharging,https://www.linkedin.com/company/eo-charging/,101-250,"£25,000,000",2015
Downstream,https://www.crunchbase.com/organization/trash-gurus,"Nov 3, 2025","$8,000,000",Not Started,"Construction, Logistics, Marketplace, Recycling, Waste Management","Dallas, Texas, United States",Downstream is a marketplace simplifying the waste management buying process for commercial customers,"29,183",https://www.trydownstream.io/,—,"FJ Labs, Moneta Ventures, Brick & Mortar Ventures, Victorum Capital","Brick & Mortar Ventures, Moneta Ventures",https://x.com/trydownstream,https://www.linkedin.com/company/trashgurus,1-10,"$8,000,000","Jan 21, 2022"
LitFinancial,https://www.crunchbase.com/organization/litfinancial,"Nov 3, 2025","$8,000,000",Not Started,"Finance, Financial Services, Lending, Mortgage","Troy, Michigan, United States","LitFinancial offers mortgages including conventional, FHA, VA, jumbo, home equity, DSCR, plus purchase, refinance, and cash‑out options.","29,819",https://litfinancial.com/,$1M to $10M,—,—,https://x.com/LitFinancial_,https://www.linkedin.com/company/lit-financial,101-250,"$8,000,000",2024
