Organization Name,CrunchBase URL,Last Funding Date,Total Funding Amount,Stage,Industries,Headquarters Location,Description,CB Rank (Company),Website,Estimated Revenue Range,Top 5 Investors,Lead Investors,Twitter,LinkedIn,Number of Employees,Last Funding Amount,Founded Date
Vok Bikes,https://www.crunchbase.com/organization/vok-bikes,"Jul 2, 2025","€11,400,000",Not Started,"Last Mile Transportation, Rental","Tallinn, Harjumaa, Estonia",Heavy duty cargo bikes provides on demand delivery companies.,"99,401",http://vokbikes.com/,$1M to $10M,"Specialist VC, Sunly, Superangel, Spring Capital, Enterprise Estonia","Enterprise Estonia, Metaplanet, SmartCap, Specialist VC, SQM Lithium Ventures",https://x.com/hashtag/vokbikes?lang=en&src=hash,https://www.linkedin.com/company/vok-ebikes,11-50,"€5,000,000",2019
Dekel Agri-Vision,https://www.crunchbase.com/organization/dekeloil-public-ltd,"Jul 2, 2025","$9,810,508",Not Started,Oil and Gas,"Limassol, Limassol, Cyprus",Dekel Agri-Vision which is engaged in developing and cultivating palm oil plantations in Cote d'lvoire.,"222,574",http://www.dekeloil.com/,$10M to $50M,AgDevCo,AgDevCo,,https://www.linkedin.com/company/dekeloil-ltd,51-100,"£115,601",2007
Blue Owl,https://www.crunchbase.com/organization/blue-owl-e2cf,"Jul 1, 2025","$3,647,767,745",Not Started,"Banking, Consumer Lending, Finance, Financial Services, Lending","New York, New York, United States","Blue Owl is an asset management firm offering alternative investment solutions in private credit, GP stakes, and real estate.",23,https://www.blueowl.com/,$1B to $10B,"HSBC, ICONIQ Capital, Societe Generale, Barclays, SMBC",Societe Generale,https://x.com/blueowlcapital,https://www.linkedin.com/company/blue-owl-capital,1001-5000,"£107,500,000",2021
Monroe Capital,https://www.crunchbase.com/organization/monroe-capital,"Jul 1, 2025","$534,000,000",Not Started,"Asset Management, Credit, Finance, Financial Services, Wealth Management","Chicago, Illinois, United States",Monroe Capital is an asset management firm that provides private credit solutions to middle‑market companies.,348,http://www.monroecap.com/,$50M to $100M,"Deutsche Bank, Fifth Third Bank","Deutsche Bank, Fifth Third Bank",https://x.com/MonroeCap,https://www.linkedin.com/company/monroe-capital,251-500,"$500,000,000","Oct 12, 2004"
Zscaler,https://www.crunchbase.com/organization/zscaler,"Jul 1, 2025","$1,670,695,169",Not Started,"Cloud Security, Cyber Security, Enterprise Software, Security","San Jose, California, United States",Zscaler is a global cloud-based information security company that enables secure digital transformation for mobile and cloud.,"2,360",https://www.zscaler.com/,$1B to $10B,"Lightspeed Venture Partners, CapitalG, TPG Growth, Employee Stock Option Fund, Junipero Capital","Lightspeed Venture Partners, TPG Growth",https://x.com/zscaler,https://www.linkedin.com/company/zscaler,5001-10000,"$1,500,000,000",2008
Ambrook,https://www.crunchbase.com/organization/ambrook,"Jul 1, 2025","$29,000,000",Not Started,"Accounting, Agriculture, FinTech, Payments, Software","New York, New York, United States",Ambrook is the financial layer powering American industry,"2,704",https://ambrook.com/,—,"BoxGroup, Thrive Capital, Homebrew, Designer Fund, Mischief","Dylan Field, Thrive Capital",https://x.com/AmbrookAg,https://www.linkedin.com/company/ambrook,11-50,"$26,100,000",Sep 2020
Globeleq,https://www.crunchbase.com/organization/globeleq,"Jul 1, 2025","$888,082,952",Not Started,"Energy, Energy Management, Mining, Natural Resources, Renewable Energy, Solar","London, England, United Kingdom","Globeleq Generation Limited develops, builds, and operates renewable power projects in Africa and the Americas.","3,762",http://www.globeleq.com/,$1M to $10M,"Absa group (Bank), Actis, British International Investment, Standard Bank Group, Norfund","Absa group (Bank), British International Investment, Norfund, Standard Bank Group",,https://www.linkedin.com/company/globeleq,501-1000,"ZAR5,400,000,000",2001
Talon.One,https://www.crunchbase.com/organization/talon-one,"Jul 1, 2025","€114,000,000",Not Started,"Business Development, Enterprise Software, Information Technology, Loyalty Programs, Marketing, SaaS, Software","Berlin, Berlin, Germany","Talon.One is the most powerful incentives engine that unifies loyalty, promotions and gamification into one holistic platform.","3,809",https://talon.one/,$10M to $50M,"CRV, Square Peg Capital, Silversmith Capital Partners, IRIS, Meritech Capital Partners","Berlin Ventures, Meritech Capital Partners, Silversmith Capital Partners",https://x.com/TalonOne,https://www.linkedin.com/company/talon.one,101-250,"€114,000,000",Nov 2015
Quiver Bioscience,https://www.crunchbase.com/organization/q-state-biosciences,"Jul 1, 2025","$22,518,527",Not Started,"Artificial Intelligence (AI), Biotechnology, Health Care, Life Science, Pharmaceutical, Precision Medicine","Cambridge, Massachusetts, United States",Quiver Bioscience develops medicines for brain disorders using human disease models and AI to advance drug development.,"4,000",https://www.quiverbioscience.com/,$10M to $50M,"National Cancer Institute, National Institute of Neurological Disorders and Stroke","National Cancer Institute, National Institute of Neurological Disorders and Stroke",https://x.com/quiverbio,https://www.linkedin.com/company/quiverbioscience,11-50,—,2013
Blumira,https://www.crunchbase.com/organization/blumira,"Jul 1, 2025","$42,900,000",Not Started,"Cyber Security, Information Technology, Network Security","Ann Arbor, Michigan, United States",Blumira is an end-to-end automated detection & response platform that simplifies and improves security for IT teams.,"4,265",https://www.blumira.com/,$1M to $10M,"Ten Eleven Ventures, Mercury, Array Ventures, M25, RPS Ventures","M25, Mercury, Ten Eleven Ventures",https://x.com/blumirasec,https://www.linkedin.com/company/blumira,51-100,"$15,000,000",2018
Syntis Bio,https://www.crunchbase.com/organization/syntis-bio,"Jul 1, 2025","$53,372,179",Not Started,"Health Care, Medical, Therapeutics","Boston, Massachusetts, United States","Syntis Bio operates as a late-stage preclinical company that develops oral therapies for obesity, diabetes, and rare diseases.","5,034",https://www.syntis.bio/,$1M to $10M,"Safar Partners, Cerberus Capital Management, Cerity Partners Ventures, National Institutes of Health, Bold Capital Partners","Cerberus Capital Management, National Institutes of Health",,https://www.linkedin.com/company/syntis-bio,11-50,"$33,000,000",2022
Icertis,https://www.crunchbase.com/organization/icertis,"Jul 1, 2025","$641,499,999",Not Started,"Artificial Intelligence (AI), Cloud Data Services, CRM, Procurement, SaaS","Bellevue, Washington, United States",Icertis is an AI-powered contract management platform that ensures compliance and minimizes risk.,"5,549",https://www.icertis.com/,$100M to $500M,"B Capital, Headline, Greycroft, SoftBank Vision Fund, Eight Roads Ventures","B Capital, Eight Roads Ventures, Greycroft, Ignition Partners, Meritech Capital Partners, Premji Invest, SAP, Silicon Valley Bank, SoftBank Vision Fund",https://x.com/Icertis,http://www.linkedin.com/company/icertis,1001-5000,"$75,000,000","Mar 27, 2009"
Genesis AI,https://www.crunchbase.com/organization/genesis-ai,"Jul 1, 2025","$105,000,000",Not Started,"Artificial Intelligence (AI), Robotics","Paris, Ile-de-France, France",Genesis AI operates as a physical AI lab and full-stack robotics company.,"5,556",https://genesis-ai.company/,—,"Bpifrance, HSG, Khosla Ventures, Eclipse Ventures, Drysdale Ventures","Eclipse Ventures, Khosla Ventures",,https://www.linkedin.com/company/gs-ai/about/,11-50,"$105,000,000",Dec 2024
Lightmatter,https://www.crunchbase.com/organization/lightmatter-inc,"Jul 1, 2025","$822,000,000",Not Started,"AI Infrastructure, Artificial Intelligence (AI), Data Center, Machine Learning, Semiconductor, Software","Mountain View, California, United States",Lightmatter develops photonic chips that enable data processing and communication using light instead of electricity.,"7,084",https://lightmatter.co/,—,"Lockheed Martin Ventures, Fidelity, Matrix, Hewlett Packard Enterprise, Spark Capital","Google Ventures, Matrix, Spark Capital, T. Rowe Price, Viking Global Investors",https://x.com/LightmatterCo,https://www.linkedin.com/company/lightmatter,251-500,—,"Sep 8, 2017"
Boba Network,https://www.crunchbase.com/organization/boba-network,"Jul 1, 2025","$115,000,000",Not Started,"Blockchain, Cryptocurrency, Ethereum","Palo Alto, California, United States",Boba Network is a Decentralized Autonomous Organization (DAO) and next-generation Ethereum Layer-2 Optimistic Rollup scaling solution.,"7,922",https://boba.network/,$1M to $10M,"TheVentureCity, Hack VC, BitMart, HTX, LD Capital","Awaken Foundation, LDA Capital, Valour",https://x.com/bobanetwork,https://www.linkedin.com/company/bobanetwork,11-50,"$70,000,000",2018
ArriVent,https://www.crunchbase.com/organization/arrivent-biopharma,"Jul 1, 2025","$455,000,000",Not Started,"Biotechnology, Life Science, Pharmaceutical","Pennsylvania Furnace, Pennsylvania, United States",ArriVent develops pharmaceutical products to cure presently untreatable cancer.,"8,794",https://arrivent.com/,$10M to $50M,"General Catalyst, HSG, Hillhouse Investment, Catalio Capital Management, OrbiMed","General Catalyst, Hillhouse Investment, Silicon Valley Bank, Sofinnova Investments",,https://www.linkedin.com/company/arrivent/,11-50,"$75,000,000",2021
d.light,https://www.crunchbase.com/organization/d-light-design,"Jul 1, 2025","$807,700,000",Not Started,"Energy, Manufacturing, Renewable Energy, Solar","Palo Alto, California, United States","d.light designs, manufactures, and distributes solar lighting and power products, particularly targeting off-grid communities.","8,956",http://www.dlight.com/,Less than $1M,"European Investment Bank, Nexus Venture Partners, Mirova, Nithio Holdings, Finnfund","African Frontier Capital, Auster Capital Partners, Beyond the Grid, BloombergNEF, Chapel Hill Denham, Developing World Markets, E3 Capital, European Investment Bank, Finnfund, Inspired Evolution Investment Management, KawiSafi Ventures, Mirova, Nexus Venture Partners, Norfund, Omidyar Network, Proparco, Rural Electrification Agency, Shell Foundation, SunFunder, Swedfund International, Trade and Development Bank -TDB",https://x.com/dlightdesign,http://www.linkedin.com/company/d-light-design,501-1000,"$300,000,000",2007
Deeto,https://www.crunchbase.com/organization/deeto,"Jul 1, 2025","$17,000,000",Not Started,"Advice, Apps, Artificial Intelligence (AI), Customer Service, Marketing","Tenafly, New Jersey, United States","Deeto provides an AI‑driven customer activation platform that automates sourcing, sharing customer testimonials, and reference engagement.","9,801",https://www.deeto.ai/,$1M to $10M,"Tal Ventures, Jump Capital, UpWest, TAU Ventures, at.inc/","Jump Capital, UpWest",https://x.com/Deeto_ai,https://www.linkedin.com/company/deetoai,11-50,"$12,500,000",Apr 2022
Kushner,https://www.crunchbase.com/organization/kushner-companies,"Jul 1, 2025","$1,315,000,000",Not Started,Real Estate,"New York, New York, United States",Kushner Companies is a diversified private real estate organization.,"10,080",https://kushner.com/,$100M to $500M,"Blackstone Group, Berkadia Commercial Mortgage","Berkadia Commercial Mortgage, Blackstone Group",,https://www.linkedin.com/company/kushner-companies/,1001-5000,"$515,000,000",1985
Radiology Partners,https://www.crunchbase.com/organization/radiology-partners,"Jul 1, 2025","$4,282,095,717",Not Started,"Health Care, Health Diagnostics, Hospital","El Segundo, California, United States",Radiology Partners is a healthcare service company providing radiology services.,"10,274",http://www.radpartners.com/,$1B to $10B,"New Enterprise Associates, Future Fund, Starr Investment Holdings","Future Fund, New Enterprise Associates, Starr Investment Holdings",https://x.com/rad_partners,https://www.linkedin.com/company/radiology-partners,1001-5000,"$2,300,000,000",2012
Healx,https://www.crunchbase.com/organization/healx,"Jul 1, 2025","$114,909,855",Not Started,"Artificial Intelligence (AI), Biopharma, Biotechnology, Health Care, Life Science, Medical","Cambridge, Cambridgeshire, United Kingdom",Healx is a rare disease biotechnology company that uses generative AI for drug discovery.,"10,383",https://healx.ai/,$10M to $50M,"Amadeus Capital Partners, Atomico, Balderton Capital, Intel Capital, b2venture","Amadeus Capital Partners, Atomico, Balderton Capital, Jonathan Milner, R42 Group, SCI Ventures",https://x.com/healx,https://www.linkedin.com/company/healx,51-100,—,2014
AeroVironment,https://www.crunchbase.com/organization/aerovironment,"Jul 1, 2025","$1,684,007,167",Not Started,"Aerospace, Air Transportation, Drones, Electric Vehicle, Electronics, Energy, Government, Manufacturing","Arlington, Virginia, United States",AeroVironment is a technology company specializing in unmanned aircraft systems and electric vehicle charging solutions.,"11,231",https://www.avinc.com/,$500M to $1B,—,—,https://x.com/aerovironment,http://www.linkedin.com/company/aerovironment,1001-5000,"$875,000,048",1971
Field Medical,https://www.crunchbase.com/organization/field-medical,"Jul 1, 2025","$89,000,000",Not Started,"Manufacturing, Medical, Medical Device","Cardiff By The Sea, California, United States","Field Medical helps physicians, cardiologists, and patients to achieve the best possible outcomes during cardiac ablation procedures.","11,868",https://www.fieldmedicalinc.com/,—,"BioStar Capital, CUE Growth Partners","BioStar Capital, CUE Growth Partners",https://x.com/Field_Medical_,https://www.linkedin.com/company/field-medical,1-10,"$35,000,000",2022
Columbus Crew SC,https://www.crunchbase.com/organization/columbus-crew-sc,"Jul 1, 2025","$90,000,000",Not Started,Sports,"Columbus, Ohio, United States",Columbus Crew SC is a sports team that participates in MLS Cup championship.,"11,937",https://www.columbuscrew.com/,$10M to $50M,Edwards Family office,Edwards Family office,https://x.com/columbuscrewsc,,101-250,"$90,000,000","Jun 15, 1994"
Civ Robotics,https://www.crunchbase.com/organization/civdrone,"Jul 1, 2025","$15,031,868",Not Started,"Civil Engineering, Commercial, Robotics","San Francisco, California, United States",Civdrone is a construction tech startup aiming to revolutionize land surveying.,"12,962",https://www.civrobotics.com/,$1M to $10M,"AlleyCorp, Newfund, ff Venture Capital, C2 Ventures, Drone Fund","AlleyCorp, Alley Robotics Ventures, Drone Fund, ff Venture Capital, GENIUS NY",,https://www.linkedin.com/company/civdrone/,11-50,"$7,500,000","Jan 1, 2018"
Macroscope,https://www.crunchbase.com/organization/prasso,"Jul 1, 2025","$40,000,000",Not Started,"Project Management, Software Engineering, Web Development","San Francisco, California, United States",Macroscope wants on-demand analytics to take the place of status meetings.,"13,257",http://www.prasso.ai/,—,"Lightspeed Venture Partners, Thrive Capital, Google Ventures, Adverb Ventures","Adverb Ventures, Google Ventures, Lightspeed Venture Partners, Thrive Capital",,https://www.linkedin.com/company/macroscopeai/,11-50,"$30,000,000","Jul 22, 2023"
Gigi,https://www.crunchbase.com/organization/ava-291d,"Jul 1, 2025","$8,750,000",Not Started,Software,"San Francisco, California, United States","Your network, working for you.","13,491",https://gigi.co/,—,"OpenAI, Sequoia Capital, Khosla Ventures, Outsized Ventures, MONASHEES","Khosla Ventures, MONASHEES, OpenAI, Sequoia Capital",,https://www.linkedin.com/company/gigi-ai,1-10,"$3,000,000",2023
GrowthBook,https://www.crunchbase.com/organization/growth-book,"Jul 1, 2025","$23,121,791",Not Started,"A/B Testing, B2B, Developer Tools, Software, Test and Measurement","Anaheim, California, United States",GrowthBook is an open source feature flagging and experimentation platform,"13,502",https://www.growthbook.io/,$1M to $10M,"Y Combinator, Nexus Venture Partners, Data Tech Fund","Nexus Venture Partners, Y Combinator",,https://www.linkedin.com/company/growthbook,11-50,"$22,621,791","Jul 3, 2020"
Wisq,https://www.crunchbase.com/organization/wisq,"Jul 1, 2025","$55,000,000",Not Started,"Apps, Artificial Intelligence (AI), Human Resources","Redwood City, California, United States",Wisq delivers an AI-powered platform tailored for enterprise HR teams.,"14,085",https://www.wisq.com/,$1M to $10M,"Norwest, Shasta Ventures, True Ventures, Stephen Hays","Norwest, True Ventures",,https://www.linkedin.com/company/wisq,11-50,"$15,000,000",2021
"Oka, The Carbon Insurance Company",https://www.crunchbase.com/organization/oka-the-carbon-insurance-company,"Jul 1, 2025","$19,580,000",Not Started,"Business Development, Credit, Insurance","Park City, Utah, United States","Oka, The Carbon Insurance Company's objective is to establish a more secure and open market for carbon credits.","14,134",https://carboninsurance.co/,—,"Aquiline Capital Partners, Firstminute Capital, Overview, Aquiline Technology Growth","Aquiline Capital Partners, Aquiline Technology Growth, Firstminute Capital, Overview",,https://www.linkedin.com/company/oka-the-carbon-insurance-company,11-50,"$2,580,000",2022
Ark Robotics,https://www.crunchbase.com/organization/ark-robotics,"Jul 1, 2025","$8,700,000",Not Started,"Drone Management, Military, Robotics","Tallinn, Harjumaa, Estonia",Ark Robotics is a technology company building core infrastructure for mass autonomous robotics and collaborative autonomy.,"15,900",https://ark-robotics.com/,—,—,—,,https://www.linkedin.com/company/arkrobotics,51-100,"$7,500,000",Jan 2024
Remark,https://www.crunchbase.com/organization/remark-ac50,"Jul 1, 2025","$26,300,000",Not Started,"Guides, Information Technology, Internet","New York, New York, United States",Remark is a product guidance startup for online stores that brings the in-store experience online.,"17,406",https://www.withremark.com/,—,"Stripe, Inspired Capital Partners, Neo, Shine Capital, Visible Ventures",Inspired Capital Partners,https://x.com/withremark,https://www.linkedin.com/company/withremark,11-50,"$16,000,000",2022
Atmanity,https://www.crunchbase.com/organization/atmanity,"Jul 1, 2025","$6,300,000",Not Started,"Artificial Intelligence (AI), Information Technology, Internet, Software","Santa Clara, California, United States",Atmanity provides AI software that allows people and organizations to create interactive digital avatars.,"19,225",https://www.atmanity.io/,—,"Forerunner, Recursive Ventures, GFR Fund, Hawktail Management, Addin Ventures",—,,https://www.linkedin.com/company/atmanity/,11-50,"$4,000,000","Oct 7, 2024"
Terrana Biosciences,https://www.crunchbase.com/organization/terrana-biosciences,"Jul 1, 2025","$50,000,000",Not Started,"Agriculture, Biotechnology, Health Care","Cambridge, Massachusetts, United States",Terrana's innovative technology platform uses RNA-based plant health solutions to enable resilient agriculture for a world.,"22,432",https://www.terranabio.com/,$10M to $50M,Flagship Pioneering,Flagship Pioneering,,https://www.linkedin.com/company/terrana-biosciences,11-50,"$50,000,000",2021
Heidmar,https://www.crunchbase.com/organization/heidmar-inc,"Jul 1, 2025","$32,400,000",Not Started,"Consulting, Information Technology","Norwalk, Connecticut, United States",Heidmar is a maritime company providing management services.,"24,060",http://heidmar.com/,$10M to $50M,B. Riley Financial,B. Riley Financial,,https://www.linkedin.com/company/heidmar/,101-250,"$12,400,000",1984
HerdDogg,https://www.crunchbase.com/organization/herddogg,"Jul 1, 2025","$21,304,295",Not Started,"AgTech, Livestock, Sustainability","Seward, Nebraska, United States",HerdDogg develops data-driven livestock management to help ranchers track health and proximity data from their herd.,"24,687",https://www.herddogg.com/,$1M to $10M,"Portland Seed Fund, Lever VC, Invest Nebraska, Innova Memphis, Serra Ventures","Serra Ventures, Sheldon Group, Wonder Fund North Dakota",https://x.com/HerdDoggHome,https://www.linkedin.com/company/herddogg,11-50,"$1,259,295","Nov 11, 2015"
Progyny,https://www.crunchbase.com/organization/progyny,"Jul 1, 2025","$315,549,451",Not Started,"Fertility, Health Care, Medical","New York, New York, United States",Progyny is a fertility benefits management company.,"25,549",https://www.progyny.com/,$1B to $10B,"Kleiner Perkins, SR One, JP Morgan Chase, TPG Biotech, M Ventures",JP Morgan Chase,https://x.com/Progyny,https://www.linkedin.com/company/progyny,501-1000,"$200,000,000",2008
Southern Water,https://www.crunchbase.com/organization/southern-water,"Jul 1, 2025","£1,205,000,000",Not Started,"Commercial, Water, Water Purification","Worthing, West Sussex, United Kingdom",Southern Water is a private utility company responsible for public wastewater collection and treatment.,"28,966",https://www.southernwater.co.uk/,$1B to $10B,Macquarie Asset Management,Macquarie Asset Management,https://x.com/southernwater,https://www.linkedin.com/company/southern-water/,1001-5000,"£655,000,000",1989
Resand Oy,https://www.crunchbase.com/organization/finn-recycling,"Jul 1, 2025","€16,000,000",Not Started,"Environmental Consulting, GreenTech, Recycling, Renewable Energy, Sustainability","Nuutajärvi, Western Finland, Finland",Resand Oy specializes in the reclamation and recycling of spent foundry sands and other industrial sands.,"29,075",https://resand.eu/,—,"Nefco, Finnish Climate Fund",Nefco,,https://www.linkedin.com/company/finn-recycling-oy/,51-100,"€5,000,000",2013
Del Monte Foods,https://www.crunchbase.com/organization/del-monte-foods,"Jul 1, 2025","$912,500,000",Not Started,"Food and Beverage, Organic Food, Retail","San Francisco, California, United States","Del Monte Foods is one of the country's largest and most well-known producers, distributors and marketers of premium quality, branded food","29,085",http://www.delmonte.com/,$1B to $10B,—,—,https://x.com/DelMonte,https://www.linkedin.com/company/dlm-foods,5001-10000,"$912,500,000",1916
Kerys Software,https://www.crunchbase.com/organization/kerys-software,"Jul 1, 2025","€6,200,000",Not Started,"Information Technology, Productivity Tools, Software","Palaiseau, Ile-de-France, France",Kerys Software is a Data Security Product Manufacturing firm developing secured virtualization tool for cases.,"29,097",https://kerys.software/,—,"Seedcamp, Daphni, Kima Ventures, IncubAlliance Paris-Saclay, Nicolas Steegmann","backtrace capital, Daphni, Seedcamp",https://x.com/keryssoftware,https://www.linkedin.com/company/kerys-software/,1-10,"€6,200,000",2024
Yuno,https://www.crunchbase.com/organization/yuno-9311,"Jul 1, 2025","€7,000,000",Not Started,"Audio, Edutainment, E-Learning","Berlin, Berlin, Germany",Yuno is an app that enhances their general knowledge by listening to short audio stories.,"30,134",https://www.get-yuno.com/,—,"468 Capital, IBB Ventures, Atlantic, Blast. Club, New Renaissance Ventures",Blast. Club,,https://www.linkedin.com/company/gaiali/,11-50,"€7,000,000",2020
Rocketable,https://www.crunchbase.com/organization/rocketable,"Jul 1, 2025","$6,500,000",Not Started,"Artificial Intelligence (AI), Software, Software Engineering","San Francisco, California, United States",Rocketable is a software holding company that acquires existing software products and operates them using AI agents.,"30,729",https://www.rocketable.com/,—,"Y Combinator, Unpopular Ventures, Rebel Fund, Seaplane Ventures",—,https://x.com/RocketableInc,https://www.linkedin.com/company/rocketable/,1-10,"$6,500,000",2023
Studenac,https://www.crunchbase.com/organization/studenac,"Jul 1, 2025","€340,000,000",Not Started,"Grocery, Retail","Omis, Splitsko-Dalmatinska, Croatia",Studenac operates as a retail chains with more than 360 stores and supermarkets.,"30,853",https://www.studenac.hr/,$500M to $1B,"European Bank for Reconstruction and Development, Bank Polska Kasa Opieki, ZaBa, OTP Bank, OTP Banka","Bank Polska Kasa Opieki, European Bank for Reconstruction and Development",,https://www.linkedin.com/company/studenac-market,5001-10000,"€300,000,000",1991
Carbyon,https://www.crunchbase.com/organization/carbyon,"Jul 1, 2025","$19,904,303",Not Started,"Carbon Capture, Energy, Renewable Energy, Semiconductor","Eindhoven, Noord-Brabant, The Netherlands",Carbyon is a Netherlands-based company that develops direct air capture (DAC) technologies.,"32,410",https://carbyon.com/,$1M to $10M,"Lowercarbon Capital, Invest-NL, Isai, XPRIZE, Innovation Industries","Innovation Industries, XPRIZE",https://x.com/carbyon,https://www.linkedin.com/company/carbyon,11-50,—,2019
Groove Quantum,https://www.crunchbase.com/organization/groove-quantum,"Jul 1, 2025","€10,000,000",Not Started,Quantum Computing,"Delft, Zuid-Holland, The Netherlands",Groove Quantum is a company that develops germanium-based quantum computing technology.,"33,224",https://groovequantum.com/,—,"Verve Ventures, Innovation Industries, European Innovation Council, 55 North",European Innovation Council,,https://www.linkedin.com/company/groove-quantum/,1-10,"€7,500,000",2024
Seenons,https://www.crunchbase.com/organization/seenons,"Jul 1, 2025","€16,000,000",Not Started,"Recycling, Software, Waste Management","Amsterdam, Noord-Holland, The Netherlands",Seenons is a technology company that uses IT solutions and smart logistics for circular waste management.,"33,767",https://seenons.com/,$10M to $50M,"Invest-NL, Fortino Capital, CapitalT, Swiss Post, Shamrock Ventures","CapitalT, Fortino Capital, Tablomonto Ventures",,https://www.linkedin.com/company/seenons,51-100,—,"Nov 24, 2019"
