Organization Name,CrunchBase URL,Last Funding Date,Total Funding Amount,Stage,Industries,Headquarters Location,Description,CB Rank (Company),Website,Estimated Revenue Range,Top 5 Investors,Lead Investors,Twitter,LinkedIn,Number of Employees,Last Funding Amount,Founded Date
Hexium,https://www.crunchbase.com/organization/hexium,"Jul 21, 2025","$25,054,991",Not Started,"Energy, Energy Storage, Renewable Energy","Austin, Texas, United States",Hexium enriches isotopes for next-gen reactors using LLNL AVLIS including Lithium and Uranium,"21,637",https://www.hexium.com/,—,"MaC Venture Capital, Refactor, R7 Partners, Overture Ventures, Julian Capital","MaC Venture Capital, Refactor",,https://www.linkedin.com/company/hexiuminc/,11-50,"$13,000,000",2023
Eventual,https://www.crunchbase.com/organization/eventual-375b,"Jul 21, 2025","$7,499,992",Not Started,"InsurTech, Machine Learning, Property Insurance, Real Estate, Software","New York, New York, United States",Eventual is an insurtech company that builds software and markets to protect real estate owners from climate risks.,"21,809",https://eventualclimate.com/,$1M to $10M,"AlleyCorp, Upfront Ventures, Clocktower Technology Ventures, Kindergarten Ventures, Harvest Venture Partners","AlleyCorp, Upfront Ventures",,https://www.linkedin.com/company/eventualclimate,1-10,"$4,999,992","Oct 30, 2023"
Sunsave,https://www.crunchbase.com/organization/sunsave,"Jul 21, 2025","£122,200,000",Not Started,"Energy, Energy Storage, Solar","London, England, United Kingdom",Sunsave is a subscription-based platform that helps households to save solar battery system.,"21,849",https://www.sunsave.energy/,—,"Plug and Play, Norrsken VC, Credit Agricole CIB, Clearance Venture Partners, Michael Spencer","Credit Agricole CIB, IPGL, Norrsken VC",,https://www.linkedin.com/company/sunsaveuk,11-50,"£100,000,000",2021
SAB Biotherapeutics,https://www.crunchbase.com/organization/sab-biotherapeutics,"Jul 21, 2025","$361,320,000",Not Started,"Biotechnology, Clinical Trials, Therapeutics","Sioux Falls, South Dakota, United States",SAB Biotherapeutics is a clinical-stage biopharmaceutical development company.,"23,497",https://www.sab.bio/,$10M to $50M,"RA Capital Management, Sanofi, Vivo Capital, RTW Investments, Commodore Capital","National Institutes of Health, RA Capital Management, Sioux Falls Development Foundation, South Dakota Equity Partners, U.S. Department of Defense",https://x.com/SABBantibody,https://www.linkedin.com/company/sab-biotherapeutics/,51-100,"$175,000,000",Jun 2014
Cambridge Terahertz,https://www.crunchbase.com/organization/cambridge-terahertz,"Jul 21, 2025","$12,011,451",Not Started,"Business Development, Information Technology, Internet, SaaS","Cambridge, Massachusetts, United States","Cambridge Terahertz is a technology company that offers SaaS applications, REST APIs, and 3D imaging systems.","23,889",https://thzcorp.com/,—,"Felicis, SBXi, Amazon Industrial Innovation Fund, Vishal Rao",Felicis,,https://www.linkedin.com/company/thzcorp,1-10,"$12,011,451",2023
Travel Curious,https://www.crunchbase.com/organization/travel-curious,"Jul 21, 2025","$32,573,262",Not Started,"B2B, Hospitality, Hotel, Information Technology, Loyalty Programs, Software, Tourism, Travel","Dover, Delaware, United States","Travel Curious operates a travel tech platform connecting brands to tours, activities, experiences, and ancillary services.","27,626",https://travelcuriousgroup.com/,$1M to $10M,"SyndicateRoom, KM Capital, Claudio Chiaromonte, Angela Skelly, Mario Bodini","Claudio Chiaromonte, KM Capital",https://x.com/travelcurious1,https://www.linkedin.com/company/travelcurious/,51-100,"$30,508,262","Sep 18, 2018"
CUDDLY,https://www.crunchbase.com/organization/poundwishes-inc-,"Jul 21, 2025","$20,380,000",Not Started,"Consumer Goods, Crowdfunding, E-Commerce, Marketplace, Pet","Grapevine, Texas, United States",CUDDLY is building the largest rescue and shelter feeding program in the country,"28,632",http://www.cuddly.com/,$10M to $50M,"Lead Edge Capital, RevTek Capital, Montage Capital, Greg Kidd, John Hussey","Frank Suryan, John Hussey, Lead Edge Capital, Montage Capital, RevTek Capital",https://x.com/welovecuddly,https://www.linkedin.com/company/cuddly/,11-50,"$2,000,000","Jan 1, 2014"
Beitel Group,https://www.crunchbase.com/organization/beitel-group,"Jul 21, 2025","$305,000,000",Not Started,"Property Development, Real Estate, Real Estate Investment","Brooklyn, New York, United States",Beitel Group is a SFO focused on acquiring multifamily and retail properties with substantial upside while pursuing a value-add strategy.,"33,195",https://beitel.com/,$1M to $10M,SCALE Lending,SCALE Lending,,https://www.linkedin.com/company/besyata-investment-group/,11-50,"$305,000,000","Jul 1, 2016"
Cosmic Shielding Corporation,https://www.crunchbase.com/organization/cosmic-shielding-corporation,"Jul 21, 2025","$10,425,000",Not Started,"Advanced Materials, Simulation, Space Travel","Atlanta, Georgia, United States",Making space safe with world leading & mission proven nanocomposite radiation shielding materials,"34,859",https://cosmicshielding.com/,$1M to $10M,"Seraphim Space, Type One Ventures, Outsiders Fund, Starbridge Venture Capital, SpaceFund","Outsiders Fund, SpaceFund",,https://www.linkedin.com/company/cosmic-shielding-corporation/?viewAsMember=true,11-50,"$4,000,000",Jan 2021
Qpoint,https://www.crunchbase.com/organization/qpoint-bc30,"Jul 21, 2025","$15,509,996",Not Started,"Analytics, Information Technology, Intelligent Systems, Real Time, Software","Oakland, California, United States",Qpoint is an egress observability and security platform.,"35,053",https://www.qpoint.io/,$1M to $10M,"Scribble Ventures, Bloomberg Beta, Mango Capital, Preface Ventures",Mango Capital,https://x.com/qpoint_io,https://www.linkedin.com/company/qpoint-io,1-10,"$9,419,996","Jul 19, 2022"
Arkansas Research Alliance,https://www.crunchbase.com/organization/arkansas-research-alliance,"Jul 21, 2025","$8,000,000",Not Started,"Consulting, Market Research, Non Profit, Recruiting","Conway, Arkansas, United States",Arkansas Research Alliance provides research in drug development and cutting edge membrane technology.,"43,187",https://aralliance.org/,Less than $1M,National Science Foundation,National Science Foundation,https://x.com/ARAllianceOrg,https://www.linkedin.com/company/arkansas-research-alliance/,1-10,"$8,000,000",2008
MidlandHeart,https://www.crunchbase.com/organization/midlandheart,"Jul 21, 2025","£100,000,000",Not Started,Non Profit,"Birmingham, Birmingham, United Kingdom",MidlandHeart is a non-profit organization that transforms lives and communities by providing homes and housing-related care and support.,"56,644",http://www.midlandheart.org.uk/,$50M to $100M,NatWest,NatWest,https://x.com/midhearthelp,https://www.linkedin.com/company/midland-heart,5001-10000,"£100,000,000",1925
VOOL,https://www.crunchbase.com/organization/vool,"Jul 21, 2025","€9,420,000",Not Started,"Battery, Electronics","Tallinn, Harjumaa, Estonia","VOOL is an EV charging solution that provides business and private customers with dependable, smart, and cost-effective charging.","58,951",https://www.vool.com/,$1M to $10M,"Specialist VC, Startup Wise Guys, European Union, Alexela, Amalfi Capital","Alexela, European Union, Specialist VC",,https://www.linkedin.com/company/wearevool,11-50,"€1,500,000",2018
Berri Fit,https://www.crunchbase.com/organization/berri-pro,"Jul 21, 2025","$8,427,460",Not Started,"Food and Beverage, Food Processing, Organic Food","Santa Monica, California, United States","Berri Fit provides quality organic, plant-based nutrition for individuals and families worldwide.","68,238",https://berriorganics.com/,$1M to $10M,Red Bear Angels,—,https://x.com/berripro,https://www.linkedin.com/company/berri-pro,1-10,"$999,999",2015
Zero Point Five Therapeutics,https://www.crunchbase.com/organization/zero-point-five-therapeutics,"Jul 21, 2025","$11,554,937",Not Started,"Health Care, Pharmaceutical, Therapeutics","Potomac, Maryland, United States",Zero Point Five Therapeutics develops drugs to treat soil-transmitted helminthiasis.,"70,259",http://zeropointfivetherapeutics.com/,—,"Portfolia, TEDCO","Portfolia, TEDCO",,,—,"$35,000",2018
Comtech,https://www.crunchbase.com/organization/comtech-telecommunications,"Jul 21, 2025","$480,000,000",Not Started,"Developer Platform, Information Technology, Internet, Manufacturing, Public Relations, Telecommunications, Wireless","Melville, New York, United States","Comtech is a prominent technological business in satellite, space, terrestrial, and wireless communications.","76,180",https://comtech.com/,$500M to $1B,"U.S. Department of Defense, Magnetar Capital, White Hat Capital Partners","Magnetar Capital, U.S. Department of Defense, White Hat Capital Partners",https://x.com/comtechtel,http://www.linkedin.com/company/comtech-telecommunications-corp,1001-5000,"$35,000,000",1967
DiaMedica,https://www.crunchbase.com/organization/diamedica,"Jul 21, 2025","$167,336,962",Not Started,"Biopharma, Biotechnology, Health Care, Therapeutics","Minneapolis, Minnesota, United States",DiaMedica is a biopharmaceutical company that focuses on developing treatments for stroke.,"80,117",http://www.diamedica.com/,$1M to $10M,"Trill Impact, Fosun Pharma, SK Group, Hermed Capital, TomEnterprise Private",Hermed Capital,https://x.com/diamedica,https://www.linkedin.com/company/diamedica,11-50,"$30,100,000","Jan 1, 2000"
CODAN US Corporation,https://www.crunchbase.com/organization/codan-usa,"Jul 21, 2025","$27,697,880",Not Started,"Health Care, Manufacturing, Medical Device","Santa Ana, California, United States",CODAN US Corporation is recognized as a manufacturer and distributor of medical devices for infusion and transfusion therapy.,"81,836",https://www.codanusa.com/,$10M to $50M,—,—,,https://www.linkedin.com/company/codan-usa/,1001-5000,"$27,697,880",1939
Advicenne,https://www.crunchbase.com/organization/advicenne,"Jul 21, 2025","$49,249,237",Not Started,"Biotechnology, Medical, Pharmaceutical, Therapeutics","Paris, Ile-de-France, France",Advicenne is a specialty pharmaceutical company dedicated to improving the lives of patients who suffer from rare kidney diseases.,"87,005",http://advicenne.com/,$1M to $10M,"European Investment Bank, Bpifrance, BNP Paribas, IXO Private Equity, IRDI","Bpifrance, Cemag Invest, European Investment Bank, IRDI, MI Care",,https://www.linkedin.com/company/advicenne-pharma-sa/about/,11-50,"€2,600,000",2007
Amon Maritime,https://www.crunchbase.com/organization/amon-maritime,"Jul 21, 2025","NOK180,000,000",Not Started,"Marine Technology, Marine Transportation","Sandefjord, Vestfold, Norway","Amon Maritime is a maritime project development company, working with leading technology, commercial, and financial partners.","90,735",https://www.amonmaritime.com/,$1M to $10M,Enova,Enova,,https://www.linkedin.com/company/amon-maritime/,1-10,"NOK180,000,000",2019
IDEX,https://www.crunchbase.com/organization/idex-asa,"Jul 21, 2025","NOK466,314,260",Not Started,"Biometrics, Information Technology, Sensor, Software","Fornebu, Akershus, Norway",Biometrics Software & Fingerprint Sensor,"100,077",https://www.idexbiometrics.com/,Less than $1M,—,—,https://x.com/idexasa,https://www.linkedin.com/company/idexbiometrics/,11-50,"NOK15,614,260",1996
Yolo Tech Insurance,https://www.crunchbase.com/organization/yolo-insurance,"Jul 21, 2025","$36,994,200",Not Started,"FinTech, Insurance, InsurTech","Milan, Lombardia, Italy",Yolo Tech Insurance is an insurance platform that offers financial services.,"133,998",https://yolo-insurance.com/,$1M to $10M,"Primo Capital, Neva SGR, Generali Group, CRiF, Reale Group","Generali Group, Neva SGR, Primo Capital",,https://www.linkedin.com/company/yolo-tech-insurance/,51-100,"€2,200,000",2017
Verici Dx,https://www.crunchbase.com/organization/verici-dx,"Jul 21, 2025","£5,880,000",Not Started,Health Care,"New York, New York, United States","Verici Dx is a health care company that conducts tests, tracks the overall records, and journey of kidney transplant patients.","146,313",https://vericidx.com/,$1M to $10M,"Harwood Capital Management, Sara Barrington, Julian Baines, Sir Ian Carruthers, David Anderson",—,https://x.com/vericidx,https://www.linkedin.com/company/verici-dx/,11-50,"£5,880,000",2020
ENGIE Romania,https://www.crunchbase.com/organization/engie-romania-sa,"Jul 21, 2025","€90,000,000",Not Started,"Energy, Oil and Gas, Sustainability","Bucharest, Bucuresti, Romania",ENGIE is a leading world group that provides low-carbon energy,"150,689",https://www.engie.ro/,$10B+,European Bank for Reconstruction and Development,European Bank for Reconstruction and Development,https://x.com/ENGIEgroup,https://www.linkedin.com/company/engie/,1001-5000,"€90,000,000",1975
NuCana BioMed,https://www.crunchbase.com/organization/nucana-biomed,"Jul 21, 2025","$280,156,334",Not Started,"Biotechnology, Medical, Therapeutics","Edinburgh, Edinburgh, City of, United Kingdom","NuCana BioMed, a biopharmaceutical company, develops and commercializes rationally designed medicines for significant unmet medical needs.","168,884",http://www.nucanabiomed.com/,$1M to $10M,"Sofinnova Partners, Abingworth, Sofinnova Investments, Scottish Enterprise, Morningside","Abingworth, Sofinnova Investments, Sofinnova Partners",https://x.com/NuCana_news,http://www.linkedin.com/company/nucana-biomed-ltd,11-50,"£19,000,000",1997
Miter,https://www.crunchbase.com/organization/miter-057c,"Jul 19, 2025","$50,000,000",Not Started,"Construction, Human Resources, Software","San Francisco, California, United States","Miter provides human capital management, field operations, and expense management platform for the construction industry.","7,025",https://www.miter.com/,$10M to $50M,"Pear VC, Bessemer Venture Partners, Coatue, Battery Ventures","Bessemer Venture Partners, Coatue",https://x.com/miterhr,https://www.linkedin.com/company/miterhr,51-100,"$50,000,000",2021
Radical AI,https://www.crunchbase.com/organization/radical-ai,"Jul 18, 2025","$55,000,000",Not Started,"Advanced Materials, Artificial Intelligence (AI), Manufacturing","New York, New York, United States",Radical AI develops and applies artificial intelligence and automated laboratory systems to accelerate materials research and discovery.,"3,415",https://www.radical-ai.com/,—,"Alumni Ventures, NVentures, AlleyCorp, Eni, noa",RTX Ventures,,https://www.linkedin.com/company/radicalai/,11-50,"$55,000,000",2024
Trucordia,https://www.crunchbase.com/organization/pcf-insurance,"Jul 18, 2025","$5,500,000,000",Not Started,"Health Insurance, Insurance, Life Insurance","Lindon, Utah, United States",Trucordia a full-service insurance brokerage firm which provides complete risk management solutions.,"6,204",https://trucordia.com/,—,"Blue Owl, Crescent Capital Group, The Carlyle Group, Blue Owl Capital Corporation, HGGC","Blue Owl, HGGC, The Carlyle Group",,https://www.linkedin.com/company/pcfinsuranceservices,5001-10000,"$2,900,000,000",1998
BrightAI,https://www.crunchbase.com/organization/brightai,"Jul 18, 2025","$66,000,000",Not Started,"Artificial Intelligence (AI), Cloud Computing, Internet of Things, Mobile","San Francisco, California, United States",BrightAI provides physical AI solutions for infrastructure and services.,"7,036",https://www.bright.ai/,$100M to $500M,"BoxGroup, Khosla Ventures, Inspired Capital Partners, Upfront Ventures, Cooley","Inspired Capital Partners, Khosla Ventures, Upfront Ventures",,https://www.linkedin.com/company/brightai,51-100,"$51,000,000",2020
Alt,https://www.crunchbase.com/organization/alt-xyz,"Jul 18, 2025","$146,010,000",Not Started,"Finance, Financial Services, FinTech, Lending, Marketplace","San Francisco, California, United States","Alt is an online marketplace that enables users to buy, sell, and vault authenticated trading cards.","7,452",https://www.alt.xyz/,$10M to $50M,"BoxGroup, SV Angel, First Round Capital, Shrug Capital, Trinity Capital","Max Mullen, Seven Seven Six, Spearhead, Trinity Capital",https://x.com/altxyzofficial,https://www.linkedin.com/company/altxyzofficial,101-250,"$40,000,000",2020
Queen's University Belfast,https://www.crunchbase.com/organization/queens-university-belfast,"Jul 18, 2025","£14,550,000",Not Started,"Education, Higher Education, Universities","Belfast, Belfast, United Kingdom",Queen's University Belfast is a public research university that offers undergraduate and postgraduate programs.,"7,968",http://www.qub.ac.uk/,$1M to $10M,"Innovate UK, UK Research and Innovation","Innovate UK, UK Research and Innovation",https://x.com/qubelfast,https://www.linkedin.com/company/queen's-university-belfast,1001-5000,"£4,350,000",1845
KLA,https://www.crunchbase.com/organization/kla-tencor,"Jul 18, 2025","$758,383,129",Not Started,"Automotive, Environmental Consulting, Information Technology","Milpitas, California, United States",KLA is a distributor of process control and yield management solutions that offers learning and knowledge services for its users.,"10,199",https://www.kla.com/,$10B+,Cardiff Capital Region,Cardiff Capital Region,https://x.com/klacorp,https://in.linkedin.com/company/kla-tencor,10001+,"£6,250,000",1976
BlackSkyTechnology,https://www.crunchbase.com/organization/blacksky-global,"Jul 18, 2025","$440,400,000",Not Started,"Aerospace, Enterprise Software, Real Time","Seattle, Washington, United States",BlackSky Technology is a satellite-imaging-as-a-service startup.,"12,104",https://www.blacksky.com/,$100M to $500M,"Tiger Global Management, RRE Ventures, Mithril Capital Management, Senator Investment Group, Intelsat","Intelligence Advanced Research Projects Activity, Intelsat, RRE Ventures",https://x.com/blacksky_inc,https://www.linkedin.com/company/blacksky-global,251-500,"$160,000,000",2013
Phospholutions,https://www.crunchbase.com/organization/phospholutions,"Jul 18, 2025","$32,500,000",Not Started,"Agriculture, Horticulture, Sustainability","State College, Pennsylvania, United States",Phospholutions developed a patented technology to alleviate the environmental impact of phosphorus fertilizer.,"14,927",https://www.phospholutions.com/,$10M to $50M,"CityRock Venture Partners, Advantage Capital, UPL, Ag Ventures Alliance, Tekfen Ventures","1855 Capital Partners, Advantage Capital, Continental Grain Company, Maumee Ventures",https://x.com/phospholutions?s=20,https://www.linkedin.com/company/phospholutions/,11-50,—,2016
University of Strathclyde,https://www.crunchbase.com/organization/university-of-strathclyde,"Jul 18, 2025","£24,694,420",Not Started,"Education, Higher Education, Universities","Glasgow, Glasgow City, United Kingdom",The University of Strathclyde is a public research university that offers undergraduate and postgraduate programs for various disciplines.,"15,406",http://www.strath.ac.uk/,$500M to $1B,"Catapult, UK Research and Innovation, UK Space Agency, UK Department for Transport, The Wolfson Foundation","Catapult, The Wolfson Foundation, UK Department for Transport, UK Research and Innovation, UK Space Agency",https://x.com/unistrathclyde,https://www.linkedin.com/school/university-of-strathclyde,1001-5000,"£4,350,000",1796
Ivy Tech Community College,https://www.crunchbase.com/organization/ivy-tech-community-college-of-indiana,"Jul 18, 2025","$29,340,000",Not Started,"Higher Education, Universities","Indianapolis, Indiana, United States",Ivy Tech Community College of Indiana is a school.,"23,560",http://www.ivytech.edu/,$100M to $500M,"JP Morgan Chase, Lilly Endowment, US Department of Commerce, Economic Development Administation, The Duke Energy Foundation, U.S. Department of Labor","Indiana Economic Development Association, Lilly Endowment, Lowe's Foundation, Richard M. Fairbanks Foundation, The Duke Energy Foundation, US Department of Commerce, Economic Development Administation, U.S. Department of Labor",https://x.com/IvyTechCC,https://www.linkedin.com/company/ivy-tech-community-college,5001-10000,—,1963
ReadySet Surgical,https://www.crunchbase.com/organization/readyset-surgical,"Jul 18, 2025","$15,368,715",Not Started,"Cloud Data Services, Health Care, Hospital, Logistics, Medical Device, SaaS, Supply Chain Management","Cleveland, Ohio, United States",​ReadySet Surgical is a healthcare technology company specializing in surgical supply chain processes for hospitals and surgery centers.,"30,343",https://readysetsurgical.com/,$1M to $10M,"Rev1 Ventures, CincyTech, JumpStart Inc., Plymouth Growth, Connetic Ventures","CincyTech, JumpStart Inc., Plymouth Growth, Rev1 Ventures",https://x.com/ReadySetCLE,https://www.linkedin.com/company/readyset-surgical/,11-50,"$2,274,996",2015
Solynta,https://www.crunchbase.com/organization/solynta,"Jul 18, 2025","€59,560,000",Not Started,"Agriculture, AgTech, Biotechnology","Wageningen, Gelderland, The Netherlands","Solynta is a breeding and biotechnology company based in Wageningen, the Netherlands.","31,412",http://www.solynta.com/,$1M to $10M,"European Investment Bank, Innovation Industries, Fortissimo Capital, EISMEA",European Investment Bank,,https://www.linkedin.com/company/solynta/,51-100,"€20,000,000","Sep 14, 2007"
EnBW,https://www.crunchbase.com/organization/enbw,"Jul 18, 2025","€4,800,000,000",Not Started,"Energy, Energy Management, Service Industry","Karlsruhe, Baden-Wurttemberg, Germany",EnBW is rank among the largest energy supply companies in Germany.,"32,828",https://www.enbw.com/,$10B+,"BBVA, Commerzbank, BNP Paribas CIB, Baden-Württemberg, Zweckverband Oberschwäbische Elektrizitätswerke","Baden-Württemberg, Zweckverband Oberschwäbische Elektrizitätswerke",https://x.com/EnBW,https://www.linkedin.com/company/18490,10001+,"€500,000,000",1997
Community College of Rhode Island,https://www.crunchbase.com/organization/community-college-of-rhode-island,"Jul 18, 2025","$12,095,398",Not Started,"EdTech, Education, Health Care, Higher Education","Warwick, Rhode Island, United States",Community College of Rhode Island is a school in Warwick.,"33,481",http://www.ccri.edu/,$50M to $100M,"U.S. Department of Education, Strada Education Network, HarborOne Foundation, Lowe's Foundation","HarborOne Foundation, Lowe's Foundation, Strada Education Network, U.S. Department of Education",https://x.com/CCRINews,https://www.linkedin.com/edu/school?id=20182,501-1000,"$1,000,000",1964
Broadstreet Partners,https://www.crunchbase.com/organization/broadstreet-partners,"Jul 18, 2025","$100,000,000",Not Started,"Angel Investment, Consulting, Finance, Financial Services, Small and Medium Businesses","Columbus, Ohio, United States",Broadstreet Partners is a brokerage firm that focuses on investment and acquisitions with agencies for their financial support.,"40,742",https://broadstreetcorp.com/,$1M to $10M,"T. Rowe Price, BCI, Penfund, Ethos Capital, White Mountains Insurance Group","BCI, Ethos Capital, Penfund, White Mountains Insurance Group",,https://www.linkedin.com/company/broadstreetcorp/,501-1000,—,2001
HighPoint Partners LLC,https://www.crunchbase.com/organization/highpoint-partners-llc,"Jul 18, 2025","$100,655,440",Not Started,"Energy, Mineral, Oil and Gas","San Antonio, Texas, United States",HighPoint Midstream is an Oil and Gas company that owns and operates traditional energy midstream assets.,"41,013",https://highpointllc.com/,—,—,—,,https://www.linkedin.com/company/highpointmidstream,1-10,"$100,655,440",2022
GRI Renewable Industries,https://www.crunchbase.com/organization/gri-renewable-industries,"Jul 18, 2025","€140,000,000",Not Started,"Industrial Manufacturing, Machinery Manufacturing, Manufacturing, Renewable Energy","Madrid, Madrid, Spain","GRI Renewable Industries is a manufacturer of towers, castings, and flanges for the wind energy sector.","46,100",https://www.gri.com.es/,$1B to $10B,"Cofides, Sumitomo Mitsui Banking Corporation, Bank Polska Kasa Opieki, Narodowy Fundusz Ochrony Środowiska i Gospodarki Wodnej",Cofides,https://x.com/GRIRenInd,https://www.linkedin.com/company/gri-renewable-industries/,5001-10000,"€140,000,000",2008
Encevo,https://www.crunchbase.com/organization/encevo,"Jul 18, 2025","€200,000,000",Not Started,"Energy, Renewable Energy, Solar","Esch-sur-alzette, Luxembourg, Luxembourg",Encevo Group is a provider of electricity and gas transmission as well as power generation including renewables.,"47,328",https://www.encevo.eu/en/,$1B to $10B,China Southern Power Grid,China Southern Power Grid,,https://www.linkedin.com/company/encevo-s-a/,1001-5000,"€200,000,000",2009
Lite Strategy,https://www.crunchbase.com/organization/mei-pharma,"Jul 18, 2025","$260,363,344",Not Started,"Biopharma, Biotechnology, Medical, Oncology","San Diego, California, United States",Lite Strategy is a oncology company focuses on the clinical development of novel therapies for cancer.,"56,364",https://litestrategy.com/,$10M to $50M,"RA Capital Management, Vivo Capital, New Enterprise Associates, Perceptive Advisors, Hivemind Capital Partners","CAM Capital, GSR, Litecoin Foundation, New Leaf Venture Partners, Vivo Capital",https://x.com/LiteStrategy,https://www.linkedin.com/company/litestrategy/about/,11-50,"$100,000,000",2000
IRLAB Therapeutics,https://www.crunchbase.com/organization/irlab-therapeutics,"Jul 18, 2025","$37,454,593",Not Started,"Health Care, Therapeutics","Göteborg, Vastra Gotaland, Sweden",IRLAB Therapeutics is a drug discovery and development company providing novel treatments for disorders of the brain.,"58,688",http://www.irlab.se/,$1M to $10M,"Michael J. Fox Foundation, New Leaf Venture Partners, EISMEA, Fenja Capital, Quiq Holding","Fenja Capital, Michael J. Fox Foundation, New Leaf Venture Partners",,https://www.linkedin.com/company/irlab-therapeutics-ab,11-50,"SEK115,700,000",2013
