Organization Name,CrunchBase URL,Last Funding Date,Total Funding Amount,Stage,Industries,Headquarters Location,Description,CB Rank (Company),Website,Estimated Revenue Range,Top 5 Investors,Lead Investors,Twitter,LinkedIn,Number of Employees,Last Funding Amount,Founded Date
Scottish Power,https://www.crunchbase.com/organization/scottish-power-plc,"May 8, 2025","£1,350,000,000",Not Started,Energy,"Glasgow, Glasgow City, United Kingdom",ScottishPower are amongst the top 6 power companies in the UK.,"122,200",https://www.scottishpower.com/,$1B to $10B,"Bank of America, BNP Paribas, National Wealth Fund, Banco Sabadell, NatWest",Bank of America,https://x.com/sp_energypeople,https://www.linkedin.com/company/5303,10001+,"£1,350,000,000","Apr 1, 1989"
IDACORP,https://www.crunchbase.com/organization/idacorp,"May 8, 2025","$709,999,987",Not Started,"Electrical Distribution, Energy, Financial Services, Real Estate","Boise, Idaho, United States",IDACORP is a holding company formed in 1998.,"133,573",http://idacorpinc.com/,$1B to $10B,—,—,https://x.com/idahopower,https://www.linkedin.com/company/idahopower/,1001-5000,"$450,000,000",1915
Persona AI,https://www.crunchbase.com/organization/persona-ai,"May 7, 2025","$27,000,000",Not Started,"Artificial Intelligence (AI), Robotics","Houston, Texas, United States",Persona AI is a robotics company that provides robotic solutions.,"2,087",https://personainc.ai/,$1M to $10M,"Tola Capital, SGH CAPITAL, K2 Global, Fathom Fund, Zero Infinity Partners","SGH CAPITAL, Tides Ventures, Unity Growth Fund LLC",,https://www.linkedin.com/company/persona-humanoids-at-work,11-50,"$27,000,000",2024
Carta Healthcare,https://www.crunchbase.com/organization/carta-healthcare,"May 7, 2025","$60,550,000",Not Started,"Delivery, Health Care, Hospital, Machine Learning","San Francisco, California, United States",Carta Healthcare empowers hospitals to personalize the delivery of care to the individual needs of each patient.,"3,833",http://www.carta.healthcare/,Less than $1M,"Maverick Ventures, Frist Cressey Ventures, MaC Venture Capital, Storm Ventures, Mass General Brigham","Memorial Hermann Foundation, Paramark Ventures, Storm Ventures, UnityPoint Health, UPMC Enterprises",https://x.com/carta_ai,https://www.linkedin.com/company/cartahealthcare,51-100,"$18,250,000",2017
Inductive Bio,https://www.crunchbase.com/organization/inductive-bio,"May 7, 2025","$29,300,000",Not Started,"Biotechnology, Medical","San Francisco, California, United States","Inductive Bio provides the information, machine learning, tools, and know-how required to resolve ADMET issues.","4,397",https://www.inductive.bio/,—,"Andreessen Horowitz, Bessemer Venture Partners, Obvious Ventures, S32, Lux Capital","Andreessen Horowitz, Lux Capital, Obvious Ventures",,https://www.linkedin.com/company/inductive-bio/about/,1-10,"$25,000,000",2022
Wonderskin,https://www.crunchbase.com/organization/wonderskin,"May 7, 2025","$50,000,000",Not Started,"Beauty, Cosmetics, E-Commerce, Retail","Fair Lawn, New Jersey, United States","Wonderskin is a beauty brand specializing in makeup and skincare products, including lip stains, eyeliners, and skincare solutions.","5,720",https://wonderskin.com/,$1M to $10M,Insight Partners,Insight Partners,https://x.com/wonderskin,https://www.linkedin.com/company/wonderskinllc,11-50,"$50,000,000",2020
Lumilens,https://www.crunchbase.com/organization/lumilens,"May 7, 2025","$145,703,111",Not Started,"Manufacturing, Product Design, Telecommunications","Belmont, California, United States",Lumilens creates photonics products designed for high-performance computing.,"8,083",https://www.lumilens.com/,—,"Mayfield Fund, AIspace Ventures, Accton Technology",Accton Technology,,https://www.linkedin.com/company/lumilens,11-50,"$115,703,111",2024
Foundation Alloy,https://www.crunchbase.com/organization/foundation-alloy,"May 7, 2025","$24,407,963",Not Started,"Industrial, Manufacturing, Product Design","Cambridge, Massachusetts, United States",Foundation Alloy is a vertically integrated metal part production platform.,"9,115",https://www.foundationalloy.com/,—,"Alumni Ventures, Safar Partners, America’s Frontier Fund, Material Impact, Yamaha Motor Ventures","Material Impact, The Engine",,https://www.linkedin.com/company/foundationalloy,11-50,"$7,500,000",2022
TSOLife,https://www.crunchbase.com/organization/tsolife,"May 7, 2025","$53,470,827",Not Started,"Elder Care, Information Technology, Software","Tampa, Florida, United States",TSOLife is a technology startup focused on preserving personal legacies and stories for future generations.,"10,222",https://tsolife.com/,$1M to $10M,"Florida Funders, DeepWork Capital, PeakSpan Capital, Omega Healthcare Investors, Third Act Ventures","Arnie Whitman, PeakSpan Capital",https://x.com/TSOLife_,https://www.linkedin.com/company/tsolife-llc,11-50,"$43,000,000",2014
Impact Analytics,https://www.crunchbase.com/organization/impact-analytics-3,"May 7, 2025","$76,749,982",Not Started,"Analytics, Artificial Intelligence (AI), Big Data, Machine Learning, Management Consulting","Linthicum Heights, Maryland, United States",Impact Analytics provides AI-native SaaS solutions and consulting services to help companies strategize and implement data-driven decisions.,"11,019",http://www.impactanalytics.co/,$10M to $50M,"Blue Cloud Ventures, Vistara Growth, Sageview Capital, The Argentum Group, Aarin Capital","Aarin Capital, Blue Cloud Ventures, Sageview Capital, The Argentum Group, Vistara Growth",https://x.com/impactanalytic,https://www.linkedin.com/company/impact-analytics,501-1000,"$14,999,982",2015
Cleancult,https://www.crunchbase.com/organization/cleancult-2,"May 7, 2025","$37,158,772",Not Started,"Consumer Goods, Manufacturing","New York, New York, United States","Sustainable packaging and an effective clean, powered by nature’s finest ingredients.","11,230",https://www.cleancult.com/,$10M to $50M,"BoxGroup, Everywhere Ventures, National Science Foundation, Karman Ventures, Anchor Capital GP","Anchor Capital GP, Dwight Funding, MassChallenge, National Science Foundation, Vanterra Capital",,https://in.linkedin.com/company/cleancult,11-50,"$5,000,000",2017
SimpleClosure,https://www.crunchbase.com/organization/simpleclosure,"May 7, 2025","$20,500,000",Not Started,"Information Technology, Internet","Los Angeles, California, United States",SimpleClosure simplifies the complex task of shutting down a business.,"11,701",https://simpleclosure.com/,$1M to $10M,"Infinity Ventures, TTV Capital, Anthemis, The LegalTech Fund, Carta","Cambrian Ventures, Infinity Ventures, TTV Capital",https://x.com/Simple_Closure,https://www.linkedin.com/company/simpleclosure/,11-50,"$15,000,000",2023
Kind Designs,https://www.crunchbase.com/organization/kind-designs,"May 7, 2025","$10,040,000",Not Started,"3D Printing, Construction, Manufacturing","Miami Beach, Florida, United States","Kind Designs creates 3D-printed seawalls and tiles that protect coastlines, restore marine life, and support sustainable infrastructure.","13,462",https://www.kinddesigns.com/,Less than $1M,"Overlay Capital, New York Angels, Mark Cuban, Florida Opportunity Fund, GOVO Venture Partners","Florida Venture Forum, Overlay Capital",,https://www.linkedin.com/company/kind-designs-official,11-50,"$5,000,000",2022
Circula,https://www.crunchbase.com/organization/circula,"May 7, 2025","€31,300,000",Not Started,"Financial Services, SaaS, Software, Travel","Berlin, Berlin, Germany",Circula is an automated app to manage expenses and employee benefits such as meal vouchers that saves about 70% process costs in accounting.,"14,728",https://www.circula.com/,$1M to $10M,"Alstin Capital, Storm Ventures, Capnamic, CIBC Innovation Banking, Peak","Alstin Capital, Capnamic",https://x.com/getcircula,https://www.linkedin.com/company/18125546/,101-250,"€15,000,000",Jan 2017
Wayne State University,https://www.crunchbase.com/organization/wayne-state-university,"May 7, 2025","$48,700,000",Not Started,"Education, Knowledge Management, Universities","Detroit, Michigan, United States","Wayne State University is a public research university located in Detroit, Michigan.","15,565",http://www.wayne.edu/,$1B to $10B,"DTE Energy, Andrew W. Mellon Foundation, National Highway Traffic Safety Administration, National Institute of Environmental Health Sciences, Kaiser Permanente Center for Gun Violence Research and Education","Andrew W. Mellon Foundation, Kaiser Permanente Center for Gun Violence Research and Education, Michigan Legislature, National Highway Traffic Safety Administration, National Institute of Environmental Health Sciences",https://x.com/waynestate,https://www.linkedin.com/company/wayne-state-university,5001-10000,—,1868
Royal Mail,https://www.crunchbase.com/organization/royal-mail-8221,"May 7, 2025","£458,800,000",Not Started,"Delivery, Delivery Service, Freight Service, Internet, Logistics, Messaging, Transportation","London, England, United Kingdom","Royal Mail is a delivery and email messaging company that specializes in parcels.track & manage delivery, packaging & manage mail services.","17,241",https://www.royalmail.com/,$1B to $10B,"Innovate UK, Vesa Equity Investment, Sky Zero Footprint Fund","Innovate UK, Sky Zero Footprint Fund, Vesa Equity Investment",https://x.com/royalmail,https://www.linkedin.com/company/royal-mail/,10001+,"£800,000",1516
Fuse Games,https://www.crunchbase.com/organization/fuse-games,"May 7, 2025","$9,000,000",Not Started,"Artificial Intelligence (AI), Casual Games, Gaming, Online Games","Istanbul, Istanbul, Turkey",Fuse Games is a mobile gaming company that integrates artificial intelligence technology to provide engaging games.,"20,718",https://fusegam.es/,$1M to $10M,"Lakestar, Griffin Gaming Partners, NFX, Actera","Griffin Gaming Partners, Lakestar, NFX",,https://www.linkedin.com/company/fusegamestr/,11-50,"$7,000,000",Jan 2023
Centra,https://www.crunchbase.com/organization/centra,"May 7, 2025","$105,172,131",Not Started,"E-Commerce, Fashion, Internet, Lifestyle","Stockholm, Stockholms Lan, Sweden",Centra is an e-commerce software that offers complete direct-to-consumer and wholesale services for fashion and lifestyle brands.,"20,796",https://www.centra.com/,$10M to $50M,"Verdane, H&M Group Ventures","H&M Group Ventures, Verdane",https://x.com/CentraHQ,https://www.linkedin.com/company/centra-commerce/,101-250,"SEK50,000,000",2016
Koala Health,https://www.crunchbase.com/organization/koala-health,"May 7, 2025","$40,000,000",Not Started,"Consumer Goods, Health Care, Pet","Boston, Massachusetts, United States",Koala Health provides medications and health products for pet needs.,"21,011",https://www.koala.health/,$1M to $10M,"Menlo Ventures, Alumni Ventures, BoxGroup, Operator Partners, First Round Capital","Alumni Ventures, Menlo Ventures, Valspring Capital",https://x.com/koalaforpets,https://www.linkedin.com/company/koala-health/,11-50,"$20,000,000",Nov 2021
Beyond,https://www.crunchbase.com/organization/beyond-meat,"May 7, 2025","$262,553,000",Not Started,"Alternative Protein, Food and Beverage, Food Processing, Nutrition, Organic Food, Plant-Based Foods","Manhattan Beach, California, United States",Beyond Meat is a food processing company that specializes in providing plant-based meat.,"21,370",http://www.beyondmeat.com/,$100M to $500M,"Kleiner Perkins, S2G Investments, Obvious Ventures, Collaborative Fund, GreatPoint Ventures","Cleveland Avenue, Future Positive, General Mills, Obvious Ventures, Structural Capital, The Humane Society of the United States, Unprocessed Foods",https://x.com/beyondmeat,http://www.linkedin.com/company/beyond-meat,501-1000,"$100,000,000",2009
GoQuant,https://www.crunchbase.com/organization/goquant,"May 7, 2025","$7,000,000",Not Started,"Cryptocurrency, Financial Services, FinTech","Miami, Florida, United States","GoQuant is a unified digital asset trading infrastructure platform, spanning data, execution, risk, operations, and credit.","21,473",https://goquant.io/,$1M to $10M,"GSR, Tyr Capital",GSR,https://x.com/go_quant,https://www.linkedin.com/company/goquant/,51-100,"$4,000,000","Sep 6, 2022"
Breathe Battery Technologies,https://www.crunchbase.com/organization/breathe-battery-technologies,"May 7, 2025","$32,994,954",Not Started,"Automotive, Battery, Energy Storage, Software","London, England, United Kingdom",Breathe Battery Technologies is a developer of electric vehicle battery charging control software for automotive manufacturers.,"21,730",https://breathebatteries.com/,$1M to $10M,"Speedinvest, Lowercarbon Capital, Kinnevik, Creative Destruction Lab (CDL), Volvo Cars Tech Fund","Creative Destruction Lab (CDL), Kinnevik, Lowercarbon Capital, Speedinvest, Volvo Cars Tech Fund",https://x.com/breathebt,https://www.linkedin.com/company/breathebt,11-50,"$21,000,000",2019
Vivvi,https://www.crunchbase.com/organization/vivvi,"May 7, 2025","$48,642,860",Not Started,"CRM, Education, Health Care, Information Technology","New York, New York, United States","Vivvi provides child care and early learning services for families and tools for recruitment, retention, and productivity to employers.","22,796",https://vivvi.com/,$50M to $100M,"Everywhere Ventures, Surface Ventures, Tribeca Venture Partners, CityRock Venture Partners, Eastward Capital Partners",Tribeca Venture Partners,https://x.com/vivviearlylearn,https://www.linkedin.com/company/vivviearlylearn,101-250,"$23,389,584",2018
Blank Beauty,https://www.crunchbase.com/organization/blee-beauty,"May 7, 2025","$7,250,000",Not Started,"Apps, Beauty, Consumer Electronics, Consumer Goods, Cosmetics","Memphis, Tennessee, United States",Blank Beauty is a digital-to-physical platform that empowers customers to personalize their favorite cosmetic products.,"23,150",https://blankbeauty.com/,Less than $1M,"Global Brain Corporation, Evolution VC Partners, Kirker Enterprises, Epson Robots, EP-GB","EP-GB, Evolution VC Partners",https://x.com/_blankbeauty,https://www.linkedin.com/company/blankbeauty/,11-50,"$6,500,000",2016
Intercept Music,https://www.crunchbase.com/organization/intercept-music,"May 7, 2025","$50,000,000",Not Started,"Advertising, Information Technology, Internet, Marketing, Music, Social Media Marketing, Software","San Francisco, California, United States","Intercept Music is a marketing and advertising company that specializes in music distribution, music marketing, and social media marketing.","24,239",https://interceptmusic.com/,—,Ralph Tashjian,—,https://x.com/Intercept_Music,https://www.linkedin.com/company/intercept-music/,11-50,"$50,000,000",2018
Gardin,https://www.crunchbase.com/organization/gardin,"May 7, 2025","$16,500,000",Not Started,"Analytics, Biotechnology, Information Technology","London, England, United Kingdom",Gardin develops optical phenotyping technology and analytics to optimise food production.,"25,142",https://www.gardin.co.uk/,$1M to $10M,"Seedcamp, MMC Ventures, LDV Capital, Molten Ventures, Navus Ventures","LDV Capital, Molten Ventures, Navus Ventures",https://x.com/GardinAgritech,https://www.linkedin.com/company/gardin-tech/about/,11-50,"$4,500,000","Jan 24, 2020"
Natoma Labs,https://www.crunchbase.com/organization/natoma-labs,"May 7, 2025","$7,000,000",Not Started,—,"Los Altos, California, United States","Accelerate enterprise adoption of agentic AI, without compromising security.","25,659",https://natoma.id/,—,"Index Ventures, Greylock",Index Ventures,https://x.com/natomalabs,https://www.linkedin.com/company/natomalabs/,11-50,"$7,000,000",Dec 2023
COCC,https://www.crunchbase.com/organization/cocc,"May 7, 2025","$121,980,000",Not Started,"Consulting, Finance, Information Technology, Software","Avon, Connecticut, United States",COCC is an information technology company that offers technology services from core processing to business process management.,"37,410",http://www.cocc.com/,$1M to $10M,—,—,https://x.com/coccinsight,http://www.linkedin.com/company/cocc,501-1000,"$13,880,000",1967
Baltimore Community Lending,https://www.crunchbase.com/organization/baltimore-community-lending,"May 7, 2025","$8,882,278",Not Started,"Communities, Lending","Baltimore, Maryland, United States",Baltimore Community Lending is a nonprofit community that offers support to real estate companies to develop underserved communities.,"37,464",https://bclending.org/,$1M to $10M,"PNC Bank, Baltimore Community Foundation, Community Development Financial Institutions Fund, CDFI Equitable Recovery Program","Baltimore Community Foundation, CDFI Equitable Recovery Program, Community Development Financial Institutions Fund, PNC Bank",https://x.com/BC_Lending,https://www.linkedin.com/company/baltimore-community-lending/,11-50,"$924,600",1989
Eyeo,https://www.crunchbase.com/organization/eyeo-92e9,"May 7, 2025","€15,000,000",Not Started,"Manufacturing, Semiconductor, Sensor","Eindhoven, Noord-Brabant, The Netherlands",Eyeo is fundamentally redefining image sensing by eliminating decades-old limitations.,"38,315",https://eyeo-imaging.com/,—,"HTGF (High-Tech Gruenderfonds), Invest-NL, imec.xpand, Qbic Fund, BOM","imec.xpand, Invest-NL",,https://www.linkedin.com/company/eyeo/,1-10,"€15,000,000",2023
Uviquity,https://www.crunchbase.com/organization/uviquity,"May 7, 2025","$13,274,620",Not Started,"Artificial Intelligence (AI), Cyber Security, SaaS","Raleigh, North Carolina, United States",Uviquity is a firm that wants to encourage safety for their clients.,"39,518",https://uviquity.ai/,—,"AgFunder, CIG Spectrum Capital, Emerald Development Managers, MANN+HUMMEL",Emerald Development Managers,,https://www.linkedin.com/company/uviquity/,1-10,"$6,600,000",2022
Tended,https://www.crunchbase.com/organization/tended,"May 7, 2025","$10,578,503",Not Started,"B2B, Hardware, Mobile Apps, Public Safety, Wearables","Lincoln, Lincolnshire, United Kingdom",Tended is transforming safety across high-risk industries by combining revolutionary wearable technology with behavioural science.,"40,581",https://www.tended.co.uk/,$1M to $10M,"Praetura Ventures, Innovate UK, Wealth Club, Basinghall Partners, Blackfinch Ventures","Blackfinch Ventures, Praetura Ventures",https://x.com/tended,https://www.linkedin.com/company/tended-ltd,11-50,"£2,000,000","Aug 20, 2017"
Foodiq,https://www.crunchbase.com/organization/foodiq,"May 7, 2025","€23,000,000",Not Started,"Food and Beverage, Food Processing, Machinery Manufacturing, Manufacturing","Helsinki, Southern Finland, Finland",Foodiq is a one-of-a-kind food manufacturer that can both develop and manufacture plant-based products.,"41,754",https://www.foodiq.fi/,$1M to $10M,"Nicoya, Mathias Kamprad, Saeid Binzagr","Mathias Kamprad, Nicoya, Saeid Binzagr",,https://www.linkedin.com/company/foodiq/,11-50,"€10,000,000",2015
Elfly Group / NOEMI,https://www.crunchbase.com/organization/elfly-group,"May 7, 2025","$14,250,000",Not Started,"Aerospace, Air Transportation, Business Travel, Ride Sharing, Sustainability, Tourism","Bergen, Hordaland, Norway","Elfly Group is building electric amphibious seaplanes, enabling scalable, zero-emission regional mobility.","43,112",https://el-fly.no/,$1M to $10M,—,—,,https://www.linkedin.com/company/elflygroup/,11-50,"$1,350,000","May 5, 2018"
Tobin Scientific,https://www.crunchbase.com/organization/tobin-scientific,"May 7, 2025","$32,000,000",Not Started,"Bioinformatics, Biotechnology, Life Science, Risk Management","Beverly, Massachusetts, United States","Tobin Scientific is a biotechnology company that offers life science laboratory relocation, biorepository, and portable cold storage.","45,540",https://www.tobinscientific.com/,Less than $1M,"Denali Growth Partners, Eastern Bank, Truck 9 Partners","Denali Growth Partners, Eastern Bank, Truck 9 Partners",https://x.com/TobinScientific,https://www.linkedin.com/company/tobin-scientific,101-250,"$32,000,000",2008
The Fundworks,https://www.crunchbase.com/organization/the-fundworks,"May 7, 2025","$60,000,000",Not Started,"Banking, Finance, Financial Services, FinTech","Van Nuys, California, United States",The Fundworks is a financial service company that provides alternative financing to small businesses and merchants.,"45,869",https://www.thefundworks.com/,$10M to $50M,—,—,,https://www.linkedin.com/company/linkedin.comthefundworksllc,51-100,"$10,000,000",2015
Vetr,https://www.crunchbase.com/organization/vetr,"May 7, 2025","$22,500,000",Not Started,"Crowdsourcing, Finance, Financial Services, News, Social Media","New York, New York, United States",Vetr is an investment research platform that provides simplified crowdsourced ratings and delivers personalized insights.,"46,551",https://www.vetr.com/,Less than $1M,Palehorse Capital,Palehorse Capital,https://x.com/vetrdotcom,https://www.linkedin.com/company/whisperinvest,1-10,"$21,000,000",2013
The Johns Hopkins University,https://www.crunchbase.com/organization/johns-hopkins-university,"May 7, 2025","$207,963,632",Not Started,"Education, Higher Education, Information Technology","Baltimore, Maryland, United States",Johns Hopkins University is a research university that enrolls full and part-time students throughout nine academic divisions.,"47,245",https://www.jhu.edu/,$1B to $10B,"Advanced Research Projects Agency for Health, Deerfield Capital Management, National Highway Traffic Safety Administration, Maryland Stem Cell Research Fund (MSCRF), Alfred P. Sloan Foundation","Advanced Research Projects Agency for Health, Alfred P. Sloan Foundation, Foundation for Opioid Response Efforts, Maryland Stem Cell Research Fund (MSCRF), National Highway Traffic Safety Administration",https://x.com/johnshopkins,https://www.linkedin.com/school/johns-hopkins-university,10001+,—,"Feb 22, 1876"
Avammune Therapeutics,https://www.crunchbase.com/organization/avammune-therapeutics,"May 7, 2025","$12,000,000",Not Started,"Biotechnology, Therapeutics","Philadelphia, Pennsylvania, United States",Avammune Therapeutics  is a drug discovery company.,"51,575",http://www.avammune.com/,Less than $1M,"IvyCap Ventures, Shastra VC, Kotak Alternate Asset Managers, 1Crowd, The Chennai Angels","Capital 2B, Kotak Alternate Asset Managers, Shastra VC, The Chennai Angels",,https://www.linkedin.com/company/avammune-therapeutics,11-50,"$12,000,000",2017
Evotec,https://www.crunchbase.com/organization/evotec-inc,"May 7, 2025","$746,736,691",Not Started,"Biotechnology, Health Care, Pharmaceutical, Therapeutics","Hamburg, Hamburg, Germany",Evotec is a pharmaceutical and life science company that provides drug discovery and gene therapy solutions.,"62,567",http://evotec.com/,$500M to $1B,"European Investment Bank, Bill & Melinda Gates Foundation, Mubadala, Omega Funds, Novo Holdings","Bill & Melinda Gates Foundation, Biotechnology Value Fund, CARB-X, European Investment Bank, German Federal Ministry of Education and Research, Korea Advanced Institute of Science and Technology, Mubadala, Novo Holdings, Open Philanthropy",https://x.com/evotec,https://www.linkedin.com/company/evotec,1001-5000,"$2,500,000",1993
ImmuneWalk Therapeutics,https://www.crunchbase.com/organization/immunewalk-therapeutics,"May 7, 2025","$7,000,000",Not Started,"Biotechnology, Life Science, Pharmaceutical","Pearl River, New York, United States",ImmuneWalk Therapeutics is committed to developing novel therapies for chronic inflammatory diseases.,"63,481",https://immunewalk.com/,—,—,—,https://x.com/immunewalk,https://www.linkedin.com/company/immunewalk-therapeutics,1-10,"$7,000,000",2023
Fusion Connect,https://www.crunchbase.com/organization/fusion-telecommunications,"May 7, 2025","$160,206,250",Not Started,"Communications Infrastructure, Information Technology, IT Infrastructure, Telecommunications, Unified Communications","Atlanta, Georgia, United States",Fusion Connect is a next-gen managed communication service provider (MCSP) enabling enterprises to connect people and applications globally,"66,034",http://www.fusionconnect.com/,$100M to $500M,"Plexus Capital, Praesidian Capital, Backcast Partners, Hark Capital, PNC Business Credit","Hark Capital, PNC Business Credit",https://x.com/fusionconnectsm,https://www.linkedin.com/company/fusionconnect,501-1000,"$85,000,000",1997
Magnetic Systems Technology,https://www.crunchbase.com/organization/magnetic-systems-technology,"May 7, 2025","$9,044,087",Not Started,"Automotive, Autonomous Vehicles, Electronics, Manufacturing, Professional Services","Sheffield, Sheffield, United Kingdom",Magtec designs and manufactures electric drive systems and components for all vehicle types.,"122,102",http://www.magtec.co.uk/,Less than $1M,"Innovate UK, EISMEA, Advanced Propulsion Centre UK","Advanced Propulsion Centre UK, Innovate UK",,https://www.linkedin.com/company/magtec-magnetic-systems-technology-ltd/,51-100,—,1992
Latecoere,https://www.crunchbase.com/organization/latecoere,"May 7, 2025","$108,043,577",Not Started,"Aerospace, Drones, Machinery Manufacturing, Manufacturing, Marketing","Toulouse, Midi-Pyrenees, France",Latecoere specializes in the manufacturing and marketing of structures for the aeronautics sector.,"140,421",https://www.latecoere.aero/,$500M to $1B,"Tikehau Capital, Searchlight Capital Partners, André-Hubert Roussel, Nick Sanders","Searchlight Capital Partners, Tikehau Capital",https://x.com/LatecoereGroup,https://www.linkedin.com/company/latecoere/,5001-10000,"€1,100,000",1917
Finnfund,https://www.crunchbase.com/organization/finnfund,"May 6, 2025","€375,000,000",Not Started,—,"Helsinki, Southern Finland, Finland",Finnfund is a Finnish development finance company that provides long-term risk capital for private projects in developing countries.,"1,832",http://www.finnfund.fi/,$10M to $50M,—,—,https://x.com/Finnfund,https://www.linkedin.com/company/finnfund,51-100,"€200,000,000",1980
