Organization Name,CrunchBase URL,Last Funding Date,Total Funding Amount,Stage,Industries,Headquarters Location,Description,CB Rank (Company),Website,Estimated Revenue Range,Top 5 Investors,Lead Investors,Twitter,LinkedIn,Number of Employees,Last Funding Amount,Founded Date
NEOGOV,https://www.crunchbase.com/organization/neogov,"Jul 28, 2025","$700,000,000",Not Started,"GovTech, Human Resources, Information Technology, Software","El Segundo, California, United States","NEOGOV is the leading provider of workforce management software uniquely designed for the public sector, education, and public safety.","4,464",http://www.neogov.com/,$100M to $500M,"Warburg Pincus, The Carlyle Group, CPP Investments","The Carlyle Group, Warburg Pincus",https://x.com/NEOGOV,https://www.linkedin.com/company/neogov,501-1000,"$700,000,000",1999
MapLight Therapeutics,https://www.crunchbase.com/organization/alvarado-therapeutics,"Jul 28, 2025","$640,599,999",Not Started,"Biopharma, Biotechnology, Life Science, Medical","Palo Alto, California, United States",MapLight Therapeutics is a biopharma company that offers a platform designed to discover and develop therapeutics for brain disorders.,"5,321",https://maplightrx.com/,—,"Blue Owl, Sanofi, 5AM Ventures, Novo Holdings, T. Rowe Price","5AM Ventures, Cowen Healthcare Investments, Forbion Capital Partners, Goldman Sachs Alternatives, Michael J. Fox Foundation, Novo Holdings",https://x.com/Maplightrx,https://www.linkedin.com/company/maplight-therapeutics-inc,51-100,"$372,500,000",2018
E2B,https://www.crunchbase.com/organization/e2b-1c91,"Jul 28, 2025","$35,024,871",Not Started,"Artificial Intelligence (AI), Cloud Management, Developer APIs, Software","San Francisco, California, United States",E2B develops a cloud infrastructure tailored for AI agents and applications.,"5,625",https://e2b.dev/,—,"Insight Partners, KAYA, Pareto Holdings, Edward Lando, Decibel Partners","Decibel Partners, Insight Partners, KAYA",https://x.com/e2b_dev,https://www.linkedin.com/company/e2b-dev,11-50,"$21,000,000",2023
Brown University,https://www.crunchbase.com/organization/brown-university-2,"Jul 28, 2025","$860,759,662",Not Started,"Education, Higher Education, Universities","Providence, Rhode Island, United States",Brown University is an Ivy League research university that provides undergraduate and graduate programs.,"5,767",https://www.brown.edu/,$1B to $10B,"National Institutes of Health, NASA, Department of Energy & Environment, RI Life Science Hub, Pablo Legorreta","Department of Energy & Environment, NASA, RI Life Science Hub",https://x.com/BrownUniversity,https://www.linkedin.com/school/brown-university,5001-10000,"$500,000,000",1764
Salient,https://www.crunchbase.com/organization/salient,"Jul 28, 2025","$60,500,000",Not Started,"Artificial Intelligence (AI), Automotive, Finance, Financial Services, Information Technology, Internet","San Francisco, California, United States",Salient is an AI-driven loan servicing platform built specifically for consumer finance and auto lending industries.,"6,255",https://www.trysalient.com/,$10M to $50M,"Andreessen Horowitz, Y Combinator, Matrix, Michael Ovitz","Andreessen Horowitz, Y Combinator",https://x.com/trysalient,https://www.linkedin.com/company/salientai,11-50,"$60,000,000",2023
ImageneBio,https://www.crunchbase.com/organization/inmagene-biopharmaceuticals,"Jul 28, 2025","$196,000,000",Not Started,"Biopharma, Biotechnology, Health Care","San Diego, California, United States","ImageneBio is dedicated to developing therapeutics for patients with immunological, autoimmune and inflammatory diseases","6,679",https://imagenebio.com/,$1M to $10M,"Blue Owl, Omega Funds, RTW Investments, Foresite Capital, Highlight Capital","Highlight Capital, Panacea Venture, Vertex Ventures China",,https://www.linkedin.com/company/inmagene-biopharmaceuticals/,11-50,"$75,000,000",2019
Tensordyne,https://www.crunchbase.com/organization/recogni,"Jul 28, 2025","$211,050,000",Not Started,"AI Infrastructure, Artificial Intelligence (AI), Semiconductor, Software","Sunnyvale, California, United States","Math, Chips, and Systems for AI Inference.","7,875",https://www.tensordyne.ai/,$1M to $10M,"Plug and Play, Toyota Ventures, Mayfield Fund, Bosch Ventures, GreatPoint Ventures","Celesta Capital, GreatPoint Ventures, HSBC Innovation Banking, Premji Invest",https://x.com/tensordyneinc?s=21,https://www.linkedin.com/company/tensordyne/,101-250,"$35,000,000",Nov 2017
Julius AI,https://www.crunchbase.com/organization/julius-ai,"Jul 28, 2025","$10,500,000",Not Started,"Analytics, Artificial Intelligence (AI), Data Visualization, Information Technology","San Francisco, California, United States",Julius AI is an artificial intelligence platform that develops and analyzes data with computational AI.,"8,013",https://julius.codes/,—,"Bessemer Venture Partners, 8VC, Y Combinator, Karman Ventures, Guillermo Rauch","Bessemer Venture Partners, Y Combinator",https://x.com/JuliusAI_,https://www.linkedin.com/company/julius-ai/,1-10,"$10,000,000",2022
FOSSA,https://www.crunchbase.com/organization/fossa-2,"Jul 28, 2025","$43,549,972",Not Started,"Compliance, Developer Tools, Open Source, SaaS, Software","San Francisco, California, United States",FOSSA is the developer's choice for managing open source risk and reporting.,"8,489",http://fossa.com/,$50M to $100M,"Norwest, Hack VC, Bain Capital Ventures, Costanoa Ventures, Canvas Prime","Bain Capital Ventures, Canvas Prime, Costanoa Ventures",https://x.com/getfossa,https://www.linkedin.com/company/fossa/,51-100,"$5,149,993",2015
1Komma5°,https://www.crunchbase.com/organization/1komma5,"Jul 28, 2025","€652,500,000",Not Started,"Charging Infrastructure, Energy, Energy Storage, Renewable Energy","Hamburg, Hamburg, Germany",1Komma5° is a home electrification and climatetech company that provides intelligent energy solutions and promotes a CO₂-neutral lifestyle.,"8,797",https://1komma5.com/,$500M to $1B,"Norrsken VC, Deutsche Bank, G2 Venture Partners, BNP Paribas, 2150","2150, b2venture, CalSTRS, eCAPITAL ENTREPRENEURIAL PARTNERS, Eurazeo, G2 Venture Partners, Hamilton Lane, Norrsken Foundation, Norrsken VC, Porsche Ventures, Sabanci Climate Technologies",https://x.com/1KOMMA5GRAD,https://www.linkedin.com/company/1komma5grad,1001-5000,—,2021
Quartr,https://www.crunchbase.com/organization/quartr,"Jul 28, 2025","$23,026,765",Not Started,Financial Services,"Stockholm, Stockholms Lan, Sweden","Quartr is a software company. Our product suite consists of our free mobile application, and a web application built for professionals.","9,690",https://quartr.com/,$1M to $10M,"Flat Capital, Altos Ventures, Yanno Capital, Centripetal, Öhman Group","Altos Ventures, Öhman Group",https://x.com/Quartr_App,https://www.linkedin.com/company/quartr-ab,11-50,"$10,000,000",Nov 2020
BridgePort,https://www.crunchbase.com/organization/bridgeport,"Jul 28, 2025","$6,425,000",Not Started,"Cryptocurrency, Financial Services, FinTech, Trading Platform, Web3","New York, New York, United States","BridgePort is a fintech company that provides middleware for institutional crypto trading, custodial options for off-exchange settlement.","10,096",https://www.bridgeportmq.com/,—,"Blockchain Founders Fund, Further Ventures, Virtu Financial, XBTO Humla Ventures, FunFair Ventures",Further Ventures,https://x.com/BridgePortMQ,https://www.linkedin.com/company/bridgeportmq/,1-10,"$3,225,000",Jan 2024
Farmers Business Network,https://www.crunchbase.com/organization/farmers-business-network,"Jul 28, 2025","$967,900,000",Not Started,"Agriculture, AgTech, E-Commerce, Farming, Marketplace, Sustainability","San Francisco, California, United States","Farmers Business Network is a digital marketplace that helps farmers buy inputs, access financing, and join marketing programs.","10,186",https://www.fbn.com/,$100M to $500M,"Temasek Holdings, BlackRock, Kleiner Perkins, Fidelity, T. Rowe Price","Acre Venture Partners, BlackRock Innovation Capital, DBL Partners, Fidelity, Google Ventures, Kleiner Perkins, Temasek Holdings, T. Rowe Price",https://x.com/fbnfarmers,https://www.linkedin.com/company/farmers-business-network,501-1000,"$50,000,000",2014
Zodia Markets,https://www.crunchbase.com/organization/zodia-markets,"Jul 28, 2025","$18,250,000",Not Started,"Asset Management, Blockchain, Cryptocurrency, Financial Services, Trading Platform","London, England, United Kingdom","Zodia Markets is a digital asset trading platform that provides custody of digital assets, brokerage, trade, investments, and exchange.","12,406",https://zodiamarkets.com/,Less than $1M,"Human Capital, Circle Ventures, Pharsalus Capital, XVC Tech, The Operating Group",Pharsalus Capital,https://x.com/zodiamarkets,https://www.linkedin.com/company/zodiamarkets/,11-50,"$18,250,000",2021
Powerful Medical,https://www.crunchbase.com/organization/powerful-medical,"Jul 28, 2025","$62,621,149",Not Started,"Artificial Intelligence (AI), Big Data, Health Care, Health Diagnostics, Image Recognition, Medical Device","New York, New York, United States",Powerful Medical provides AI solutions that enable medical professionals to diagnose and treat cardiovascular disease.,"12,900",https://www.powerfulmedical.com/,$10M to $50M,"European Commission, LifeX Ventures, EIC Accelerator, Zero One Hundred, Venture to Future Fund","EIC Accelerator, European Commission, Martin Herman, Venture to Future Fund, Zero One Hundred",https://x.com/PowerfulMedical,https://www.linkedin.com/company/powerful-medical/,51-100,"€40,000,000",2019
RealWear,https://www.crunchbase.com/organization/realwear,"Jul 28, 2025","$129,094,220",Not Started,"Artificial Intelligence (AI), Augmented Reality, Electronics, Industrial, Software, Wearables","Vancouver, Washington, United States",RealWear is the global leader in assisted reality wearables,"13,008",http://realwear.com/,$10M to $50M,"JP Morgan Chase, Foundry Group, Qualcomm Ventures, Runway Growth Capital, Fortive","Columbia Ventures Corporation, Foundry Group, Runway Growth Capital, Teradyne",https://x.com/realwearinc,https://www.linkedin.com/company/realwear-inc./,51-100,"$650,000",2016
Project Q,https://www.crunchbase.com/organization/project-q,"Jul 28, 2025","€7,500,000",Not Started,"Artificial Intelligence (AI), Information Technology","Berlin, Berlin, Germany","Q develops defence and security solutions, providing real-time situational awareness, data fusion, and strategic decision support","13,572",https://project-q.ai/,Less than $1M,"Expeditions, Superangel, Project A Ventures",Project A Ventures,,https://www.linkedin.com/company/project-q-gmbh,11-50,"€7,500,000",2024
Local Initiatives Support Corporation,https://www.crunchbase.com/organization/local-initiatives-support-corporation,"Jul 28, 2025","$28,352,678",Not Started,"Association, Business Development, Communities, Health Care, Non Profit","New York, New York, United States","LISC, is one of the organizations in the country supporting projects to revitalize communities.","14,700",http://www.lisc.org/,$100M to $500M,"Bread Financial, Federal Home Loan Bank of Dallas, Washington Trust, PNC Bank, Federal Home Loan Bank of San Francisco","Ameris Bank, BankNewport, Bread Financial, Citizens Charitable Foundation, Community Development Financial Institutions Fund, Dick's Sporting Goods, Federal Home Loan Bank of Dallas, Federal Home Loan Bank of San Francisco, KeyBank Foundation, Michigan Department of Labor and Economic Opportunity, PNC Bank, The Milliken & Company Charitable Foundation, Truist Foundation, Washington Trust",https://x.com/lisc_hq/,https://www.linkedin.com/company/local-initiatives-support-corporation-lisc,501-1000,—,1979
H100 Group,https://www.crunchbase.com/organization/h100-group,"Jul 28, 2025","SEK763,719,915",Not Started,"Generative AI, Health Care, Internet","Stockholm, Stockholms Lan, Sweden","H100 is a data-driven, scalable model to optimize user health journeys by integrating digital health services.","19,233",https://www.h100.group/,—,"UTXO Management, Adam Back, Alundo Invest, Race Venture Scandinavia, Morten Klein",Adam Back,,https://www.linkedin.com/company/h100group/,1-10,"SEK109,000,000",2024
Harmonya,https://www.crunchbase.com/organization/harmonya,"Jul 28, 2025","$20,000,000",Not Started,"Artificial Intelligence (AI), Product Research, Retail Technology","New York, New York, United States","Harmonya offers an API-based data enrichment and augmentation product that assists in category management, innovation, and product search.","19,596",https://www.harmonya.com/,$10M to $50M,"Silicon Road Ventures, Team8, Susa Ventures, W23, Bright Pixel Capital","Bright Pixel Capital, dunnhumby Ventures, W23",,https://www.linkedin.com/company/harmonya-inc/,11-50,—,2021
TakeUp,https://www.crunchbase.com/organization/takeup-1e1c,"Jul 28, 2025","$11,000,000",Not Started,"Artificial Intelligence (AI), Enterprise Software, Hospitality, Information Technology","Cleveland, Ohio, United States","TakeUp is a revenue management tool designed for independent lodging establishments, such as bed & breakfasts and boutique hotels.","19,733",https://takeup.ai/,—,1848 Ventures,1848 Ventures,,https://www.linkedin.com/company/takeup-ai,11-50,"$11,000,000",2021
Weave.AI,https://www.crunchbase.com/organization/weave-ai,"Jul 28, 2025","$7,420,000",Not Started,"Artificial Intelligence (AI), Business Intelligence, Enterprise Software, Machine Learning","Bellevue, Washington, United States",Neuro-Symbolic AI Built For Risk Management And Alpha Discovery,"24,420",https://www.weave.ai/,Less than $1M,Techstars,—,https://x.com/weaveai,https://www.linkedin.com/company/weave-ai,11-50,"$1,500,000",2016
Live Oak Bank,https://www.crunchbase.com/organization/live-oak-banking-company,"Jul 28, 2025","$176,092,240",Not Started,"Banking, Credit, Financial Services, Lending","Wilmington, North Carolina, United States",Live Oak Bank is a financial service company that offers banking services and products for small and medium businesses.,"29,229",https://www.liveoakbank.com/,$100M to $500M,—,—,https://x.com/liveoakbank,https://www.linkedin.com/company/live-oak-bank,1001-5000,"$100,000,000",2008
APERIO,https://www.crunchbase.com/organization/aperio-systems,"Jul 28, 2025","$24,850,000",Not Started,"Artificial Intelligence (AI), Big Data, Data Visualization, Infrastructure, Software","Boston, Massachusetts, United States",APERIO AI uses the power of machine learning to solve a wide range of operational data quality issues for industrial companies.,"32,303",http://www.aperio.ai/,$1M to $10M,"Momenta, National Grid Partners (NGP), Propel(X), Jump Capital, NextEra Energy","Energias de Portugal, Momenta, National Grid Partners (NGP)",,https://www.linkedin.com/company/aperioai/,11-50,"$2,850,000","Jan 1, 2019"
[cafeteria],https://www.crunchbase.com/organization/cafeteria-853c,"Jul 28, 2025","$6,000,000",Not Started,"Brand Marketing, Personal Branding, Teenagers","Los Angeles, California, United States",[cafeteria] is an ongoing production partnership between businesses and teenagers to help build career skills.,"32,711",https://www.teamcafeteria.com/,—,"Collaborative Fund, Imaginary Ventures, Listen, Marquee Ventures, Guy Oseary","Collaborative Fund, Imaginary Ventures",,https://www.linkedin.com/company/team-cafeteria/,11-50,"$3,000,000",2023
Ardagh Group,https://www.crunchbase.com/organization/ardagh-group,"Jul 28, 2025","$2,339,358,475",Not Started,Manufacturing,"Luxembourg, Luxembourg, Luxembourg",Ardagh Group manufactures metal and glass packaging solutions for various industries worldwide.,"33,005",http://www.ardaghgroup.com/,$1B to $10B,—,—,https://x.com/ArdaghGroup,http://www.linkedin.com/company/ardagh-group,10001+,"$1,500,000,000",1932
Raiffeisen Bank International,https://www.crunchbase.com/organization/raiffeisen-bank,"Jul 28, 2025","$239,265,056",Not Started,"Asset Management, Banking, Finance, Financial Exchanges, Financial Services, FinTech, Lending","Vienna, Wien, Austria",Raiffeisen Bank International is a financial services company that offers banking services to individuals and corporations.,"33,656",http://www.rbinternational.com/,$1B to $10B,"European Bank for Reconstruction and Development, International Finance Corporation","European Bank for Reconstruction and Development, International Finance Corporation",https://x.com/RBI_Presse,https://www.linkedin.com/company/raiffeisen-bank-international,10001+,—,1886
Professional Triathletes Organisation,https://www.crunchbase.com/organization/professional-triathletes-organisation,"Jul 28, 2025","$92,500,000",Not Started,"Event Management, Non Profit, Sports","London, England, United Kingdom",Professional Triathletes Organisation is a nonprofit company that organizes events of the triathlon sport.,"33,954",https://protriathletes.org/,$1M to $10M,"Warner Bros Discovery, Eckuity, Cordillera Investment Partners, Michael Moritz, SURJ Sports Investment","Cordillera Investment Partners, Divergent Investments, Michael Moritz, SURJ Sports Investment",https://x.com/protriorg,https://www.linkedin.com/company/protriathletes/,11-50,"$40,000,000",2014
DynaRisk,https://www.crunchbase.com/organization/dynarisk,"Jul 28, 2025","$8,675,894",Not Started,"Cyber Security, Information Technology, Insurance, Security","London, England, United Kingdom",DynaRisk provides cyber security tools for home users and businesses.,"34,283",https://www.dynarisk.com/,$1M to $10M,"YFM Equity Partners, CyLon Ventures, ICP, Nexus Investment Ventures, Jonathan Marland","CyLon Ventures, Nexus Investment Ventures, YFM Equity Partners",https://x.com/dynarisk,https://www.linkedin.com/company/dynarisk/,11-50,"£3,500,000","Feb 1, 2016"
Aptitude Medical Systems,https://www.crunchbase.com/organization/aptitude-medical-systems,"Jul 28, 2025","$73,700,000",Not Started,"Biotechnology, Health Diagnostics, Life Science, Medical, Therapeutics","Goleta, California, United States",Aptitude Medical Systems is a deep-tech healthcare company that offers diagnostic testing solutions with lab-quality results.,"35,007",http://www.aptitudemedical.com/,$1M to $10M,"Bill & Melinda Gates Foundation, TSVC, Biomedical Advanced Research and Development Authority (BARDA)","Bill & Melinda Gates Foundation, Biomedical Advanced Research and Development Authority (BARDA)",,https://www.linkedin.com/company/aptitudemedical,11-50,"$9,000,000",2011
MHV GROUP,https://www.crunchbase.com/organization/mhv-group,"Jul 28, 2025","€20,000,000",Not Started,"Hospitality, Property Management, Real Estate","Limassol, Limassol, Cyprus",MHV GROUP is a hospitality and real estate investment that focuses on risk-adjusted and value-appreciating assets.,"36,456",https://www.mhvgroup.com/,—,Prodea Investment,Prodea Investment,,https://www.linkedin.com/company/mhvgroup,1001-5000,"€20,000,000",2022
Main Street Auto,https://www.crunchbase.com/organization/main-street-auto,"Jul 28, 2025","$60,000,000",Not Started,"Automotive, Consumer","Atlanta, Georgia, United States",Main Street Auto is committed to providing local auto repair shops that have long been a cornerstone of communities.,"39,820",https://mainstreetauto.com/,$100M to $500M,Turning Rock Partners,Turning Rock Partners,,https://www.linkedin.com/company/main-street-auto,501-1000,"$60,000,000",2021
Root Evidence,https://www.crunchbase.com/organization/root-evidence,"Jul 28, 2025","$12,500,000",Not Started,"Cyber Security, Information Technology, Software","Boise, Idaho, United States",Root Evidence will help them cut through the clutter and concentrate first on the few vulnerabilities.,"41,456",https://www.rootevidence.com/,—,"Ballistic Ventures, Grossman Ventures",Ballistic Ventures,https://x.com/rootevidence,https://www.linkedin.com/company/rootevidence,1-10,"$12,500,000",Jul 2025
Blink Ops,https://www.crunchbase.com/organization/blink-ffe8,"Jul 28, 2025","$100,000,000",Not Started,"Artificial Intelligence (AI), Cloud Security, Cyber Security, Productivity Tools, SaaS","Austin, Texas, United States",BlinkOps delivers an AI-powered platform for automating security workflows.,"41,834",https://www.blinkops.com/,$10M to $50M,"Lightspeed Venture Partners, Hetz Ventures, Vertex Ventures Israel, O.G. Venture Partners, Entrée Capital","Entrée Capital, Hetz Ventures, Lightspeed Venture Partners, O.G. Venture Partners, Vertex Ventures Israel",,https://www.linkedin.com/company/blink-ops,101-250,"$50,000,000",2021
The Indianapolis Neighborhood Housing Partnership,https://www.crunchbase.com/organization/the-indianapolis-neighborhood-housing-partnership,"Jul 28, 2025","$7,708,071",Not Started,"Charity, Financial Services, Non Profit","Indianapolis, Indiana, United States",The Indianapolis Neighborhood Housing Partnership operates as a nonprofit homeownership resource.,"46,436",https://www.inhp.org/,$1M to $10M,"Lilly Endowment, Community Development Financial Institutions Fund, Federal Home Loan Bank of Indianapolis, KeyBank Foundation","Community Development Financial Institutions Fund, Federal Home Loan Bank of Indianapolis, KeyBank Foundation, Lilly Endowment",https://x.com/inhp_home,https://www.linkedin.com/company/indianapolis-neighborhood-housing-partnership,51-100,—,1988
Vita Group,https://www.crunchbase.com/organization/vita-group-de5a,"Jul 28, 2025","£311,700,000",Not Started,Real Estate,"Alderley Edge, Cheshire, United Kingdom",Vita Group is a real estate platform that provides student accommodation services.,"50,563",https://www.vitagroup.com/,$50M to $100M,"LaSalle Investment Management, PGIM Real Estate, Cain International, Arini, Puma Property Finance","Arini, Cain International, LaSalle Investment Management, PGIM Real Estate, Puma Property Finance",,https://www.linkedin.com/company/vitagroup/,101-250,—,2013
CHS (Community Health Systems),https://www.crunchbase.com/organization/chs-community-health-systems,"Jul 28, 2025","$3,665,000,000",Not Started,"Health Care, Hospital","Franklin, Tennessee, United States",Community Health Systems is a provider of general hospital healthcare services.,"51,204",http://www.chs.net/,$10B+,—,—,,https://www.linkedin.com/company/community-health-systems,10001+,"$1,790,000,000",1985
3ICE,https://www.crunchbase.com/organization/3ice,"Jul 28, 2025","$19,748,330",Not Started,"Content, Events, Hockey, Media and Entertainment, Sports, Sports Leagues and Teams","New York, New York, United States",3ICE is an independent 3-on-3 professional ice hockey league.,"51,774",https://www.3ice.com/,$1M to $10M,KB Partners,KB Partners,https://x.com/3ICEhockey,https://www.linkedin.com/company/3icehockey,251-500,"$4,799,999",2018
Upland Software,https://www.crunchbase.com/organization/upland-software,"Jul 28, 2025","$1,076,376,300",Not Started,"Cloud Data Services, Enterprise Software, Information Technology, IT Management, Project Management, SaaS, Software","Austin, Texas, United States",Upland is a cloud-based enterprise software that helps businesses communicate with clients on key digital channels.,"57,661",http://www.uplandsoftware.com/,$100M to $500M,"Activant Capital, Sound Point Capital Management, National Association of REALTORS, Regions Bank, Capital One Ventures","Activant Capital, Austin Ventures, CIT Bank, Credit Suisse Loan Funding, HGGC, Sound Point Capital Management, Wells Fargo Capital Finance",https://x.com/uplandsoftware,http://www.linkedin.com/company/upland-software,1001-5000,"$240,000,000",2010
Advance Auto Parts,https://www.crunchbase.com/organization/advance-auto-parts,"Jul 28, 2025","$1,950,000,000",Not Started,"Automotive, Retail","Raleigh, North Carolina, United States","Advance Auto Parts is the largest automotive aftermarket parts provider in North America, serves both the professional installer.","57,710",https://shop.advanceautoparts.com/,$1B to $10B,—,—,https://x.com/aapdeals,http://www.linkedin.com/company/advance-auto-parts,10001+,"$1,950,000,000",1932
CEA Industries,https://www.crunchbase.com/organization/cea-industries,"Jul 28, 2025","$500,000,000",Not Started,"Agriculture, Commercial, Farming","Louisville, Colorado, United States",CEA Industries is an agriculture company that offers indoor cultivation services.,"57,884",https://ceaindustries.com/,$1M to $10M,"YZi Labs, Borderless Capital, Pantera Capital, Blockchain.com, dao5","10X Capital, YZi Labs",https://x.com/CeaIndustries,https://www.linkedin.com/company/ceaindustries,11-50,"$500,000,000",2009
Pahr Therapeutics,https://www.crunchbase.com/organization/pahr-therapeutics,"Jul 28, 2025","$14,000,000",Not Started,Clinical Trials,"Boston, Massachusetts, United States","Pahr Therapeutics is a clinical stage business, is to create innovative ways to treat pulmonary arterial hypertension.","58,848",https://www.pahrtx.com/,—,"RA Capital Management, UTEC - The University of Tokyo Edge Capital Partners, AN Ventures","AN Ventures, RA Capital Management, UTEC - The University of Tokyo Edge Capital Partners",,,—,"$14,000,000",2025
Secure Solar Futures,https://www.crunchbase.com/organization/secure-futures-solar,"Jul 28, 2025","$15,200,000",Not Started,"Energy, Renewable Energy, Solar","Staunton, Virginia, United States","Secure Solar Futures provides affordable rooftop solar to educational institutions, hospitals, businesses, and non-profit organizations.","63,350",https://securefutures.solar/,Less than $1M,Pardee Resources Company,Pardee Resources Company,https://x.com/secfuturesolar,https://www.linkedin.com/company/secure-futures/,11-50,"$15,200,000",2004
MMP Capital,https://www.crunchbase.com/organization/mmp-capital,"Jul 28, 2025","$212,000,000",Not Started,"Finance, Financial Services, Service Industry","Farmingdale, New York, United States","MMP Capital offers financial solutions to employees, customers, vendor partners, and banking partners.","63,551",https://www.mmpcapital.com/,$1M to $10M,—,—,,https://www.linkedin.com/company/mmpcapital/,51-100,"$192,000,000",2013
