Organization Name,CrunchBase URL,Last Funding Date,Total Funding Amount,Stage,Industries,Headquarters Location,Description,CB Rank (Company),Website,Estimated Revenue Range,Top 5 Investors,Lead Investors,Twitter,LinkedIn,Number of Employees,Last Funding Amount,Founded Date
Picnic,https://www.crunchbase.com/organization/picnic-vivid-robotics,"May 15, 2025","$57,182,518",Not Started,"Food Processing, Industrial Automation, Robotics, Software","Seattle, Washington, United States",Picnic is a developer of robotic food system designed to automate the pizza-making process.,"10,792",https://www.picnicworks.com/,$1M to $10M,"Alumni Ventures, Draper Associates, Branded Hospitality, Flying Fish Partners, Creative Ventures","Cercano Management, Creative Ventures, Draper Associates, Thursday Ventures, Vulcan Capital",https://x.com/picnicnews,https://www.linkedin.com/company/picnicnews,11-50,—,2016
XP,https://www.crunchbase.com/organization/xp-bac8,"May 15, 2025","$6,200,000",Not Started,"Blockchain, Marketplace, Web3","Chicago, Illinois, United States","XP is a blockchain-based ticket marketplace that allows users to buy, sell, and trade event tickets transparently.","12,306",https://xp.xyz/,—,"L1D, Reflexive Capital, Blockchange Ventures",Blockchange Ventures,https://x.com/xpticket,https://www.linkedin.com/company/xptix,11-50,"$6,200,000",2024
Solestial,https://www.crunchbase.com/organization/regher-solar,"May 15, 2025","$30,094,529",Not Started,"Aerospace, National Security, Renewable Energy, Solar, Space Travel","Tempe, Arizona, United States",Solestial exists to deliver abundant energy in space.,"12,697",https://solestial.com/,$1M to $10M,"Techstars, National Science Foundation, Global Brain Corporation, Silent Ventures, AE Industrial Partners","AE Industrial Partners, Airbus Ventures, Jackson Moses, NASA, National Science Foundation, Silent Ventures, Techstars",https://x.com/SolestialSpace,https://www.linkedin.com/company/solestial,11-50,"$17,000,000",2013
South East Water,https://www.crunchbase.com/organization/south-east-water-1d6a,"May 15, 2025","£275,000,000",Not Started,"Energy Management, Renewable Energy, Water Purification","Snodland, Kent, United Kingdom","South East Water specializes in drinking water supply, metering programs, payment support and drought planning services.","13,760",https://www.southeastwater.co.uk/,$100M to $500M,—,—,https://x.com/sewateruk,https://www.linkedin.com/company/southeastwater/,501-1000,"£200,000,000",1992
Antares Therapeutics,https://www.crunchbase.com/organization/antares-therapeutics-971a,"May 15, 2025","$177,000,000",Not Started,"Biopharma, Biotechnology, Ediscovery, Health Care, Life Science, Manufacturing, Therapeutics","Boston, Massachusetts, United States","Antares is a biotechnology company focused on developing transformational,medicines targeting validated cancer and other serious diseases.","14,931",https://antaresrx.com/,—,"Lightspeed Venture Partners, Cormorant Asset Management, Omega Funds, Vida Ventures, Abingworth","Atlas Venture, Biotechnology Value Fund, Cormorant Asset Management, Lightspeed Venture Partners, Omega Funds",,https://www.linkedin.com/company/antares-therapeutics,101-250,"$177,000,000",2025
Doji,https://www.crunchbase.com/organization/doji-4e54,"May 15, 2025","$14,000,000",Not Started,"Apps, Artificial Intelligence (AI), Fashion, Shopping","New York, New York, United States","Doji is an app to combine virtual clothing try-ons with social features, allowing users to experiment with fashion.","14,964",https://www.doji.com/,—,"Thrive Capital, Seven Seven Six, Brett Goldstein, Javaughn Lawrence, Joe WIlkinson",Thrive Capital,https://x.com/doji_com,https://www.linkedin.com/company/doji-com/,1-10,"$14,000,000",2025
GrowthX AI,https://www.crunchbase.com/organization/growthx-ai,"May 15, 2025","$12,000,000",Not Started,"Artificial Intelligence (AI), Marketing","San Francisco, California, United States",GrowthX built a sophisticated platform that combines content creation tools with flexible AI capabilities.,"14,973",https://growthx.ai/,—,Madrona,Madrona,,https://www.linkedin.com/company/growthx-ai,11-50,"$12,000,000",2024
Tern Travel,https://www.crunchbase.com/organization/tern-travel,"May 15, 2025","$16,819,997",Not Started,"Logistics, Travel","Dover, Delaware, United States",Tern Travel builds an integrated platform that connects the travel advisor to travelers and suppliers.,"16,136",https://www.tern.travel/,—,"Haystack, Upfront Ventures, Viewpoint Ventures","Haystack, Viewpoint Ventures",,https://www.linkedin.com/company/terntravelinc,1-10,"$13,000,000",2022
Reebelo,https://www.crunchbase.com/organization/reebelo,"May 15, 2025","$50,250,000",Not Started,"Consumer Goods, E-Commerce, Electronics, Marketplace, Mobile Devices","San Mateo, California, United States","Reebelo is a marketplace for refurbished electronics and lifestyle products, connecting buyers and sellers.","17,354",https://www.reebelo.com/,$1M to $10M,"Antler, Cathay Innovation, FJ Labs, KREAM Corporation, Magnetic Capital","Antler, Cathay Innovation, June Fund",https://x.com/reebelo_apac,https://www.linkedin.com/company/reebelo,101-250,—,Oct 2019
Compound Eye,https://www.crunchbase.com/organization/compound-eye,"May 15, 2025","$20,623,979",Not Started,"3D Technology, Artificial Intelligence (AI), Automotive, Autonomous Vehicles, Computer Vision, Geospatial, Machine Learning, Mapping Services, Robotics","Redwood City, California, United States",Compound Eye develops 3D vision systems for autonomous machines.,"17,648",http://www.compoundeye.com/,$1M to $10M,"Khosla Ventures, Two Sigma Ventures, K9 Ventures","K9 Ventures, Khosla Ventures",https://x.com/compoundeyeinc,https://www.linkedin.com/company/compound-eye/,11-50,"$12,765,513",Oct 2015
Toolpath,https://www.crunchbase.com/organization/toolpath,"May 15, 2025","$23,570,878",Not Started,"Developer Platform, Machine Learning, Manufacturing, Software Engineering","Bedford, Ohio, United States",Toolpath is a distributed machining platform that creates CNC machined parts to accelerate innovation from prototype to production.,"20,367",https://toolpath.com/,—,"Leaders Fund, Tech Square Ventures, Kennametal, BLH Venture Partners, Carl Bass","Kennametal, Leaders Fund",,https://www.linkedin.com/company/toolpath/,1-10,"$6,613,448",2021
Cartwheel,https://www.crunchbase.com/organization/cartwheel-1b21,"May 15, 2025","$15,600,000",Not Started,—,"New York, New York, United States",Cartwheel is a powerful text-to-animation platform.,"20,842",https://getcartwheel.com/,$1M to $10M,"Accel, Runway, Khosla Ventures, Craft Ventures, Human Ventures","Accel, Craft Ventures",,https://www.linkedin.com/company/getcartwheel/,1-10,"$10,000,000",2023
Infinitform Inc,https://www.crunchbase.com/organization/infinitform,"May 15, 2025","$12,700,000",Not Started,"Generative AI, Software","Los Angeles, California, United States","InfinitForm is an AI-powered design tool that optimizes CAD parts for real-world manufacturing—CNC, casting, molding, and additive.","25,030",https://infinitform.com/,—,"UP Partners, Yamaha Motor Ventures, Schematic Ventures, Counterpart Ventures, Carl Bass","Schematic Ventures, UP Partners",,https://www.linkedin.com/company/infinitform,1-10,"$12,700,000",2023
Atara Biotherapeutics,https://www.crunchbase.com/organization/atara-biotherapeutics,"May 15, 2025","$566,816,156",Not Started,"Biotechnology, Health Care, Oncology, Therapeutics","South San Francisco, California, United States","Atara Biotherapeutics (Nasdaq: ATRA) is an off-the-shelf, allogeneic T-cell immunotherapy company.","26,291",http://atarabio.com/,$100M to $500M,"Kleiner Perkins, Redmile Group, EcoR1 Capital, Domain Associates, Panacea Venture","Alexandria, Domain Associates, Redmile Group",https://x.com/Atarabio,https://www.linkedin.com/company/atarabio/,11-50,"$16,000,000",2012
Alpheus Medical,https://www.crunchbase.com/organization/alpheus-medical,"May 15, 2025","$82,000,000",Not Started,"Biotechnology, Health Care, Health Diagnostics, Medical","Oakdale, Pennsylvania, United States",Alpheus Medical provides a novel sonodynamic therapy platform targeting solid body cancers.,"27,672",https://www.alpheusmedical.com/,—,"Samsara BioCapital, SV Health Investors, OrbiMed, HealthQuest Capital, Action Potential Venture Capital","Action Potential Venture Capital, HealthQuest Capital, OrbiMed, Samsara BioCapital",,https://www.linkedin.com/company/alpheus-medical-inc/,1-10,"$52,000,000",2021
Solar Landscape,https://www.crunchbase.com/organization/solar-landscape,"May 15, 2025","$1,033,400,000",Not Started,"Clean Energy, Energy, Solar","Asbury Park, New Jersey, United States",Solar Landscape is an installer and operator of solar energy systems.,"34,275",https://www.solarlandscape.com/,—,"NJEDA, National Bank of Canada, Silicon Valley Bank, KeyBanc Capital Markets, PGIM Private Capital","KeyState, NJEDA, PGIM Private Capital, Silicon Valley Bank, U.S. Department of Energy Solar Energy Technologies Office",,https://www.linkedin.com/company/solarlandscape,251-500,"$175,000,000",2012
Kohl’s,https://www.crunchbase.com/organization/kohl-s,"May 15, 2025","$360,000,000",Not Started,"Retail, Shopping","Menomonee Falls, Wisconsin, United States","Kohl’s Corporation (Kohl’s) operate family-oriented department stores that sell apparel, footwear and accessories","39,856",https://corporate.kohls.com/,$10B+,—,—,https://x.com/kohls,https://www.linkedin.com/company/kohls-department-stores,10001+,"$360,000,000",1988
Eckard Enterprises,https://www.crunchbase.com/organization/eckard-enterprises-llc,"May 15, 2025","$43,518,616",Not Started,"Asset Management, Financial Services, Oil and Gas, Renewable Energy","Allen, Texas, United States","Eckard Enterprises is an asset management company that focuses on providing families access to diverse, alternative investments.","40,079",http://www.eckardenterprises.com/,Less than $1M,—,—,https://x.com/EckardNews,https://www.linkedin.com/company/eckard-enterprises,11-50,"$10,800,000",2012
Fitness Park,https://www.crunchbase.com/organization/fitness-park,"May 15, 2025","€280,000,000",Not Started,"Fitness, Health Care","Paris, Ile-de-France, France","Fitness Park is developing a network of franchised fitness clubs, under the ""low cost"" Fitness Park brand.","40,683",https://www.fitnesspark.fr/,—,"The Carlyle Group, M Capital Partners","M Capital Partners, The Carlyle Group",https://x.com/fitnesspark_?lang=en,https://www.linkedin.com/company/fitnesspark/,51-100,"€280,000,000",2012
Riverse,https://www.crunchbase.com/organization/riverse,"May 15, 2025","€6,500,000",Not Started,"Environmental Engineering, GreenTech, Manufacturing","Lyon, Rhone-Alpes, France",Riverse enables efficient and transparent carboncredit markets in Europe.,"41,987",https://www.riverse.io/,—,"Speedinvest, Techstars, Alven, K Fund, Racine2","Alven, Racine2, Speedinvest",,https://www.linkedin.com/company/riverse,11-50,"€5,000,000",2021
HOPE Therapeutics,https://www.crunchbase.com/organization/hope-therapeutics,"May 15, 2025","$10,300,000",Not Started,"Health Care, Medical, Mental Health","Wilmington, Delaware, United States",HOPE Therapeutics is a medical and technology driven company.,"43,205",https://hopetherapeutics.com/,$1M to $10M,—,—,https://x.com/HOPETherapeutx,https://www.linkedin.com/company/hopetherapeutics/,11-50,"$7,800,000",2024
Carroll Fulmer,https://www.crunchbase.com/organization/carroll-fulmer-logistics,"May 15, 2025","$27,000,000",Not Started,"Delivery Service, Logistics, Transportation","Groveland, Florida, United States",Carroll Fulmer is a full-time service provider for trucking services and logistics for the delivery sector.,"51,650",https://www.cfulmer.com/,—,Gordon Brothers,Gordon Brothers,https://x.com/CarrollFulmerBR,https://www.linkedin.com/company/carroll-fulmer-logistics,251-500,"$27,000,000",1954
Restoration Builders,https://www.crunchbase.com/organization/restoration-builders,"May 15, 2025","$19,407,301",Not Started,"Building Maintenance, Commercial, Construction","Phoenix, Arizona, United States",Restoration Builders is a residential and commercial contractor that provides construction and restoration services.,"52,387",https://restorbuilders.com/,$10M to $50M,—,—,https://x.com/restorbuilders,https://www.linkedin.com/company/restorationbuilders,101-250,"$1,935,000",2017
Eastern European Electric Company,https://www.crunchbase.com/organization/eastern-european-electric-company,"May 15, 2025","€500,000,000",Not Started,"Energy, Energy Management, Manufacturing","Amsterdam, Noord-Holland, The Netherlands",The Eastern European Electric Company B.V. (EEEC) is a major energy company.,"60,045",https://eeec-eu.com/,$1B to $10B,European Bank for Reconstruction and Development,—,,,1001-5000,"€500,000,000",2020
MoviePass,https://www.crunchbase.com/organization/moviepass,"May 15, 2025","$171,026,392",Not Started,"Apps, Location Based Services, Media and Entertainment, Subscription Service","New York, New York, United States",MoviePass is a subscription-based service that allows members to watch movies in theaters for a low monthly fee.,"62,630",https://www.moviepass.com/,$1M to $10M,"WME, True Ventures, Elevate Innovation Partners, The Global Emerging Markets Group, Otter Rock Capital","Chris Kelly, Forecast Labs, Structure Capital, The Global Emerging Markets Group",https://x.com/MoviePass,https://www.linkedin.com/company/moviepass-inc,1-10,"$100,000,000","Feb 1, 2011"
Prudential PLC,https://www.crunchbase.com/organization/prudential-plc,"May 15, 2025","SGD600,000,000",Not Started,"Asset Management, Finance, Financial Services, Insurance","London, England, United Kingdom","Prudential is an international financial services group with significant operations in Asia, the US and the UK.","68,832",https://www.prudentialplc.com/,$10B+,—,—,https://x.com/prudentialplc?lang=en,https://in.linkedin.com/company/prudential-plc,10001+,"SGD600,000,000",1848
Clearwell Capital,https://www.crunchbase.com/organization/clearwell-capital,"May 15, 2025","£250,000,000",Not Started,—,"London, England, United Kingdom",Clearwell Capital is a UK-based company.,"74,135",https://www.clearwellcapital.co.uk/,Less than $1M,"Fasanara Capital, HSBC Global Banking and Markets",HSBC Global Banking and Markets,,https://www.linkedin.com/company/clearwell-capital-limited,1-10,"£250,000,000",2010
Tüpraş,https://www.crunchbase.com/organization/t%C3%BCpra%C5%9F,"May 15, 2025","$500,000,000",Not Started,"Energy, Industrial, Oil and Gas","Körfez, Kocaeli, Turkey",Tüpraş is a refinery company that operates petroleum refineries.,"154,786",https://www.tupras.com.tr/,$10B+,—,—,https://x.com/tupras,https://www.linkedin.com/company/tupras/,1001-5000,"$500,000,000","Jan 1, 1983"
Ependion,https://www.crunchbase.com/organization/beijer-group,"May 15, 2025","SEK1,300,000,000",Not Started,"Electronics, Infrastructure, Manufacturing","Malmö, Skane Lan, Sweden","Ependion is a technology company that provides digital solutions for safe management, control, data visualization, and transmission.","164,998",https://www.ependion.com/en,$100M to $500M,"SEK, Danske Bank, Stena Adactum, Svolder, Nordea Funds AB","Danske Bank, SEK",,https://www.linkedin.com/company/ependion/,501-1000,"SEK300,000,000",1981
Climeon,https://www.crunchbase.com/organization/climeon,"May 15, 2025","$11,839,759",Not Started,"Energy, Environmental Consulting, Renewable Energy","Stockholm, Stockholms Lan, Sweden","Climeon is a clean-tech vendor that produces heat power systems, converting waste heat, and geothermal heat into clean electricity.","262,240",https://climeon.com/,$1M to $10M,"SEK, BloombergNEF, Acacia Asset Management, MP Pensjon, SEB Stiftelsen",BloombergNEF,https://x.com/climeon?lang=en,https://www.linkedin.com/company/climeon-ab/,51-100,"SEK30,000,000",2011
TensorWave,https://www.crunchbase.com/organization/tensorwave,"May 14, 2025","$146,713,300",Not Started,"AI Infrastructure, Artificial Intelligence (AI), Cloud Computing, Cloud Infrastructure, Generative AI, IaaS","Las Vegas, Nevada, United States",TensorWave is an AMD GPU exclusive Cloud that supports training and inference at scale,"1,216",https://tensorwave.com/,$100M to $500M,"Nexus Venture Partners, Maverick Silicon, AMD, Translink Capital, Prosperity7 Ventures","AMD Ventures, FundNV, Magnetar Capital, Nexus Venture Partners",https://x.com/TensorWaveCloud,https://www.linkedin.com/company/tensorwave,51-100,"$100,000,000",Dec 2023
SIX,https://www.crunchbase.com/organization/six-group,"May 14, 2025","CHF250,000,000",Not Started,"Banking, Finance, Financial Exchanges, Financial Services, Payments, Security, Stock Exchanges","Zürich, Zurich, Switzerland","SIX is a financial service company that offers securities, banking, financial information services to clients in the financial market.","2,667",http://www.six-group.com/,$1B to $10B,—,—,https://x.com/sixgroup,https://www.linkedin.com/company/sixgroup,1001-5000,"CHF250,000,000",2008
Granola,https://www.crunchbase.com/organization/granola,"May 14, 2025","$67,250,000",Not Started,"Artificial Intelligence (AI), Meeting Software, SaaS, Software","London, England, United Kingdom","Granola is an AI notepad that transcribes and summarizes meetings from your device, helping users stay organized without joining calls.","2,756",https://www.granola.ai/,—,"Lightspeed Venture Partners, Spark Capital, Betaworks, Firstminute Capital, NFDG Ventures","Lightspeed Venture Partners, NFDG Ventures, Spark Capital",https://x.com/meetgranola,https://www.linkedin.com/company/meetgranola,11-50,"$43,000,000",Mar 2023
Space Forge,https://www.crunchbase.com/organization/space-forge,"May 14, 2025","$50,937,134",Not Started,"Hardware, Manufacturing, Robotics, Semiconductor","Cardiff, Cardiff, United Kingdom",Space Forge develops reusable satellites for manufacturing materials in space.,"2,842",https://www.spaceforge.com/,$10M to $50M,"Gaingels, British Business Bank, Stellar Development Foundation, FJ Labs, Development Bank of Wales","Intel Ignite, NATO Innovation Fund, SpaceFund, Type One Ventures, UK Space Agency, World Fund",https://x.com/Space_Forge,https://www.linkedin.com/company/space-forge-ltd,51-100,"£22,600,000",2018
Arkestro,https://www.crunchbase.com/organization/bid-ops,"May 14, 2025","$63,950,000",Not Started,"Analytics, Predictive Analytics, Procurement, Productivity Tools, Software","San Francisco, California, United States","Arkestro is a predictive procurement platform that utilizes AI, behavioral science, and machine learning to enhance procurement processes.","2,905",https://arkestro.com/,Less than $1M,"Plug and Play, Aramco Ventures, Construct Capital, New Enterprise Associates, Correlation Ventures","Altira Group, Aramco Ventures, Cervin Ventures, Construct Capital, Four More Capital, Illuminate Ventures, Koch Disruptive Technologies, New Enterprise Associates, Tech Wildcatters",https://x.com/Arkestro,https://www.linkedin.com/company/arkestro,101-250,"$36,000,000",2017
Openlayer,https://www.crunchbase.com/organization/unbox-3db0,"May 14, 2025","$19,500,000",Not Started,"Artificial Intelligence (AI), Developer Tools, Information Technology, Machine Learning, Quality Assurance, Software","San Francisco, California, United States","Openlayer is an analysis platform that ""opens up"" machine learning models by detecting and eliminating failure patterns and biases.","2,947",https://openlayer.com/,$1M to $10M,"Gaingels, Y Combinator, Quiet Capital, MANTIS Venture Capital, Liquid 2 Ventures","Quiet Capital, Race Capital",https://x.com/openlayerco,https://www.linkedin.com/company/openlayerco,1-10,"$14,500,000","May 3, 2021"
MUBI,https://www.crunchbase.com/organization/mubi,"May 14, 2025","$102,402,000",Not Started,"Digital Entertainment, Film, Film Distribution, Film Production, Video, Video Streaming","London, England, United Kingdom","MUBI is a global streaming service, production company and film distributor.","3,210",http://mubi.com/,—,"Sequoia Capital, C4 Ventures, MMC Ventures, Summit Partners, Georges Harik","Closer Media, Eduardo Costantini, Sequoia Capital, Summit Partners",https://x.com/mubi,http://www.linkedin.com/company/mubi,251-500,"$100,000,000","Feb 14, 2007"
ElastixAI,https://www.crunchbase.com/organization/elastixai,"May 14, 2025","$18,000,000",Not Started,"Artificial Intelligence (AI), Generative AI, Machine Learning","Seattle, Washington, United States",ElastixAI is developing an AI inference platform designed to optimize how large language models are run.,"3,365",https://www.elastix.ai/,—,"Liquid 2 Ventures, DNX Ventures, FUSE, Catapult Ventures, Tyche Partners",FUSE,,https://www.linkedin.com/company/elastixai/,11-50,"$18,000,000",2025
Akamai Technologies,https://www.crunchbase.com/organization/akamai-technologies,"May 14, 2025","$2,635,000,000",Not Started,"Cyber Security, Digital Media, SaaS, Software, Video Streaming","Cambridge, Massachusetts, United States","Akamai is a provider of cloud services that help enterprises provide secure, high-performing user experiences on any device.","4,137",https://www.akamai.com/,$1B to $10B,"IVP, Battery Ventures, Polaris Partners, The TCW Group, Baker Capital",IVP,https://x.com/Akamai,http://www.linkedin.com/company/akamai-technologies,10001+,"$1,500,000,000","Aug 1, 1998"
Reflect Orbital,https://www.crunchbase.com/organization/reflect-orbital,"May 14, 2025","$28,700,000",Not Started,"Aerospace, Energy, Manufacturing, Renewable Energy","Hawthorne, California, United States",Reflect Orbital is a solar company that offers solar powered tech and products.,"4,898",https://www.reflectorbital.com/,—,"Sequoia Capital, Lux Capital, Starship Ventures, Climate Capital, Kevin Hartz","Lux Capital, Sequoia Capital, Starship Ventures",https://x.com/reflectorbital?lang=en,https://www.linkedin.com/company/reflectorbital,1-10,"$20,000,000",2021
Layer AI,https://www.crunchbase.com/organization/layer-e061,"May 14, 2025","$18,300,000",Not Started,"Artificial Intelligence (AI), Gaming, Generative AI, Machine Learning, Video","San Francisco, California, United States","Layer AI offers a generative AI platform to assist game developers in creating 2D, 3D, and video assets.","7,091",https://layer.ai/,$1M to $10M,"e2vc, FJ Labs, Hummingbird Ventures, The Games Fund, 500 Emerging Europe","Arcadia Funds, Hummingbird Ventures",https://x.com/layer_ai,https://linkedin.com/company/layerai,1-10,"$6,500,000",2022
Blank Street,https://www.crunchbase.com/organization/blank-street,"May 14, 2025","$134,824,300",Not Started,"Coffee, Food and Beverage, Hospitality, Restaurants","Brooklyn, New York, United States","Blank Street is a coffee chain that offers coffee as a daily ritual that more people can enjoy, in places convenient to their lives.","7,467",https://www.blankstreet.com/,$10M to $50M,"General Catalyst, Tiger Global Management, Base10 Partners, Left Lane Capital, HOF Capital","General Catalyst, Tiger Global Management",https://x.com/blankstreet?lang=en,https://www.linkedin.com/company/blank-street/,251-500,"$20,999,960",2020
Dazos,https://www.crunchbase.com/organization/dazos,"May 14, 2025","$25,000,000",Not Started,"CRM, Health Care, Mental Health, Software","Boca Raton, Florida, United States",Dazos is a software and technology company that provides solutions for behavioral and mental health treatment.,"7,894",https://dazos.com/,—,Radian Capital,Radian Capital,https://x.com/dazoshealth,https://www.linkedin.com/company/dazoshealth/,11-50,"$25,000,000",2018
Slide Insurance,https://www.crunchbase.com/organization/slide-insurance,"May 14, 2025","$770,000,000",Not Started,"Artificial Intelligence (AI), Financial Services, Insurance, InsurTech, Property Insurance","Tampa, Florida, United States",SlideCompany is a technology-enabled insurance provider that uses AI and big data to deliver home insurance coverage to consumers.,"8,986",https://www.slideinsurance.com/,$500M to $1B,"Regions Bank, TampaBay.Ventures, Gries Investment Funds","Gries Investment Funds, Regions Bank, TampaBay.Ventures",,https://www.linkedin.com/company/slideinsurance,251-500,"$250,000,000",2021
Flock Freight,https://www.crunchbase.com/organization/flock-freight,"May 14, 2025","$459,000,000",Not Started,"Freight Service, Logistics, Shipping, Software, Transportation","Encinitas, California, United States",Flock Freight is a freight technology company that provides freight brokerage and transportation services through shared truckload shipping.,"9,400",https://www.flockfreight.com/,$500M to $1B,"Foundation Capital, SoftBank Vision Fund, Alphabet, SignalFire, Google Ventures","GLP Capital Partners, Google Ventures, O'Neil Strategic Capital, SignalFire, SoftBank Vision Fund",https://x.com/flockfreight,https://www.linkedin.com/company/flock-freight,251-500,"$60,000,000",Feb 2015
TurbineOne,https://www.crunchbase.com/organization/turbineone,"May 14, 2025","$54,000,000",Not Started,"Public Safety, Security","San Francisco, California, United States",TurbineOne is the frontline perception company.,"10,362",https://turbineone.com/,$1M to $10M,"Bessemer Venture Partners, StepStone Group, XYZ Venture Capital, The General Partnership, Artisanal Ventures","Bessemer Venture Partners, The General Partnership, XYZ Venture Capital",,https://www.linkedin.com/company/turbineone/,11-50,"$36,000,000",2021
